username;date;retweets;favorites;text;geo;mentions;hashtags;id;permalink
;2010-04-14 08:23;0;0;"Brandon Marshall to dolphins....idk how i feel about this";;;;"12162821837";https://twitter.com/DiffendAlex/status/12162821837
;2010-04-14 08:22;0;0;"http://bit.ly/d8B6L2 No matter where Brandon Marshall ends up, I";;;;"12162766508";https://twitter.com/LakerKingdom/status/12162766508
;2010-04-14 08:22;0;0;"RT @so_precious06 So Brandon Marshall to the # Dolphins.... That's L I V E.. Goodmorning btw people..<< U SEE IT NOW>U FUNNY BUDDY";;@so_precious06;#;"12162762349";https://twitter.com/CHEVIBOI_GMASH/status/12162762349
;2010-04-14 08:22;0;0;"I like this Brandon Marshall guy...I'm pretty sure he knows when to smack a ho like your boy Tiger Woods...report that shit Jim Nantz!";;;;"12162747723";https://twitter.com/FauxTigerWoods/status/12162747723
;2010-04-14 08:21;0;0;"Oh yea I'm waiting for all yall fucking haters this year....Dolphins got Brandon Marshall on deck now the AFC gotta see us DATT!!!!!!";;;;"12162703593";https://twitter.com/Manny_lpmg/status/12162703593
;2010-04-14 08:20;0;0;"I told u! Lolol RT @ TheSportsBros: At it already huh? RT @ Skraw_Berry: Hey y'all do Brandon Marshall have a Twitter";;@ @;;"12162650370";https://twitter.com/EmpressTaTa/status/12162650370
;2010-04-14 08:20;0;0;"I'm so mad about this brandon marshall trade! Man what are you doing to my life long team mcdanials? Do you want to win???";;;;"12162650174";https://twitter.com/dangeruss49/status/12162650174
;2010-04-14 08:19;0;0;"RT @ metsfanmurph: Brandon Marshall + South Beach = Felony by Thanksgiving. I totally agree";;@;;"12162590242";https://twitter.com/DJRussty21/status/12162590242
;2010-04-14 08:18;0;0;"Brandon Marshall to the Dolphins. I know who my team on Madden will be! Who's going to be on the Broncos tix though, Moreno?";;;;"12162587044";https://twitter.com/BangemSouth/status/12162587044
;2010-04-14 08:18;0;0;"N people wonder why I'm not a fucking TITIANS fan, why the fuck didn't yall get Brandon Marshall, well yall better get T.O. Or Miles Austin";;;;"12162582107";https://twitter.com/423_MONEYMARC/status/12162582107
;2010-04-14 08:18;0;0;"LMFAO! I hope he does! ;) RT @INTENSEDENSE: The Dolphins got Brandon Marshall ! I hope he doesn't do hood rat things with Ricky Williams";;@INTENSEDENSE;;"12162553271";https://twitter.com/MissErikaEsco/status/12162553271
;2010-04-14 08:18;0;0;"UCF's greatest WR Brandon Marshall headed home to play with the Dolphins? This is the best news I've heard in a long time.";;;;"12162550902";https://twitter.com/JustinStowell/status/12162550902
;2010-04-14 08:17;0;0;"And people wonder why I'm not a fucking TITIANS, why the fuck didn't yall get Brandon Marshall, well yall better get T.O. Or Miles Austin";;;;"12162524200";https://twitter.com/423_MONEYMARC/status/12162524200
;2010-04-14 08:17;0;0;"WOW!!!!! Brandon Marshall is a Dolphin now! They definitely could use some help on the WR core. I guess "MONEY TALKS"!";;;;"12162520201";https://twitter.com/CheetahCheeks/status/12162520201
;2010-04-14 08:16;0;0;"WHAT THE FUCK!?!? i got to sleep and wait up and FIND OUT that BRANDON MARSHALL IS TRADED TO THE DOLPHINS!?!?!?";;;;"12162474037";https://twitter.com/The_Black_Amigo/status/12162474037
;2010-04-14 08:16;0;0;"Brandon Marshall gettin trade to Mismi for a 2nd round pick this year and next year. I wonder for how much lol # notlikeIcouldaffordit";;;#;"12162459799";https://twitter.com/Certified_nut/status/12162459799
;2010-04-14 08:15;0;0;"I'll be interested to see if Chad Henne is ALSO accused of "forcing the ball" to Brandon Marshall. # Broncos # Dolphins";;;# #;"12162413904";https://twitter.com/ch0nny/status/12162413904
;2010-04-14 08:15;0;0;"Brandon Marshall 2 da Dolphins Huh smh outta all teams lol this nigga NICK happy I already kno";;;;"12162411137";https://twitter.com/YooZay/status/12162411137
;2010-04-14 08:14;0;0;"If that's your answer for the 'are you worried about Brandon Marshall' question, I agree RT @ garyvee Revis";;@;;"12162392742";https://twitter.com/Andrew_Garda/status/12162392742
;2010-04-14 08:14;0;0;"RT @mRswa99nific3nt: I am no longer a Brandon Marshall fan...«-gtfoh";;@mRswa99nific3nt;;"12162382273";https://twitter.com/_God1st/status/12162382273
;2010-04-14 08:13;0;0;"i bet sam bradford was praying that the rams would have made a play for brandon marshall. sadly, he still has no weapons other than SJ39.";;;;"12162339958";https://twitter.com/revchris_c/status/12162339958
;2010-04-14 08:12;0;0;"Great for MIA, what did Denver get? RT @ raczilla: Brandon Marshall to the Dolphins? I like it. What do you think?";;@;;"12162300039";https://twitter.com/bigguyadocious/status/12162300039
;2010-04-14 08:12;0;0;"@ Dolphins_Fans now THAT"S what i'm talking about. welcome to miami, brandon marshall. http://bit.ly/bZ6GzI # dolphins # nfl # brandonmarshall";;@;# # #;"12162297831";https://twitter.com/PGSportsFan/status/12162297831
;2010-04-14 08:10;0;0;"Brandon Marshall to the Dolphins... Suddenly like that offense after what I saw from Henne last year and Brown coming back";;;;"12162198772";https://twitter.com/BTRowland/status/12162198772
;2010-04-14 08:10;0;0;"Where have I been Brandon Marshall to the Dolphins... Patriots aint running they division no more. That is all.";;;;"12162194063";https://twitter.com/JustPolitickin_/status/12162194063
;2010-04-14 08:10;0;0;"Brandon Marshall to Miami great pickup. I expect Tedd Gin to have a break out year! http://myloc.me/5ZZNR";;;;"12162186360";https://twitter.com/RedCupShawty100/status/12162186360
;2010-04-14 08:10;0;0;"Good morning world! I love waking up to Brandon Marshall being a Dolphin because it has no effect on me. How are ya'll today?";;;;"12162168406";https://twitter.com/ShadowLord143/status/12162168406
;2010-04-14 08:09;0;0;"Damn.. so the Dolphins got Brandon Marshall huh.. I guess jets ain't the only squad making moves lol";;;;"12162150011";https://twitter.com/eric_crocker/status/12162150011
;2010-04-14 08:09;0;0;"RT @ThatDudeSwiftDamn, brandon marshall is going from cold ass denver to warm ass miami. I can't wait for the new madden lol";;@ThatDudeSwiftDamn;;"12162124569";https://twitter.com/MaddenSports/status/12162124569
;2010-04-14 08:08;0;0;"Damn, brandon marshall is going from cold ass denver to warm ass miami. I can't wait for the new madden lol";;;;"12162082191";https://twitter.com/TheBigSchlep/status/12162082191
;2010-04-14 08:07;0;0;"RT @ VicLombardi: Wow...just woke up to "Brandon Marshall traded to Miami for a pair of second round picks". I'm sure he's stoked...";;@;;"12162073996";https://twitter.com/tllawrence/status/12162073996
;2010-04-14 08:07;0;0;"Brandon Marshall is gonna ruin himself in Miami… and I aint talkin about on the field. # oceandrive";;;#;"12162066133";https://twitter.com/3CarryOnItems/status/12162066133
;2010-04-14 08:07;0;0;"I WAKE UP THIS MORNING TO BRANDON MARSHALL BEING A DOLPHINS CULD NOT BE IN A BETTER MOOD";;;;"12162062025";https://twitter.com/Daniel_Eliesen/status/12162062025
;2010-04-14 08:07;0;0;";( I wantd da redskins to get brandon marshall SMH";;;;"12162044362";https://twitter.com/Freakwency901/status/12162044362
;2010-04-14 08:06;0;0;"Sources: Broncos trade WR Marshall to Dolphins: Mercurial Broncos wide receiver Brandon Marshall i... http://bit.ly/94hgkh Super Bowl Miami";;;;"12161986899";https://twitter.com/Super_Bowl_Dall/status/12161986899
;2010-04-14 08:05;0;0;"Wow, wake up and 1st thing I see is that the Broncos trade Brandon Marshall 2 Dolphins...AFC east gettin stronger but I know my Pats watchin";;;;"12161981607";https://twitter.com/HitchIsANoun/status/12161981607
;2010-04-14 08:05;0;0;"I LOVE WEDNESDAYS! GOD BLESS BRANDON MARSHALL!!!";;;;"12161978975";https://twitter.com/jonamo22/status/12161978975
;2010-04-14 08:05;0;0;"Is it bad I woke up to a txt that said Brandon Marshall and immediatly assumed he was a Redskin, in my mind I was already halfway to Ashburn";;;;"12161963891";https://twitter.com/Mitch_Tischler/status/12161963891
;2010-04-14 08:04;0;0;"I see your santonio holmes and give u a Brandon marshall. BRANDON Fing MARSHALL woooooooo :pots and pans clanking:";;;;"12161907972";https://twitter.com/iamoris/status/12161907972
;2010-04-14 08:04;0;0;"@ kickzqueen1 yall got Brandon Marshall but who gonna throw him the ball? Ohhhhhh Ronnie Brown I forgot haha!";;@;;"12161902821";https://twitter.com/LarryOBannon/status/12161902821
;2010-04-14 08:03;0;0;"RT @ worldofbr: Then I come home to see the broncos traded brandon marshall to the Dolphins...damn yin and yang- damn right. Lol";;@;;"12161852175";https://twitter.com/BOBBYO_US/status/12161852175
;2010-04-14 08:02;0;0;"I'm sorry, but you can't send BRANDON MARSHALL to MIAMI!!! If he was wylin in Denver..... /via @ PrideOfLR ----EXACTLY!";;@;;"12161802799";https://twitter.com/raphaeldsmith/status/12161802799
;2010-04-14 08:01;0;0;"I think they're trying to turn the afc east into the nfc east haha RT @ Sabby33g11: Wow Brandon Marshall to the Dolphins";;@;;"12161789692";https://twitter.com/Jubrey_with_a_B/status/12161789692
;2010-04-14 08:01;0;0;"RT @Mocha2Badd: @FS_yrbteezy lmaooo I just told him! He mad cus I won't let him go back to sleep! He said "tell Brandon Marshall... lol";;@Mocha2Badd @FS_yrbteezy;;"12161781345";https://twitter.com/_yrbteezy/status/12161781345
;2010-04-14 08:01;0;0;"I'm not sure that Brandon Marshall + South Beach nightlife is a good combination. Sort of like Pacman + Vegas.";;;;"12161754017";https://twitter.com/GeorgeSisneros/status/12161754017
;2010-04-14 08:01;0;0;"Denver WR Brandon Marshall traded to Miami for two second-round picks. I was hoping the Seahawks could make a deal. guess not. # Seahawks";;;#;"12161747965";https://twitter.com/furthurmoe/status/12161747965
;2010-04-14 08:00;1;0;"Brandon Marshall was traded to the Miami Dolphins today. What do you think? I want to see your comments... http://bit.ly/bZxPbU";;;;"12161723615";https://twitter.com/TeamDaveLogan/status/12161723615
;2010-04-14 07:59;0;0;"I need to find Brandon Marshall. I wanna be the first bitch to say "HI" lol";;;;"12161652635";https://twitter.com/Skraw_Berry/status/12161652635
;2010-04-14 07:58;0;0;"I wish @ OGOchoCinco was coming to miami but ill take brandon marshall. Welcome to south beachh http://myloc.me/5ZXYU";;@;;"12161627595";https://twitter.com/21_Makoto/status/12161627595
;2010-04-14 07:58;0;0;"Brandon Marshall to Miami WTF is goin on in football this off season, shits goin crazy right now. I think were in for 1 crazy ass season";;;;"12161626861";https://twitter.com/Seoulsouthside/status/12161626861
;2010-04-14 07:58;0;0;"Brandon Marshall may I officially welcome to the MIAMI DOLPHINS!";;;;"12161625877";https://twitter.com/RichieRaya/status/12161625877
;2010-04-14 07:58;0;0;"Brandon marshall to the dolphins DAMN I wanted him in a # redskin uniform # ohwell";;;# #;"12161623227";https://twitter.com/dutchdutchess82/status/12161623227
;2010-04-14 07:57;0;0;"If I see one more nfl team make a move imma go nuttts!!!!!! Dolphins got brandon marshall fuck!!! Come on G-men!";;;;"12161598292";https://twitter.com/MrCarterpG3/status/12161598292
;2010-04-14 07:57;0;0;"Wow Brandon Marshall and @ TEDGINN19 I wanna be the first 2 say watch out patriots somebody coming 4 that division...";;@;;"12161593025";https://twitter.com/Truce_Bigelow/status/12161593025
;2010-04-14 07:57;0;0;"Lol RT @ xl950: - I'm not sure that Brandon Marshall + South Beach nightlife is a good combination. Sort of like Pacman + Vegas.";;@;;"12161590701";https://twitter.com/Nati_Ave/status/12161590701
;2010-04-14 07:57;0;0;"@D_Stallworth18 what u think about the brandon marshall trade ...I don't think I like it though I kinda wanted him to go somewhere else???";;@D_Stallworth18;;"12161577558";https://twitter.com/AngelllFace/status/12161577558
;2010-04-14 07:57;0;0;"RT @so_precious06: Omg I'm ready for football season... # TOMBOYTWEET>WE GETTIN BRANDON MARSHALL HOMIE";;@so_precious06;#;"12161575944";https://twitter.com/CHEVIBOI_GMASH/status/12161575944
;2010-04-14 07:56;0;0;"All of South Florida loves it! Finally a STUD wr! RT @ raczilla Brandon Marshall to the Dolphins? I like it. What do you think?";;@;;"12161555035";https://twitter.com/JoseBoza/status/12161555035
;2010-04-14 07:55;0;0;"Why the FUCK did we trade Brandon Marshall to the Dolphins for a 2nd round pick WHAT THE FUCKIN FUCK! FUCK THE BRONCOS I'M DONE # NYJETS";;;#;"12161501766";https://twitter.com/winninNsinnin/status/12161501766
;2010-04-14 07:54;0;0;"I wonder why Parcells will deal with Brandon Marshall but was so anti T. Owens in Dallas";;;;"12161464504";https://twitter.com/devinlawson/status/12161464504
;2010-04-14 07:54;0;0;"# Lifeisgoodwhen I understand all the TT. Wth is Brandon Marshall?";;;#;"12161434948";https://twitter.com/bethsugarblur/status/12161434948
;2010-04-14 07:53;0;0;"Sure Brandon Marshall looks good going to Miami on paper but I know that once he hits South Beach, he's in trouble and so are the fins :)";;;;"12161410317";https://twitter.com/_jcruiz_/status/12161410317
;2010-04-14 07:53;0;0;"Brandon Marshall to Miami...I was hoping he would goto the # redskins. Oh well, we can't get everyone I supposes.";;;#;"12161410076";https://twitter.com/JessRunsATL/status/12161410076
;2010-04-14 07:53;0;0;"I'm just relieved that Brandon Marshall is a trending topic on Twitter and it's not for strangling someone";;;;"12161409909";https://twitter.com/notGeorgeOleary/status/12161409909
;2010-04-14 07:52;0;0;"I'm not too upset about the Broncos trading WR Brandon Marshall. That dude singlehandely killed the Chiefs. He's unstoppable!";;;;"12161373414";https://twitter.com/ictsey/status/12161373414
;2010-04-14 07:52;0;0;"so i wake up this morning and see that Brandon Marshall got traded to the dolphins! for 2 nd round picks this year and next year!!!";;;;"12161372082";https://twitter.com/officiallyrory/status/12161372082
;2010-04-14 07:51;0;0;"What did I tell you! ... @ Adam_Schefter now reporting that Brandon Marshall is being traded to Dolphins later today. /via @ mortreport";;@ @;;"12161326834";https://twitter.com/pwallen/status/12161326834
;2010-04-14 07:50;0;0;"RT @ iAmYungB: Damn Brandon Marshall traded to Miami... i was hoping he went to a better team.. he went from a (cont) http://tl.gd/s44f3";;@;;"12161268354";https://twitter.com/M1k3_J/status/12161268354
;2010-04-14 07:49;0;0;"Lord, what did I do to wake up to news that my Dolphins got Brandon Marshall? # GoGod # MiamiDolphins";;;# #;"12161228257";https://twitter.com/CheerwinePapi/status/12161228257
;2010-04-14 07:47;0;0;"Brandon Marshall to the Dolphins? I like it. What do you think?";;;;"12161152057";https://twitter.com/raczilla/status/12161152057
;2010-04-14 07:47;0;0;"Before the 2009 NFL season I traded Larry Fitzgerald and Brandon Marshall for AP. Everyone thought I was nuts....but I knew some things";;;;"12161132029";https://twitter.com/LawrenceAMarino/status/12161132029
;2010-04-14 07:47;0;0;"Then I come home to see the broncos traded brandon marshall to the Dolphins...damn yin and yang";;;;"12161130744";https://twitter.com/worldofbr/status/12161130744
;2010-04-14 07:47;0;0;"broncos trade brandon marshall to the dolphins. I guess thats good for the dolphins.";;;;"12161123793";https://twitter.com/callonjustinf/status/12161123793
;2010-04-14 07:47;0;0;"i thought it was seattle :) @ PackersLounge: RT Hmm. Brandon Marshall to the Fins. I thought for sure he was coming here. # sarcasm";;@;#;"12161117262";https://twitter.com/jrehor/status/12161117262
;2010-04-14 07:46;0;0;"ESPN's Adam Schefter reports Brandon Marshall has been traded to the Miami Dolphins for two high draft picks. I don't like that one bit!";;;;"12161089386";https://twitter.com/DeHuff/status/12161089386
;2010-04-14 07:46;0;0;"@ PostBroncos I Hope Brandon Marshall gets arrested or does something dumb :'( can't believe he ditched us Fans";;@;;"12161081330";https://twitter.com/Chaoticblaze27/status/12161081330
;2010-04-14 07:45;0;0;"I am glad that the dolphins acquired brandon marshall.";;;;"12161068306";https://twitter.com/djej1/status/12161068306
;2010-04-14 07:45;0;0;"I wanna thank the dolphins new defensive coach Mike Nolan for cosigning on wr Brandon Marshall";;;;"12161048229";https://twitter.com/jpsonic/status/12161048229
;2010-04-14 07:45;0;0;"Great. What am I supposed to do with my #15 jersey now? RT @ PostBroncos: Per ESPN: Brandon Marshall to Miami for 2 second-round picks.";;@;#15;"12161044989";https://twitter.com/Goodman933/status/12161044989
;2010-04-14 07:44;0;0;"Damn..I wanted the 'Skins to get Brandon Marshall..";;;;"12161007884";https://twitter.com/AddyBarnes/status/12161007884
;2010-04-14 07:42;0;0;"I told you @ AmazingJayce LOL!! RT @ Mikec6417: BRANDON MARSHALL !!!!!!";;@ @;;"12160909460";https://twitter.com/KrayzieK3/status/12160909460
;2010-04-14 07:42;0;0;"NO TED GINN RT @ Redskins19and0 Brandon Marshall traded to Dolphins, I wonder if they'll try to move Ginn, love to have him as a returner";;@;;"12160908144";https://twitter.com/daddylive9/status/12160908144
;2010-04-14 07:42;0;0;"Brandon Marshall to the dolphins.. I wish they had a legit QB..";;;;"12160900162";https://twitter.com/MaximumCortez/status/12160900162
;2010-04-14 07:41;0;0;"Morning!!! Interview this morning!! I step out the shower and what do I read via everybody!! BRANDON MARSHALL a MIAMI DOLPHIN!!!! =)";;;;"12160886898";https://twitter.com/iRUNtheseTWEETz/status/12160886898
;2010-04-14 07:41;0;0;"They just traded brandon marshall to the miami dolphins that's my new team but I still like the broncos";;;;"12160885323";https://twitter.com/charlessparkly/status/12160885323
;2010-04-14 07:41;0;0;"I love waking up to nine text msgs saying Brandon Marshall is a Miami Dolphin!!!!!! TTT Trust the Tuna";;;;"12160882831";https://twitter.com/GinoM1121/status/12160882831
;2010-04-14 07:41;0;0;"RT @ NESN: Report: Broncos Trading Wide Receiver Brandon Marshall to Dolphins http://bit.ly/dqqYl1 --Damn I wanted the PATS to sign him";;@;;"12160876736";https://twitter.com/jdooleyiv/status/12160876736
;2010-04-14 07:41;0;0;"RT @ DVanDyke8: Brandon marshall a dolphin!! • @ FreezBlackHeart how you feel about that?! I'm about to go & buy you a jersey!!!!! # YRB";;@ @;#;"12160865418";https://twitter.com/BRiANNAtheYRB/status/12160865418
;2010-04-14 07:39;0;0;"personally, i think brandon marshall is worth a tad more than a 2nd round pick. that's just me tho. denver better pick wisely.";;;;"12160792915";https://twitter.com/bigboxchvy/status/12160792915
;2010-04-14 07:39;0;0;"Most of you probably don't care, but I am proper chuffed that the # Dolphins have signed Brandon Marshall. At last, a man who can catch! # NFL";;;# #;"12160778554";https://twitter.com/cg__/status/12160778554
;2010-04-14 07:38;0;0;"I'd like to take this opportunity to thank Brandon Marshall for all the great Fantasy Football memories - He's dead to me now # SquishTheFish";;;#;"12160764692";https://twitter.com/RealMagDoubleO/status/12160764692
;2010-04-14 07:38;0;0;"So Brandon Marshall was traded to the Dolphins, I wonder if they'll try to move Ginn, I would love to have him as a returner at least # skins";;;#;"12160742507";https://twitter.com/Redskins19and0/status/12160742507
;2010-04-14 07:37;0;0;"I ain't cry in years but when I found out the Dolphins got Brandon Marshall I couldn't have it....no homo";;;;"12160690557";https://twitter.com/Dmw_D_Redd/status/12160690557
;2010-04-14 07:37;0;0;"@Swagdout4lfe I'd be doing a lot better if Brandon Marshall wasn't traded to the # Dolphins";;@Swagdout4lfe;#;"12160687522";https://twitter.com/WAD1980/status/12160687522
;2010-04-14 07:37;0;0;"Brandon Marshall of the # broncos to the # dolphins I love it finally filling a need no gambling on Dez Bryant";;;# #;"12160686027";https://twitter.com/xstortion/status/12160686027
;2010-04-14 07:36;0;0;"I was at UCF when Brandon Marshall was there. I knew then he was going to be a Beast because of his size & hands. Welcome back to FL # BMarsh";;;#;"12160685149";https://twitter.com/HeatMerc/status/12160685149
;2010-04-14 07:36;1;0;"I'm sorry, but you can't send BRANDON MARSHALL to MIAMI!!! If he was wylin in Denver.....";;;;"12160666362";https://twitter.com/PrideOfLR/status/12160666362
;2010-04-14 07:36;0;0;"RT @ gregk31: Dolphins get Brandon Marshall. Impressive pickup. Hope dude doesn't get I'm stoopid, dumb trouble on South Beach tho.";;@;;"12160644460";https://twitter.com/daniellealexisb/status/12160644460
;2010-04-14 07:35;0;0;"@ Lorenzo21 I think moss and wayne and andre johnson are better receives than brandon marshall and revis shut em all down";;@;;"12160638949";https://twitter.com/MrCanuck78/status/12160638949
;2010-04-14 07:34;0;0;"Wow. The Dolphins got Brandon Marshall. I like this offseason";;;;"12160599078";https://twitter.com/DiabolicalGrin/status/12160599078
;2010-04-14 07:34;0;0;"GAH STUPID MIAMI!!! I WANTED # BRANDON MARSHALL TO THE # SEAHAWKS!!!";;;# #;"12160589498";https://twitter.com/Johnbhan/status/12160589498
;2010-04-14 07:34;0;0;"@ bhempstead haha... Brandon marshall still needs a quarterback... I don't think Ronnie brown can handle the duties";;@;;"12160579777";https://twitter.com/johnclarson4/status/12160579777
;2010-04-14 07:34;0;0;"@MattMaiocco how does the Brandon Marshall trade effect the Niners draft? I think Singletary will pick Dez Bryant unfort. =/";;@MattMaiocco;;"12160567379";https://twitter.com/KingWaldenJr/status/12160567379
;2010-04-14 07:33;0;0;"Brandon Marshall traded to Dolphins for draft picks..... Suprised because I didn't think Parcells would p/u a media driven WR";;;;"12160535902";https://twitter.com/WorldPoole/status/12160535902
;2010-04-14 07:33;0;0;"Also..Brandon Marshall to the Dolphins. Wait, do I care? NO. Just that about 20 people from Miami have updated their fbook status to that.";;;;"12160519754";https://twitter.com/sandrod86/status/12160519754
;2010-04-14 07:33;2;0;"Wow...just woke up to "Brandon Marshall traded to Miami for a pair of second round picks". I'm sure he's stoked. Back home in Florida.";;;;"12160516189";https://twitter.com/VicLombardi/status/12160516189
;2010-04-14 07:31;0;0;"damn brandon marshall is a dolphin now, i like that move for miami";;;;"12160461682";https://twitter.com/MrBoobieSir/status/12160461682
;2010-04-14 07:31;0;0;"I meant Dolphins haha RT @ WebReddy Brandon Marshall to Miami? Ehh Dilphins got a decent deal, but they got lots to deal with # NFL";;@;#;"12160457385";https://twitter.com/WebReddy/status/12160457385
;2010-04-14 07:31;0;0;"Damn Brandon Marshall traded to Miami... i was hoping he went to a better team.. he went from a aiight team to a wack team... o well";;;;"12160455488";https://twitter.com/BigBusinessB/status/12160455488
;2010-04-14 07:31;0;0;"I'm sick now my boy Brandon Marshall leaving my Broncos";;;;"12160454708";https://twitter.com/NappyBoyJethrow/status/12160454708
;2010-04-14 07:31;0;0;"Ohhhh Brandon Marshall to Miami maybe? I know @RangeMerani has to be happy about that";;@RangeMerani;;"12160453259";https://twitter.com/OMGNima/status/12160453259
;2010-04-14 07:31;0;0;"The stupid Broncos traded Brandon Marshall to the Dolphins. But I guess they get a 2nd round pick.";;;;"12160445163";https://twitter.com/JideTheCool/status/12160445163
;2010-04-14 07:30;0;0;"RT @ EasyStylez smh, I guess I woke up to Brandon Marshall being traded to the Dolphins (You too lol)";;@;;"12160404386";https://twitter.com/Da_Miles_Theory/status/12160404386
;2010-04-14 07:30;0;0;"Brandon Marshall is now a Miami Dolphin. I'm really impressed with the moves from the AFC east!";;;;"12160402123";https://twitter.com/Mr_Mike_O/status/12160402123
;2010-04-14 07:30;0;0;"wow Brandon Marshall to the Miami!!! i love seasons like this";;;;"12160389292";https://twitter.com/sk8boardPP/status/12160389292
;2010-04-14 07:29;0;0;"Brandon Marshall to Miami.......I don't like it";;;;"12160374920";https://twitter.com/Black_DeNiro/status/12160374920
;2010-04-14 07:28;0;0;"Now that's what I'm talkin about Miami! Brandon Marshall to the Phins...now if we only had a QB to throw to him...";;;;"12160329806";https://twitter.com/JohnnyTrabs/status/12160329806
;2010-04-14 07:28;0;0;"smh, I guess I woke up to Brandon Marshall being traded to the Dolphins";;;;"12160320585";https://twitter.com/EsauTheFirst/status/12160320585
;2010-04-14 07:28;0;0;"RT @ BlackMediaSCOOP: Wow! comcast sports says WR Brandon Marshall headed to the Miami Dolphins. I can't WAIT for (cont) http://tl.gd/s3q4d";;@;;"12160316694";https://twitter.com/ITZJACKDANZ/status/12160316694
;2010-04-14 07:26;0;0;"I think we're all missing the important part of this Brandon Marshall deal. Ted Ginn Jr is now 83% more likely to get shot & killed! SWEET!";;;;"12160233080";https://twitter.com/adamsmoot/status/12160233080
;2010-04-14 07:25;0;0;"@ mudaguru I called this one>> RT@NFLRumorCentral With Brandon Marshall in town, is Ted Ginn Jr. good as gone? http://bit.ly/9VemPT";;@ @NFLRumorCentral;;"12160212331";https://twitter.com/JoeyTurnpike/status/12160212331
;2010-04-14 07:24;0;0;"RT @AKAramelDelite: Brandon Marshall to the Miami Dolphins???? « I hope so!";;@AKAramelDelite;;"12160176990";https://twitter.com/AnAlphaNamedKen/status/12160176990
;2010-04-14 07:24;0;0;"What's the over/under that Brandon Marshall gets arrested down in # Miami b4 his first game with the # DolphIns??? I'd say it's a slam dunk!";;;# #;"12160148250";https://twitter.com/powdercity/status/12160148250
;2010-04-14 07:22;0;0;"I'm proud 2 say that Brandon Marshall is a Miami Dolphin";;;;"12160093969";https://twitter.com/Miami12345/status/12160093969
;2010-04-14 07:22;0;0;"Wait what's going on? RT @ Addydoes: Good Morning All, I am prayin Brandon Marshall pass his physical, prayin in we need dis";;@;;"12160093874";https://twitter.com/TiAyiti/status/12160093874
;2010-04-14 07:22;0;0;"I certainly don't like seeing Brandon Marshall in the AFC East. There is a lot of talent in this division. Thankfully they don't have a QB.";;;;"12160074482";https://twitter.com/MercuryLoungeNY/status/12160074482
