username;date;retweets;favorites;text;geo;mentions;hashtags;id;permalink
;2010-04-14 12:09;0;0;"Oh yes, the Dolphins just traded for Brandon Marshall. Excuse me while I go do the river dance celebratory dance!!";;;;"12173896008";https://twitter.com/hansolo46/status/12173896008
;2010-04-14 12:08;0;0;"GFFL News Keeper WR Brandon Marshall traded to Miami!!! I know @ Rob_Merino Gotta b excited!";;@;;"12173865918";https://twitter.com/Fatguy78/status/12173865918
;2010-04-14 12:04;0;0;"Going to do my best to not be bitter about my # DenverBroncos trading Brandon Marshall. Not sure who I'm more mad at - them or Marshall!";;;#;"12173688918";https://twitter.com/TraciLJ/status/12173688918
;2010-04-14 12:04;0;0;"In case anyone is wondering, I'm a big fan of the # Dolphins acquisition of Brandon Marshall. If he keeps out of trouble.";;;#;"12173680792";https://twitter.com/kyleroussel/status/12173680792
;2010-04-14 12:04;0;0;"hold up. i just heard my Broncos traded brandon marshall to miami today. Fuck!! that is so not cool.";;;;"12173670153";https://twitter.com/MeganLuckyCharm/status/12173670153
;2010-04-14 12:03;0;0;"annnnnnnnnnnnnnnnd it'z alwayz good 2 start off da day wit GREAT newz...I'd like 2 welcome Mr. Brandon Marshall 2 da @ MiamiDolphins !!";;@;;"12173655536";https://twitter.com/Yella_Boiii/status/12173655536
;2010-04-14 12:03;0;0;"Damn Brandon Marshall a Dolphin, I know Brey ass happy";;;;"12173636451";https://twitter.com/JayT843/status/12173636451
;2010-04-14 12:02;0;0;"We got Brandon Marshall coming to the Dolphins. @ BarbieBrittania: whoops i means this coming weekend that is.";;@;;"12173595783";https://twitter.com/HypeTarantino/status/12173595783
;2010-04-14 12:02;0;0;"Everyone knows I'm a die hard denver broncos fan.. And we just traded brandon marshall to the dolphins... Smh sad day for me.";;;;"12173576597";https://twitter.com/Bpam_139/status/12173576597
;2010-04-14 12:00;0;0;"# Bleacher_Report_NFL: Bye Bye Brandon Marshall, I Bet You're Happy To Be Off The Denver Broncos. As an Oakland Raid... http://is.gd/bsBC4";;;#;"12173505086";https://twitter.com/Football_Blogs/status/12173505086
;2010-04-14 12:00;0;0;"I realize Brandon Marshall was a risk but a 2nd & future 2nd for a 25 yr old monster talent was a deal/risk Jerry damn well should have ...";;;;"12173496053";https://twitter.com/DFWSportsbeat/status/12173496053
;2010-04-14 12:00;0;0;"Bye Bye Brandon Marshall, I Bet You're Happy To Be Off The Denver Broncos http://tinyurl.com/y6kwpl6 # ILoveYou";;;#;"12173473220";https://twitter.com/random_memory/status/12173473220
;2010-04-14 11:58;0;0;"I pray for Brandon Marshall in Miami. Lord, grant him sound judgment and wise counsel.";;;;"12173415201";https://twitter.com/bluesatch/status/12173415201
;2010-04-14 11:58;0;0;"@ seymorebutts BTW, hope your headache goes away :) Brandon Marshall to the Fins :) I'm having a great day!";;@;;"12173388347";https://twitter.com/jhustle34/status/12173388347
;2010-04-14 11:58;0;0;"Commentary: Dolphins get a known stud in Brandon Marshall instead of a draft guess: Until today, I was fretting ov... http://bit.ly/aM6LnD";;;;"12173385492";https://twitter.com/Phinscom/status/12173385492
;2010-04-14 11:58;0;0;"I knew it when Brandon Marshall signed the tender it was only a matter of time that he got delt. Miami dolphins acquire Marshall!";;;;"12173383766";https://twitter.com/TheDuCrossBros/status/12173383766
;2010-04-14 11:56;0;0;"brandon marshall finally got traded.denver,you can now officially fall to pieces while i sit and laugh :)";;;;"12173305299";https://twitter.com/heyarnold5206/status/12173305299
;2010-04-14 11:55;0;0;"RT @ ISmashedUrGirl: Man...I'm trying to get traded to Miami like Brandon Marshall»»He's nuttier than a fruit cake but it was a good trade";;@;;"12173254946";https://twitter.com/MissKnowItAll82/status/12173254946
;2010-04-14 11:55;0;0;"I think he'll fit in with the Miami lifestyle better anyway. Broncos Trade Brandon Marshall to Miami" http://moourl.com/sgj56";;;;"12173239920";https://twitter.com/LiL_Larsen/status/12173239920
;2010-04-14 11:54;0;0;"@ QuanZilla Yeah, that Brandon Marshall trade caught me off guard. I like to see what Miami is going to do this upcoming season.";;@;;"12173220742";https://twitter.com/RappersRActors/status/12173220742
;2010-04-14 11:54;0;0;"FUCK YES MY BOY BRANDON MARSHALL IS NOW A DOLPHIN. WOOOOOOOOOOOO. I CANT WAIT FOR FOOTBALL SEASON";;;;"12173200564";https://twitter.com/Richard298/status/12173200564
;2010-04-14 11:52;0;0;"Today might b the greatest day in Miami Dolphin history! I'm dancin in the streets! Brandon Marshall is a Phin!!!";;;;"12173130584";https://twitter.com/Anthony_A1/status/12173130584
;2010-04-14 11:52;0;0;"FOR ONE DAY ONLY I'm working with @ TheSportsBros. Brandon Marshall, Jerry Jones, Marlins, Heat, NFL Draft its all covered! Excited!";;@;;"12173112302";https://twitter.com/DavidAlen/status/12173112302
;2010-04-14 11:52;0;0;"I wake up to hear the dolphins traded for brandon marshall… very nice";;;;"12173110854";https://twitter.com/JrFromLA/status/12173110854
;2010-04-14 11:51;0;0;"Brandon Marshall to Miami...I like that.";;;;"12173086205";https://twitter.com/FranBoogie/status/12173086205
;2010-04-14 11:51;0;1;"Come on, Revis and Cromartie can earn their money now! RT @ RealJoeNamath: Brandon Marshall to Miami?...Not where I was wantin' him to go!";;@;;"12173085738";https://twitter.com/80sChiyuld/status/12173085738
;2010-04-14 11:51;0;0;"In other news, brandon marshall! Also, i wouldnt be shocked to see us trade ginn and ronnie brown before the draft.";;;;"12173085149";https://twitter.com/WillWellman/status/12173085149
;2010-04-14 11:50;0;0;"We just got brandon marshall... i couldn't be any happier... were ready to win!";;;;"12173022843";https://twitter.com/ohmoses/status/12173022843
;2010-04-14 11:49;0;0;"@ Revis24 will take care of tht RT @ RealJoeNamath: Brandon Marshall to Miami?...Not where I was wantin' him to go!";;@ @;;"12172986603";https://twitter.com/nyjetsfan13/status/12172986603
;2010-04-14 11:49;0;0;"so y i love football even more again?...BRANDON MARSHALL...HAHAHAHA, HAPPY ME!!";;;;"12172976976";https://twitter.com/Ay0oAB/status/12172976976
;2010-04-14 11:48;0;0;"Brandon Marshall traded to the Dolphins, and signs an extension. I wonder if he will work his way out of Miami too? But def a great pick up.";;;;"12172917360";https://twitter.com/MiguelV5/status/12172917360
;2010-04-14 11:47;0;0;"I guess Miami Dolphin WR Davone Bess will now have to give up his number 15 to Brandon Marshall.";;;;"12172878926";https://twitter.com/VeroMark/status/12172878926
;2010-04-14 11:46;0;0;"Wow I hate to see Brandon Marshall go because he is such a beast on the football field, but wow 50 million I don't blame you at all.";;;;"12172861536";https://twitter.com/Mz_Cali_Love/status/12172861536
;2010-04-14 11:46;0;0;"@ billkcummings I was referring to the Dolphins signing Brandon Marshall.";;@;;"12172839060";https://twitter.com/jasongore/status/12172839060
;2010-04-14 11:45;0;0;"I woke up earlier this morning and saw my boy Brandon Marshall got paid in full! Congrats to him 4 getting that huge deal!";;;;"12172812970";https://twitter.com/ProfessorMFitz/status/12172812970
;2010-04-14 11:45;0;0;"The Miami Dolphins have traded for Brandon Marshall...and I could not be a happier fan today. # miamidolphins # brandonmarshall";;;# #;"12172802304";https://twitter.com/briansaa/status/12172802304
;2010-04-14 11:45;0;0;"Bye Bye Brandon Marshall, I Bet Your Happy To Be Off The Denver Broncos http://bit.ly/c61597";;;;"12172788198";https://twitter.com/WebcastWords/status/12172788198
;2010-04-14 11:45;0;0;"RT @ kief3: RT @ xfrostayyy: I'm glad nobody in the east got brandon marshall pheww";;@ @;;"12172781455";https://twitter.com/_MBerry/status/12172781455
;2010-04-14 11:44;0;0;"I sleep in and I miss the Brandon Marshall trade...saw it coming from miles away though";;;;"12172773515";https://twitter.com/NickMordo/status/12172773515
;2010-04-14 11:44;0;0;"Brandon Marshall traded to Miami for 2nd round picks '10 and '11. I don't like this.";;;;"12172771348";https://twitter.com/jenninlaca/status/12172771348
;2010-04-14 11:44;0;0;"RT @ DonteWhitner: RT @ ProFootballTalk: Broncos trade Brandon Marshall to Miami http://is.gd/bsdFf # NFL( @ YOUNGCEASALIO @ sulie_ess) I seen it";;@ @ @ @;#;"12172760894";https://twitter.com/YOUNGCEASALIO/status/12172760894
;2010-04-14 11:43;0;0;"Woke up to the news of the Dolphins trading for Brandon Marshall! I definitely like it!";;;;"12172718670";https://twitter.com/metalero/status/12172718670
;2010-04-14 11:43;0;0;"Brandon Marshall to the Fins. I think he'll be a good fit with the strong armed Chad Henne. Can he keep his nose clean in South Beach???";;;;"12172713249";https://twitter.com/Mankloof/status/12172713249
;2010-04-14 11:42;0;0;"Sorry, I misread the terms of the Brandon Marshall trade. 2nd Rounders in 2010 AND 2011 sounds much better.";;;;"12172679778";https://twitter.com/DraftCountdown/status/12172679778
;2010-04-14 11:42;1;0;"Bye Bye Brandon Marshall, I Bet You're Happy to Be off the Denver Broncos: As a Oakland Raiders fan I must say any... http://bit.ly/cOq2uo";;;;"12172672926";https://twitter.com/rockbroncos/status/12172672926
;2010-04-14 11:42;0;0;"RT @13eatSmith WR Brandon Marshall JUST GOT PAID... I'M RICH B*TCH... # LOvE ---what you say!";;@13eatSmith;#;"12172672724";https://twitter.com/TheeBlackBeauty/status/12172672724
;2010-04-14 11:42;0;0;"Brandon Marshall leaves the Broncos and becomes the highest paid reciever in the NFL. Now I guess I know why he was complaining...";;;;"12172645814";https://twitter.com/conethedawg/status/12172645814
;2010-04-14 11:42;0;0;"brandon marshall goes to from Denver 2 Miami....for a second around pick n the draft. will I guess # broncos will be the choosing a reciever";;;#;"12172644548";https://twitter.com/EjH3181/status/12172644548
;2010-04-14 11:41;0;0;"Brandon Marshall to the Dolphins for two 2nd rd picks. That's a pretty good deal, says I.";;;;"12172631673";https://twitter.com/jtspangler/status/12172631673
;2010-04-14 11:41;0;0;"In Philly with my beautiful girl, and the Dolphins got Brandon Marshall! I'm one happy camper!!!";;;;"12172629870";https://twitter.com/justinfigueroa/status/12172629870
;2010-04-14 11:41;1;0;"I'm glad nobody in the east got brandon marshall pheww";;;;"12172629101";https://twitter.com/xfrostayyy/status/12172629101
;2010-04-14 11:41;0;0;"Sooo the Dolphins got Brandon Marshall...idk how I feel about this yet.";;;;"12172619399";https://twitter.com/LaughLoveFaith/status/12172619399
;2010-04-14 11:41;0;0;"The Broncos have officially traded WR Brandon Marshall to the Miami Dolphins (via @ Denver_Broncos) noooooooo! I need chris to comfort me.";;@;;"12172610146";https://twitter.com/braveopenseas/status/12172610146
;2010-04-14 11:41;0;0;"Brandon Marshall to the dolphins! My team just lost one of the best WR in the game. Dammit! I hope the 2nd rd pick is well worth it!";;;;"12172595703";https://twitter.com/AngelF13/status/12172595703
;2010-04-14 11:40;0;0;"OMG man!! Are u fuckin serious!! We traded Brandon Marshall for two 2nd round draft picks! I fuckin hate the Broncos for this!! *fired up*!";;;;"12172576077";https://twitter.com/ShaneNarkoMusic/status/12172576077
;2010-04-14 11:39;0;0;"Damn I wish I was Brandon Marshall wife! http://bit.ly/aOKsii # iwishiwas";;;#;"12172535494";https://twitter.com/iwishiwas/status/12172535494
;2010-04-14 11:39;0;0;"Brandon Marshall is worth more then a 2nd round pick. I'll be surprised if Denver wins 7 games next season";;;;"12172529427";https://twitter.com/TylerKeyes/status/12172529427
;2010-04-14 11:39;0;0;"I wonder if Brandon Marshall knows that Dolphins are just gay sharks";;;;"12172521617";https://twitter.com/BallUHouston/status/12172521617
;2010-04-14 11:39;0;0;"Lmfao # imjustsaying RT @ ImSoStudio: RT @L3_Femm3_Nikita: Damn I wish I was Brandon Marshall wife!<I aint saying you a gold digger...";;@ @L3_Femm3_Nikita;#;"12172521174";https://twitter.com/LeFemmeNikita_/status/12172521174
;2010-04-14 11:39;0;0;"WR Brandon Marshall JUST GOT PAID... I'M RICH B*TCH... # LOvE";;;#;"12172505678";https://twitter.com/13enjaminJones/status/12172505678
;2010-04-14 11:38;0;0;"Trending right now... brandon marshall traded miami dolphins AND lesbians bestfriends .... I just find that odd.";;;;"12172478079";https://twitter.com/Josh_Moczygemba/status/12172478079
;2010-04-14 11:37;0;0;"RT @L3_Femm3_Nikita: Damn I wish I was Brandon Marshall wife!<I aint saying you a gold digger...";;@L3_Femm3_Nikita;;"12172407142";https://twitter.com/ImSoStudio/status/12172407142
;2010-04-14 11:36;0;0;"I love the move, dolphins get Brandon Marshall, Parcells does well with character issues. Team just got a lot more dangerous";;;;"12172402679";https://twitter.com/thomascox/status/12172402679
;2010-04-14 11:36;0;0;"WOAH!!! Brandon Marshall 50 million?!?!?!?! This dude got to be singing I'm in the $ all the way to the bank!!!! Highest paid WR in history";;;;"12172399628";https://twitter.com/DaniB0802/status/12172399628
;2010-04-14 11:36;0;0;"# Bleacher_Report_NFL: Bye Bye Brandon Marshall, I Bet You're Happy to Be off the Denver Broncos. As a Oakland Raide... http://is.gd/bszPs";;;#;"12172388739";https://twitter.com/Football_Blogs/status/12172388739
;2010-04-14 11:35;0;0;"I think @ fs3142 has single-handedly caused the fact that Brandon Marshall is a trending topic, lol! Thanks for great discussions.";;@;;"12172336605";https://twitter.com/bertjanb/status/12172336605
;2010-04-14 11:35;0;0;"I jus keep clickin bac & forth espn & nfl network I love hearin em say Brandon Marshall is a Dolphin smh *sighs* LMAO";;;;"12172328640";https://twitter.com/615Dozier/status/12172328640
;2010-04-14 11:34;0;0;"I got waken up by @ daviddaman2 at 6 am for him to tell me bout wr brandon marshall";;@;;"12172290154";https://twitter.com/MichLoveSteeler/status/12172290154
;2010-04-14 11:33;0;0;"Brandon Marshall to South Beach.. All I can say is WOW. What are you doing McDaniels?! You've now dealt your franchise QB & WR!";;;;"12172251530";https://twitter.com/BryanDMurphy/status/12172251530
;2010-04-14 11:33;0;0;"I know where I want BMarsh to go .. RT @ RealJoeNamath: Brandon Marshall to Miami?...Not where I was wantin' him to go!";;@;;"12172249109";https://twitter.com/Brian_Bassett/status/12172249109
;2010-04-14 11:33;0;0;"I'm so glad the Seahawks didn't pick up Brandon Marshall!";;;;"12172246659";https://twitter.com/Kurtledge/status/12172246659
;2010-04-14 11:33;0;0;"I hope Brandon Marshall likes the color Orange. lol";;;;"12172245142";https://twitter.com/336WarD/status/12172245142
;2010-04-14 11:32;0;0;"I'm too upset to actually work today. And my brother is happy as a pig in shit tht @ MiamiDolphins picked up Brandon Marshall.";;@;;"12172208628";https://twitter.com/haitian_berry1/status/12172208628
;2010-04-14 11:32;0;0;"brandon marshall going to the dolphins....i hope their QB is ready";;;;"12172205469";https://twitter.com/Breology_101/status/12172205469
;2010-04-14 11:32;0;0;"@ WesFif: Brandon Marshall to Miami? # whoa <~ same thing I said";;@;#;"12172180590";https://twitter.com/4evaKD/status/12172180590
;2010-04-14 11:31;3;0;"Brandon Marshall to Miami?...Not where I was wantin' him to go!";;;;"12172123298";https://twitter.com/RealJoeNamath/status/12172123298
;2010-04-14 11:30;0;0;"RT @ milawho: i <3 Brandon Marshall!! RT RT RT @ yaboiMARSH :)";;@ @;;"12172098143";https://twitter.com/ImsoBAHF/status/12172098143
;2010-04-14 11:30;0;0;"RT @ kpelton: If the Charlie Whitehurst trade is the reason the Seahawks didn't get Brandon Marshall, I am a lot bigger fan of that trade.";;@;;"12172092274";https://twitter.com/aheadofme/status/12172092274
;2010-04-14 11:30;0;0;"I was hoping the Knicks would get Brandon Marshall";;;;"12172091614";https://twitter.com/TrevyTrev5/status/12172091614
;2010-04-14 11:30;0;0;"RT @ WesFif Brandon Marshall to Miami? # whoa <<<o shit, i gotta put espn on asap lol";;@;#;"12172075223";https://twitter.com/Marvz_Said_It/status/12172075223
;2010-04-14 11:29;0;0;"Damn I wish I was Brandon Marshall wife!";;;;"12172058171";https://twitter.com/LeFemmeNikita_/status/12172058171
;2010-04-14 11:29;0;0;"Denver traded Brandon Marshall. I am not sure how I feel about that. I sense a big void in the offense.";;;;"12172053119";https://twitter.com/jlukert/status/12172053119
;2010-04-14 11:29;0;0;"damn, the Dolphins got Brandon Marshall? I dont expect them to keep Tedd Ginn";;;;"12172024843";https://twitter.com/OGFlash/status/12172024843
;2010-04-14 11:28;0;0;"I uploaded a YouTube video -- Brandon Marshall_xvid_001.avi http://youtu.be/WraP3xAwgfc?a";;;;"12172014309";https://twitter.com/shock2k5/status/12172014309
;2010-04-14 11:28;0;0;"I woke up to hear Brandon Marshall to Miami??!?!? Fuck ya!";;;;"12171991346";https://twitter.com/billyjoemarino/status/12171991346
;2010-04-14 11:28;0;0;"@lou_y_lou no brandon marshall to Miami tweet? I'm shocked...";;@lou_y_lou;;"12171990291";https://twitter.com/GiancarloMattei/status/12171990291
;2010-04-14 11:28;0;0;"If I told you yesterday Miami would trade for Brandon Marshall you would be:: http://bit.ly/aVkCfr";;;;"12171971974";https://twitter.com/RamsRZ/status/12171971974
;2010-04-14 11:25;0;0;"Report: Brandon Marshall a Dolphin: Ugh! He might just well be a wasted talent in Miami. I don't see the fins as a... http://bit.ly/aaZhKo";;;;"12171862066";https://twitter.com/clicktech/status/12171862066
;2010-04-14 11:25;0;0;"Dolphins just got WR Brandon Marshall! I'm way too excited.";;;;"12171851215";https://twitter.com/afrikajay/status/12171851215
;2010-04-14 11:25;0;0;"Last week when brandon marshall got married, after their vows i wonder if the priest said "you may now punch the bride"";;;;"12171839733";https://twitter.com/Pluhta/status/12171839733
;2010-04-14 11:25;1;0;"If the Charlie Whitehurst trade is really the reason the Seahawks didn't get Brandon Marshall, I am a lot bigger fan of that trade.";;;;"12171835979";https://twitter.com/kpelton/status/12171835979
;2010-04-14 11:25;0;0;"RT @ xfrostayyy: Damn brandon marshall to the dolphins I know I'm probably madddd late<-- that makes 2 of us";;@;;"12171829567";https://twitter.com/Kief3/status/12171829567
;2010-04-14 11:23;0;0;"So I see the dolphins trying to keep up wit the jets Brandon Marshall and T.O";;;;"12171768286";https://twitter.com/AR__DaBB7/status/12171768286
;2010-04-14 11:23;0;0;"Damn brandon marshall to the dolphins I know I'm probably madddd late";;;;"12171746534";https://twitter.com/xfrostayyy/status/12171746534
;2010-04-14 11:22;0;0;"Bye Bye Brandon Marshall, I Bet You're Happy to Be off - Bleacher Report - Front Page http://aggbot.com/docs/link.php?id=9126756&r=tw&c=208";;;;"12171722469";https://twitter.com/Feel_the_MHEAT/status/12171722469
;2010-04-14 11:22;0;0;"RT @ SUNNYSOULSTICE YES!!! BRANDON MARSHALL IS COMIN' TO DADE COUNTY!!!...I BET HE FINNA GET SUSPENDED DURIN' HIS TENURE IN DA 305...";;@;;"12171719469";https://twitter.com/PhotoTea/status/12171719469
;2010-04-14 11:21;1;0;"RT @ OGOchoCinco Brandon Marshall headed to the Dolphins, all the great recievers are being traded, Santonio now Marshall, I love those guys,";;@;;"12171672483";https://twitter.com/WILLAVELLI/status/12171672483
;2010-04-14 11:21;0;0;"What a letdown about not getting Brandon Marshall. Dolphins gave up more than I thought the Broncos would get though.";;;;"12171657045";https://twitter.com/pastapadre/status/12171657045
;2010-04-14 11:21;0;0;"Brandon Marshall to the Dolphins?? Wow dis is gonna be a very interesting football season..I can't wait for it to start :)";;;;"12171647328";https://twitter.com/_K_Nyce_/status/12171647328
;2010-04-14 11:20;0;0;"Brandon Marshall is now a Dolphin & may also be my 2010 Keeper. I just hope Chad Henne can be better than Cutler/Orton.";;;;"12171626615";https://twitter.com/baldgraphics/status/12171626615
;2010-04-14 11:20;0;0;"Congrats on the fins gettin Brandon Marshall....but I think they fail to realize that we still have the BEST CB in the NFL @ Revis24";;@;;"12171607572";https://twitter.com/CoachDreMurphy/status/12171607572
;2010-04-14 11:20;0;0;"@ NYGreenMachine marshall is just one player how far did buffalo get when they signed T.O I am not worried about brandon marshall";;@;;"12171599979";https://twitter.com/MrCanuck78/status/12171599979
;2010-04-14 11:20;0;0;"That woulda been sick! Braylon, Holmes, and Marshall?! RT @Klassikewl: I wish Brandon Marshall would've just went to the Jets.";;@Klassikewl;;"12171590972";https://twitter.com/NupeJuice/status/12171590972
;2010-04-14 11:19;0;0;"Bye Bye Brandon Marshall, I Bet Your Happy To Be Off The Denver Broncos: Bleacher Report As a Oakland Raiders fan ... http://bit.ly/cOq2uo";;;;"12171580506";https://twitter.com/NathanCaffrey/status/12171580506
;2010-04-14 11:18;0;0;"I will not miss Brandon Marshall. Regardless of whether we lose more games this year or not, I will enjoy the Broncos a whole lot more.";;;;"12171533618";https://twitter.com/joshschloss/status/12171533618
;2010-04-14 11:18;0;0;"RT @veebaby0825: I heard that Brandon Marshall was traded... # badmove Broncos!<<< I told u they were doing that! I'm so pissed!";;@veebaby0825;#;"12171513194";https://twitter.com/JovisMama/status/12171513194
;2010-04-14 11:17;0;0;"@ e_man marshall is just one player how far did buffalo get when they signed T.O ??? I am not worried about brandon marshall";;@;;"12171455842";https://twitter.com/MrCanuck78/status/12171455842
;2010-04-14 11:16;0;0;"Good-bye Brandon Marshall! Thank goodness he's out of Denver. I'm rather sick of his problems. But we better get decent WRs out of it!";;;;"12171431799";https://twitter.com/Evans_Brittany/status/12171431799
;2010-04-14 11:16;0;0;"@ Marty1090 I put the over/under at 2 seasons. (Length of time it takes the Dolphins to tire of Brandon Marshall.) Glad he left the AFC West.";;@;;"12171422142";https://twitter.com/tkdiego/status/12171422142
;2010-04-14 11:16;0;0;"got-dam brandon marshall is BAAAALLIN!!!! 50 million tho? if i was da coach he would never come off da field for 50 mil.";;;;"12171405738";https://twitter.com/jeffreylamar/status/12171405738
;2010-04-14 11:16;0;0;"Seattle Seahawks Lose Out On Brandon Marshall To Dolphins12th Man Rising (blog)Of course I wanted to see Marsha... http://zmarter.com/326971";;;;"12171396295";https://twitter.com/Z_HotTopic/status/12171396295
;2010-04-14 11:15;0;0;"I can't believe Brandon Marshall was traded to the dolphins for only two 2nd roud pics one this year and one next year";;;;"12171384721";https://twitter.com/BPSmedia/status/12171384721
;2010-04-14 11:15;0;0;"i did the math. this nigga brandon marshall about to be making 12 million a yr.";;;;"12171369614";https://twitter.com/TaylorGangJ/status/12171369614
;2010-04-14 11:14;0;0;"# nfl # broncos Bye Bye Brandon Marshall, I Bet Your Happy To Be Off The Denver Broncos: Bleacher Report » As a Oakl... http://bit.ly/97QykT";;;# #;"12171311633";https://twitter.com/Football_Fanz/status/12171311633
;2010-04-14 11:14;1;0;"I think the Brandon Marshall trade will make Chad Henne worth a starting QB job in # fantasyfootball 2010.";;;#;"12171301444";https://twitter.com/TheFantasyNerd/status/12171301444
;2010-04-14 11:13;0;0;"Brandon Marshall headed to the Dolphins, all the great recievers are being traded, Santonio now Marshall, I love those guys(via @ OGOchoCinco";;@;;"12171283767";https://twitter.com/McClureJL/status/12171283767
;2010-04-14 11:13;0;0;"Lol.thought u were talking about me when I glanced lol RT @ bkranpost: cant wait to watch derel revis shut down brandon marshall twice a year";;@;;"12171280555";https://twitter.com/Doin_Tha_Most/status/12171280555
;2010-04-14 11:13;0;0;"BRANDON MARSHALL IS ONE COLD WR!! I DUNNO WHO IN THEIR RIGHT MIND WOULD LET HIM GO! RT @ official_flo BRANDON MARSHALL IN MIA!";;@;;"12171255058";https://twitter.com/WhoisRip/status/12171255058
;2010-04-14 11:12;0;0;"Brandon Marshall to the Dolphins for 4.7 Mill Ill go too If I was him";;;;"12171217763";https://twitter.com/TooKoolTooKare/status/12171217763
;2010-04-14 11:12;0;0;"Bye Bye Brandon Marshall, I Bet You're Happy to Be Off the Denver Broncos http://bit.ly/bsLWSw # dolphins";;;#;"12171206736";https://twitter.com/dolphinsfeedr/status/12171206736
;2010-04-14 11:12;0;0;"Bye Bye Brandon Marshall, I Bet You're Happy to Be Off the Denver Broncos http://bit.ly/bsLWSw # broncos";;;#;"12171206240";https://twitter.com/broncosfeedr/status/12171206240
;2010-04-14 11:12;0;0;"wow! Brandon Marshall to the Dolphins. this could be a good thing. I guess time will tell.";;;;"12171195775";https://twitter.com/AJHILL_2A/status/12171195775
;2010-04-14 11:11;0;0;"Also, y is brandon marshall the highest paid WR in history? I can think of about well A LOT of others better than him. Miami is screwed up";;;;"12171193470";https://twitter.com/jessdown87/status/12171193470
;2010-04-14 11:11;0;0;"Eddie Royal > Brandon Marshall -- Yeah I said it";;;;"12171192679";https://twitter.com/CounterClip/status/12171192679
;2010-04-14 11:11;0;0;"Why are the Broncos trading Brandon Marshall? Bad move. Glad I'm not a Broncos fan.";;;;"12171153146";https://twitter.com/omfgitskami/status/12171153146
;2010-04-14 11:11;0;0;"I can't believe the Broncos traded WR Brandon Marshall. Smh.";;;;"12171149060";https://twitter.com/xDelicateREBEL/status/12171149060
;2010-04-14 11:10;0;0;"Lmaaaaooooo RT @ ISmashedUrGirl: Man...I'm trying to get traded to Miami like Brandon Marshall";;@;;"12171137703";https://twitter.com/DNas/status/12171137703
;2010-04-14 11:10;0;0;"Now that the Dolphins picked up Brandon Marshall does that mean that they are gonna abandon the wildcat? I don't see anyway he will fit in.";;;;"12171130439";https://twitter.com/davidr236/status/12171130439
;2010-04-14 11:09;0;0;"Who should I start this week, Dwayne Bowe or Brandon Marshall?: Bowe and the Chiefs are at home against the Jags. ... http://bit.ly/c7mSoa";;;;"12171092503";https://twitter.com/londonbonggirl/status/12171092503
