username;date;retweets;favorites;text;geo;mentions;hashtags;id;permalink
;2009-02-27 16:51;0;0;"Bengals sign running back DeDe Dorsey to a one-year deal: Cedric Benson is still unsigned, though how much have .. http://tinyurl.com/adb47f";;;;"1260116233";https://twitter.com/CincyJungle/status/1260116233
;2009-02-27 13:47;0;0;"Bengals and Lions are in the mix; possibly battling for Derrick Ward depending on Cedric Benson: We pointed ou.. http://tinyurl.com/cd579e";;;;"1259413770";https://twitter.com/SBNationNFL/status/1259413770
;2009-02-27 12:51;0;0;"Bengals and Lions are in the mix; possibly battling for Derrick Ward depending on Cedric Benson: We pointed out .. http://tinyurl.com/cd579e";;;;"1259196866";https://twitter.com/CincyJungle/status/1259196866
;2009-02-27 08:24;0;0;"bengals are trying to get cedric benson re-signed, with derrick ward as a fallback . . .";;;;"1258154811";https://twitter.com/ProFootballTalk/status/1258154811
;2009-02-27 07:23;0;0;"Bengals, one of five teams to offer Derrik Ward a contract?: Even though there's no news on Cedric Benson in fre.. http://tinyurl.com/b5e9j2";;;;"1257963880";https://twitter.com/CincyJungle/status/1257963880
;2009-02-26 22:41;0;0;"While Cedric Benson set to hit market, focus will turn to running back: Another thing that today means is that.. http://tinyurl.com/bjselv";;;;"1256876734";https://twitter.com/SBNationNFL/status/1256876734
;2009-02-26 22:40;0;0;"While Cedric Benson set to hit market, focus will turn to running back: Another thing that today means is that t.. http://tinyurl.com/bbhhhj";;;;"1256875884";https://twitter.com/SBNation/status/1256875884
;2009-02-26 22:25;0;0;"While Cedric Benson set to hit market, focus will turn to running back: Another thing that today means is that t.. http://tinyurl.com/bjselv";;;;"1256831485";https://twitter.com/CincyJungle/status/1256831485
;2009-02-23 13:53;0;0;"Monday links and notes; Benson's stock rising? : Today is a short one. Cedric Benson is listed as the third be.. http://tinyurl.com/aftv52";;;;"1242026247";https://twitter.com/CincyJungle/status/1242026247
;2009-02-22 12:20;0;0;"Report: Cedric Benson to hit the free agency market: I'm not exactly sure if we expected the Bengals to seal C.. http://tinyurl.com/bprrfj";;;;"1237762677";https://twitter.com/CincyJungle/status/1237762677
;2009-02-22 12:11;0;0;"Report: Cedric Benson to hit the free agency market: I'm not exactly sure if we expected the Bengals to seal.. http://tinyurl.com/bprrfj";;;;"1237738308";https://twitter.com/SBNationNFL/status/1237738308
;2009-02-21 18:03;0;0;"Bengals RB Benson To Test Market: Cincinnati Bengals RB Cedric Benson expects to test the waters of free agency,.. http://tinyurl.com/b9kn9k";;;;"1235689698";https://twitter.com/fbguys/status/1235689698
;2009-02-21 09:51;0;0;"[Bengals] Bengals RB Cedric Benson To Test Free Agent Market http://tinyurl.com/apnoqg";;;;"1234403311";https://twitter.com/GridironFans/status/1234403311