username;date;retweets;favorites;text;geo;mentions;hashtags;id;permalink
;2014-03-17 15:43;0;0;"MIN [SB Nation: Daily Norseman] - Letroy Guion Signs With Green Bay Packers http://bit.ly/1gGHS3v";;;;"445661603724140545";https://twitter.com/FLGM_NFC_news/status/445661603724140545
;2014-03-17 15:42;0;0;"# POWERMOVES RT @ ProFootballTalk: Packers add Letroy Guion http://wp.me/p14QSB-9rl7";;@;#;"445661473323225088";https://twitter.com/TiMiller23/status/445661473323225088
;2014-03-17 15:42;0;0;"Packers add Letroy Guion http://bit.ly/1p4WVIG";;;;"445661415408300032";https://twitter.com/SAFFNews/status/445661415408300032
;2014-03-17 15:41;0;0;"Packers add Letroy Guion http://ift.tt/NoNN5v";;;;"445661245438689280";https://twitter.com/Football_Smarts/status/445661245438689280
;2014-03-17 15:39;0;0;"" @ ArifHasanNFL: This Letroy Guion to the Packers news is the most beautiful news of the offseason." Right lol";;@;;"445660795502735360";https://twitter.com/Zorlafsky/status/445660795502735360
;2014-03-17 15:39;0;0;"@ Zezzy24 excited? RT @ ProFootballTalk: Packers add Letroy Guion http://wp.me/p14QSB-9rl7";;@ @;;"445660761189146624";https://twitter.com/hewad209/status/445660761189146624
;2014-03-17 15:39;0;0;"Packers sign DT Letroy Guion to a one-year deal # Packers";;;#;"445660693379809280";https://twitter.com/WkeUpItsFootbal/status/445660693379809280
;2014-03-17 15:39;0;0;"Ex-Vikings defensive tackle Letroy Guion joins the Packers: One of the free agents the Ravens have displayed... http://dlvr.it/59N3Ff";;;;"445660627483115520";https://twitter.com/buzzinbaltimore/status/445660627483115520
;2014-03-17 15:38;0;0;"“ @ ProFootballTalk: Packers add Letroy Guion http://wp.me/p14QSB-9rl7 ” Packers getting DLine help # fsu # packers # nfl";;@;# # #;"445660426781458432";https://twitter.com/rebel_wa_cause/status/445660426781458432
;2014-03-17 15:38;0;1;"http://BaltimoreSun.com - Ex-Vikings defensive tackle Letroy Guion joins the Packers: http://ble.ac/1kDikbS";;;;"445660383752097792";https://twitter.com/BR_BalRavens/status/445660383752097792
;2014-03-17 15:37;0;0;"BAL Sun Insider: Ex-Vikings defensive tackle Letroy Guion joins the Packers http://bsun.md/1gGH1Qc";;;;"445660296644816897";https://twitter.com/FLGM_AFC_news/status/445660296644816897
;2014-03-17 15:37;1;0;"Ravens Insider: Ex-Vikings defensive tackle Letroy Guion joins the Packers http://bsun.md/1gGH1zQ";;;;"445660294719602688";https://twitter.com/BaltSunSports/status/445660294719602688
;2014-03-17 15:36;0;0;"" @ ProFootballTalk: Packers add Letroy Guion http://wp.me/p14QSB-9rl7 " another big boy on that pass rush!";;@;;"445660061356920832";https://twitter.com/trevorinabnit/status/445660061356920832
;2014-03-17 15:36;0;0;"RT @ ProFootballTalk: Packers add Letroy Guion http://wp.me/p14QSB-9rl7";;@;;"445660009687703552";https://twitter.com/Chicago_Land/status/445660009687703552
;2014-03-17 15:36;0;0;"RT @ ProFootballTalk: Packers add Letroy Guion http://wp.me/p14QSB-9rl7";;@;;"445659983724941312";https://twitter.com/SportsTownChi/status/445659983724941312
;2014-03-17 15:35;1;0;"" @ RavensInsider: Letroy Guion did a one-year deal with the Packers. Will hit free agency again next year when he's 27" @ phildawsonradio";;@ @;;"445659738844319744";https://twitter.com/stew_stev/status/445659738844319744
;2014-03-17 15:34;27;16;"Packers add Letroy Guion http://wp.me/p14QSB-9rl7";;;;"445659368055668736";https://twitter.com/ProFootballTalk/status/445659368055668736
;2014-03-17 15:33;0;0;"With signing of DT LeTroy Guion, Packers have three d-linemen essentially on 1-year trials (Raji, Peppers). Lots of incentive.";;;;"445659263143145473";https://twitter.com/RichRatay/status/445659263143145473
;2014-03-17 15:33;0;0;"ProFootballTalk: Packers add Letroy Guion http://bit.ly/1gGGpu0";;;;"445659232461795329";https://twitter.com/JOBOOZOSO/status/445659232461795329
;2014-03-17 15:32;2;1;"Letroy Guion Signs With Green Bay Packers # NFL # Vikings http://sbn.to/1g3wHH8";;;# #;"445658913182978049";https://twitter.com/DailyNorseman/status/445658913182978049
;2014-03-17 15:31;0;0;"" @ RapSheet: Meanwhile, the # Packers added another DL, signing ex- # Vikings DL Letroy Guion, per @ RavensInsider."";;@ @;# #;"445658781569929216";https://twitter.com/its___chad/status/445658781569929216
;2014-03-17 15:31;0;0;"# Packers & Letroy Guion reportedly come 2 terms on a 1-yr deal. 300-lb DL is quick off the snap; can shoot the gaps. Expect Raji 2go to NT.";;;#;"445658777493446656";https://twitter.com/ReverendRalph/status/445658777493446656
;2014-03-17 15:30;0;0;"# Packers sign Ex- # Viking DT Letroy Guion.";;;# #;"445658565551079424";https://twitter.com/NK_Sports1/status/445658565551079424
;2014-03-17 15:30;0;0;"Packers Sign Letroy Guion, Add to Depth on Defensive Line in Free Agency: The revamping of the Packers' defens... http://bit.ly/1iwFLU3";;;;"445658502728392704";https://twitter.com/Vikings_Sigs/status/445658502728392704
;2014-03-17 15:29;1;1;"Packers sign former Minnesota Vikings 6'4 305lbs defensive lineman Letroy Guion to a one year contract. # freeagencyfrenzy # GoPackGo";;;# #;"445658260549677056";https://twitter.com/wisprosports/status/445658260549677056
;2014-03-17 15:28;0;0;"@TheRealJShipp RT @ RavensInsider: Letroy Guion agrees to terms with the Packers, according to his agent Thomas Kleine pic.twitter.com/8wFtBBcTFb";;@TheRealJShipp @;;"445658004038242304";https://twitter.com/RossUglem/status/445658004038242304
;2014-03-17 15:28;0;0;"# Packers add a new piece to their defensive line. Letroy Guion, former Viking is now a member of the Pack.";;;#;"445657956151853057";https://twitter.com/JrCortez92/status/445657956151853057
;2014-03-17 15:28;0;0;"NFL Free Agent Defensive Tackle Rankings updated for # Packers signing Letroy Guion - http://walterfootball.com/freeagents2014DT.php …";;;#;"445657944894750720";https://twitter.com/walterfootball/status/445657944894750720
;2014-03-17 15:28;0;1;"Packers sign DT Letroy Guion";;;;"445657910572761089";https://twitter.com/MattBethke6/status/445657910572761089
;2014-03-17 15:27;0;0;"Packers contratou o DL Letroy Guion, que antes era dos Vikings. Pela reação de alguns torcedores de Minnesota, não é grande coisa.";;;;"445657607580422144";https://twitter.com/dimibarcellos_/status/445657607580422144
;2014-03-17 15:25;0;0;"Packers Add Veteran Defensive Tackle - http://goo.gl/XLVI2z - Defensive tackle Letroy Guion and the Packers have ... # Packers";;;#;"445657181128376321";https://twitter.com/JerseyAlGBP/status/445657181128376321
;2014-03-17 15:24;0;0;"Meanwhile, the # Packers added another DL, signing ex- # Vikings DL Letroy Guion, per @ RavensInsider.";;@;# #;"445657061636857856";https://twitter.com/NFCAFCshowdown/status/445657061636857856
;2014-03-17 15:24;0;0;"RT @ TyDunne: New at the JS Blog: # Packers sign another DL in Letroy Guion. ... http://www.jsonline.com/blogs/sports/250670251.html …";;@;#;"445657016833679362";https://twitter.com/journalsentinel/status/445657016833679362
;2014-03-17 15:24;0;0;"New from http://ALLGBP.com Packers Add Veteran Defensive Tackle: Defensive tackle Letroy Guion an... http://bit.ly/1iwIXPL # Packers";;;#;"445656947182665728";https://twitter.com/JasonPerone/status/445656947182665728
;2014-03-17 15:24;0;0;"Packers Add Veteran Defensive Tackle: Defensive tackle Letroy Guion and the Packers have reportedly a... http://bit.ly/1iwIXPC # Packers";;;#;"445656945190391808";https://twitter.com/CoryJennerjohn/status/445656945190391808
;2014-03-17 15:22;0;0;"Vikings_Newz. Packers Sign Letroy Guion, Add to Depth on Defensive Li - SB Nation http://aggbot.com/Minnesota-Vikings-News/article/22384079 …";;;;"445656556957614081";https://twitter.com/Vikings_Newz/status/445656556957614081
;2014-03-17 15:22;0;0;"Packers_Newz. Packers Sign Letroy Guion, Add to Depth on Defensive Li - SB Nation http://aggbot.com/Green-Bay-Packers-News/article/22384078 …";;;;"445656551500828672";https://twitter.com/Packers_Newz/status/445656551500828672
;2014-03-17 15:22;0;0;"" @ RapSheet: Meanwhile, the # Packers added another DL, signing ex- # Vikings DL Letroy Guion, per @ RavensInsider." solid";;@ @;# #;"445656549310992384";https://twitter.com/Pizzarollmaster/status/445656549310992384
;2014-03-17 15:22;0;0;"@ phildawsonradio reportedly # packers have signed Letroy Guion from the Vikings";;@;#;"445656407400910848";https://twitter.com/TimMulcahy1/status/445656407400910848
;2014-03-17 15:22;0;0;"# Packers have now added DL Letroy Guion to a one year deal. Him and Peppers are the only outside free agents signed so far.";;;#;"445656317399552001";https://twitter.com/packersupdated/status/445656317399552001
;2014-03-17 15:21;1;2;"Love how we take the packers good players and we give then Letroy Guion";;;;"445656095143776257";https://twitter.com/uk_vikings/status/445656095143776257
;2014-03-17 15:20;1;2;"First a Bear, now a Viking. DT Letroy Guion, 26, signs 1-year deal with GB. http://tinyurl.com/kzc5sub";;;;"445655921377542145";https://twitter.com/MikeClemensNFL/status/445655921377542145
;2014-03-17 15:19;0;0;"Who is Letroy Guion? @ IMxRANDALICIOUS";;@;;"445655594452516864";https://twitter.com/JNoFro6/status/445655594452516864
;2014-03-17 15:19;1;0;"Packers sign Vikings defensive tackle free agent Letroy Guion, 26, to a one year deal. Guion (GUY-in) had 21... http://fb.me/6n6MiFBEN";;;;"445655562701664256";https://twitter.com/1057FMTheFan/status/445655562701664256
;2014-03-17 15:18;0;0;"LeTroy Guion coming to the Pack.. I'll take it!";;;;"445655558172188673";https://twitter.com/CodyShrewsberry/status/445655558172188673
;2014-03-17 15:18;0;1;"Letroy guion will definitely add some depth to the packers d line";;;;"445655346875359232";https://twitter.com/ZachDenneau/status/445655346875359232
;2014-03-17 15:17;3;3;"Packer sign former Vikings DL Letroy Guion to one-year deal. Had 21 tackles in 13 games # GoPackGo # PackersNation # Packers";;;# # #;"445655299924721665";https://twitter.com/PackerFansOnly/status/445655299924721665
;2014-03-17 15:17;0;2;"Great job vikes, let the packers take letroy guion smh";;;;"445655099126206464";https://twitter.com/jack_schiffman/status/445655099126206464
;2014-03-17 15:16;0;0;"Welcome to Green Bay, Letroy Guion.";;;;"445654976829079553";https://twitter.com/SteveKranking/status/445654976829079553
;2014-03-17 15:16;0;0;"LeTroy Guion aláírt a Packershöz.";;;;"445654943589212160";https://twitter.com/pfbusiness/status/445654943589212160
;2014-03-17 15:16;0;0;"Packers Sign Ex-Vikings DL Letroy Guion to 1-Yr Deal, According to Baltimore Sun; Totaled 21 Tackles in 13 Starts in '13";;;;"445654895668912129";https://twitter.com/NFLFansExpert/status/445654895668912129
;2014-03-17 15:16;4;6;"Packers sign former Vikings DL Letroy Guion to a 1-year deal.";;;;"445654834671140864";https://twitter.com/Packers_Stuff/status/445654834671140864
;2014-03-17 15:15;0;0;"" @ RobDemovsky: Last season, Letroy Guion had 21 tackles and one sack (which came against the # Packers on Oct. 27)." Of course it did.";;@;#;"445654752152387584";https://twitter.com/aj_vela_/status/445654752152387584
;2014-03-17 15:15;0;0;"Former Vikings Letroy Guion has agreed to terms on a one year deal with..THE GREEN BAY PACKERS! http://fb.me/6xszc0d82";;;;"445654610112290816";https://twitter.com/PurplePeoplePod/status/445654610112290816
;2014-03-17 15:14;7;5;"Last season, Letroy Guion had 21 tackles and one sack (which came against the # Packers on Oct. 27).";;;#;"445654484082241537";https://twitter.com/RobDemovsky/status/445654484082241537
;2014-03-17 15:14;2;1;"Packers sign ex-Vikings DL Letroy Guion. http://www.acmepackingcompany.com/packers-free-agency-2014/2014/3/17/5519388/packers-sign-letroy-guion-defensive-lineman-vikings-free-agency …";;;;"445654361331748864";https://twitter.com/ukpackers/status/445654361331748864
;2014-03-17 15:14;19;1;"Report: Cut from Vikings, DT Letroy Guion agrees to terms with Packers # Vikings (via the 1500 ESPN SportsWire) http://1500espn.com/sportswire/Report_Cut_from_Vikings_DT_Letroy_Guion_agrees_to_terms_with_Packers031714 …";;;#;"445654318239084544";https://twitter.com/1500ESPN/status/445654318239084544
;2014-03-17 15:13;1;0;"Per @ RavensInsider, the # Packers signed ex- # Vikings DL Letroy Guion. Had interest from # Patriots";;@;# # #;"445654282046414848";https://twitter.com/PatriotsHaven/status/445654282046414848
;2014-03-17 15:13;0;0;"@ mitchnelles @ espnhomer @ gneitzel16 Packers signed DT Letroy Guion to 1 yr deal according to @ jasonjwilde";;@ @ @ @;;"445654241685028866";https://twitter.com/MarkChilds04/status/445654241685028866
;2014-03-17 15:13;0;0;"Alguem sabe Letroy Guion é bom jogador?";;;;"445654161234092034";https://twitter.com/felipec_melo/status/445654161234092034
;2014-03-17 15:12;0;0;"I thought Letroy Guion had a few decent moments his first 3 seasons with the Vikings. Faded bad last season, though.";;;;"445653956170362880";https://twitter.com/AdamsPackHQ/status/445653956170362880
;2014-03-17 15:11;2;1;"# Packers have signed former # Vikings DL Letroy Guion per @ RavensInsider # NFLFreeAgency";;@;# # #;"445653797650829312";https://twitter.com/FrankBostonTank/status/445653797650829312
;2014-03-17 15:11;0;0;"Patriots target RT @ RapSheet: Meanwhile, the # Packers added another DL, signing ex- # Vikings DL Letroy Guion, per @ RavensInsider.";;@ @;# #;"445653768256770049";https://twitter.com/patspulpit/status/445653768256770049
;2014-03-17 15:11;0;0;"Woof RT @ RavensInsider: Letroy Guion did a one-year deal with the Packers. Will hit free agency again next year when he's 27 years old";;@;;"445653686350393344";https://twitter.com/cburbs/status/445653686350393344
;2014-03-17 15:11;0;0;"You mean "DL". RT @ RapSheet: Meanwhile, the # Packers added another DL, signing ex- # Vikings DL Letroy Guion, per @ RavensInsider.";;@ @;# #;"445653629744062464";https://twitter.com/eric_j_thompson/status/445653629744062464
;2014-03-17 15:10;86;47;"Meanwhile, the # Packers added another DL, signing ex- # Vikings DL Letroy Guion, per @ RavensInsider.";;@;# #;"445653526320922624";https://twitter.com/RapSheet/status/445653526320922624
;2014-03-17 15:10;3;7;"New at the JS Blog: # Packers sign another DL in Letroy Guion. ... http://www.jsonline.com/blogs/sports/250670251.html …";;;#;"445653520536989696";https://twitter.com/TyDunne/status/445653520536989696
;2014-03-17 15:10;0;0;"I honestly have no idea who Letroy Guion is, but cool. I think";;;;"445653362822750209";https://twitter.com/mikedsaenz/status/445653362822750209
;2014-03-17 15:10;0;0;"r/GreenBayPackers: Packers sign DT Letroy Guion http://bit.ly/1qMBi3q";;;;"445653300042424320";https://twitter.com/PackerRedditor/status/445653300042424320
;2014-03-17 15:09;0;0;"Packers Sign Letroy Guion, Add to Depth on Defensive Line in Free Agency: The revamping of the Packers' defens... http://bit.ly/1iwFLU3";;;;"445653283944665089";https://twitter.com/Packers_Sigs/status/445653283944665089
;2014-03-17 15:09;7;1;"RT @ RavensInsider: Letroy Guion did a one-year deal with # Packers. Will hit free agency again next year when he's 27 years old";;@;#;"445653230421573632";https://twitter.com/jasonjwilde/status/445653230421573632
;2014-03-17 15:07;0;0;"The @ Packers have signed former # Vikings DT Letroy Guion to a one-year deal. # NFLFreeAgency";;@;# #;"445652691570917376";https://twitter.com/LuisNFL96/status/445652691570917376
;2014-03-17 15:07;1;1;"The Packers signed former Vikings DT Letroy Guion to add to DL depth, according to @ RavensInsider http://sbn.to/1eLZv1t";;@;;"445652661786775552";https://twitter.com/acmepackingco/status/445652661786775552
;2014-03-17 15:07;0;0;"The Packers signed former Vikings DT Letroy Guion to add to DL depth, according to @ RavensInsider http://sbn.to/1eLZv1t";;@;;"445652658066436096";https://twitter.com/TexWestern/status/445652658066436096
;2014-03-17 15:07;0;0;"GBP JS blog: Packers sign another DL in Letroy Guion http://bit.ly/1iWQztb";;;;"445652626378485760";https://twitter.com/FLGM_NFC_news/status/445652626378485760
;2014-03-17 15:06;1;0;"Another good signing!!! GOOD JOB TED @ rothchris: RT @ RavensInsider: Letroy Guion agrees to terms with the Packers,";;@ @;;"445652499555315712";https://twitter.com/JETFAN36/status/445652499555315712
;2014-03-17 15:06;0;1;"Letroy Guion a los Packers. Ted Thomspon enloquecido. Frenesí fichajil.";;;;"445652459034124288";https://twitter.com/RudNec555/status/445652459034124288
;2014-03-17 15:04;0;0;"Packers To Sign Letroy Guion http://po.st/Xk1VNA via @ po_st";;@;;"445652004157681664";https://twitter.com/JimWeidner51/status/445652004157681664
;2014-03-17 15:04;0;0;"Letroy Guion who received a good amount of interest around the league has landed in Green Bay on a 1yr deal # Packers";;;#;"445652002614157312";https://twitter.com/InsideEdgeNfl/status/445652002614157312
;2014-03-17 15:04;0;0;"@metalhead_mark am I going to be a fan of this LeTroy Guion guy?";;@metalhead_mark;;"445651987250819072";https://twitter.com/Mattitude1988/status/445651987250819072
;2014-03-17 15:04;0;1;"The Packers have signed DT Letroy Guion.";;;;"445651978710818816";https://twitter.com/ETwPhoneHome/status/445651978710818816
;2014-03-17 15:04;1;0;"Packers have signed DL Letroy Guion to a one-year deal.";;;;"445651915452727297";https://twitter.com/PackersNotes/status/445651915452727297
;2014-03-17 15:03;0;0;"Letroy Guion, that is. Welcome to the # Packers!";;;#;"445651623050620928";https://twitter.com/Brewfan0419/status/445651623050620928
;2014-03-17 15:03;1;0;"New # Packers DT Letroy Guion played 397 snaps and started 13 games last year, with 5 QB hurries, 1 hit, 1 sack. (via @ PFF)";;@;#;"445651565139873793";https://twitter.com/JamesKust/status/445651565139873793
;2014-03-17 15:03;0;0;"# Packers continue to make the DL a strength of the team with the signing of Letroy Guion. Will see snaps in sub-packages.";;;#;"445651544126418945";https://twitter.com/CCSO228/status/445651544126418945
;2014-03-17 15:02;9;3;"RT @ RavensInsider: DT Letroy Guion did a one-year deal with the # Packers. Will hit free agency again next year when he's 27.";;@;#;"445651484055969792";https://twitter.com/PGPackersNews/status/445651484055969792
;2014-03-17 15:02;1;0;"# Packers: -DT: Letroy Guion agrees to terms with the Packers, according to his agent http://bit.ly/1qMAfR4";;;#;"445651480230785024";https://twitter.com/FA_Packers/status/445651480230785024
;2014-03-17 15:02;0;0;"# Packers: -DT: Letroy Guion agrees to terms with the Packers, according to his agent http://bit.ly/1qMAfR4";;;#;"445651473737981953";https://twitter.com/FantasyAlarmCom/status/445651473737981953
;2014-03-17 15:02;0;1;"DL Letroy Guion, who visited with the Patriots, gets a one-year deal with the Packers, per multiple reports.";;;;"445651345903976448";https://twitter.com/cpriceNFL/status/445651345903976448
;2014-03-17 15:01;0;0;"Packers To Sign Letroy Guion http://dlvr.it/59MTwq # packers # nfl";;;# #;"445651203804766208";https://twitter.com/pfr_packers/status/445651203804766208
;2014-03-17 15:01;2;3;"Letroy Guion joins the Packers on a one-year deal: http://www.baltimoresun.com/bal-letroy-guion-joins-the-packers-20140317,0,7522885.story …";;;;"445651175200030720";https://twitter.com/AaronWilson_NFL/status/445651175200030720
;2014-03-17 15:01;0;1;"Make that Letroy Guion. Darn keyboard with a faulty "t" pic.twitter.com/RZjDrTw3Dp";;;;"445651143818248192";https://twitter.com/ThePowerSweep/status/445651143818248192
;2014-03-17 15:00;0;0;"Letroy Guion signed with the # Packers pr his agent @ thkleine14 adds depth to Dline with Pickett and Jolly gone. # nfldk # gulklud";;@;# # #;"445650969339375616";https://twitter.com/Schen_RulEz/status/445650969339375616
;2014-03-17 15:00;0;0;"I don't know what a Letroy Guion is, but ok.";;;;"445650910702628864";https://twitter.com/ji711/status/445650910702628864
;2014-03-17 15:00;2;0;"O Green Bay Packers acertou contrato de um ano com o DT Letroy Guion (MIN).";;;;"445650875651223552";https://twitter.com/oQuarterback/status/445650875651223552
;2014-03-17 14:59;0;0;"@ Robby_Walsh Should I care about Letroy Guion that we just got from y'all? Positives/negatives?";;@;;"445650733396787202";https://twitter.com/Statmark/status/445650733396787202
;2014-03-17 14:59;22;7;"Letroy Guion did a one-year deal with the Packers. Will hit free agency again next year when he's 27 years old";;;;"445650679861104641";https://twitter.com/AaronWilson_NFL/status/445650679861104641
;2014-03-17 14:59;6;1;"Letroy Guion going to the # Packers is like seeing your crazy ex date a guy you don't like. You can only point and laugh.";;;#;"445650668737396736";https://twitter.com/eric_j_thompson/status/445650668737396736
;2014-03-17 14:59;0;0;"Ted Thompson making it rain outchea. RT @ RavensInsider Letroy Guion agrees to terms with the Packers,";;@;;"445650542262374400";https://twitter.com/ByJohnDiaz/status/445650542262374400
;2014-03-17 14:58;0;0;"Still the kings of the North RT “ @ ArifHasanNFL: This Letroy Guion to the Packers news is the most beautiful news of the offseason.”";;@;;"445650362779725824";https://twitter.com/NathanBloechl/status/445650362779725824
;2014-03-17 14:57;3;5;"DT Letroy Guion has signed with the Packers.... Awesome news!";;;;"445650261701586944";https://twitter.com/KevinMcMahonNFL/status/445650261701586944
;2014-03-17 14:57;0;0;"" @ nfltrade_rumors: Packers Sign DL Letroy Guion http://tinyurl.com/ptsuzh9 "....haha have fun with that!!";;@;;"445650239521697792";https://twitter.com/Purple15Reign/status/445650239521697792
;2014-03-17 14:57;0;0;"Taking all of our rivals' best players. First Julius Peppers and now Letroy Guion. We're comin we're comin!";;;;"445650216629182464";https://twitter.com/Tjones5/status/445650216629182464
;2014-03-17 14:57;1;0;"The gift that would keep on giving. RT @ ArifHasanNFL: This Letroy Guion to the Packers news is the most beautiful news of the offseason.";;@;;"445650137084219394";https://twitter.com/eric_j_thompson/status/445650137084219394
;2014-03-17 14:57;3;0;"Packers To Sign Letroy Guion http://wp.me/p4i6ib-W2";;;;"445650086425423872";https://twitter.com/pfrumors/status/445650086425423872
;2014-03-17 14:56;18;26;"This Letroy Guion to the Packers news is the most beautiful news of the offseason.";;;;"445649945509367808";https://twitter.com/ArifHasanNFL/status/445649945509367808
;2014-03-17 14:55;0;0;"“ @ RavensInsider: Letroy Guion agrees to terms with the Packers. Ravens had interest, but no offer” ok @packerswoo now we're even for Favre";;@ @packerswoo;;"445649649882628097";https://twitter.com/carpetkaiser/status/445649649882628097
;2014-03-17 14:54;0;0;"OK. RT" @ RavensInsider Letroy Guion agrees to terms with the Packers,"";;@;;"445649423352471555";https://twitter.com/absdadon/status/445649423352471555
;2014-03-17 14:54;2;0;"Former Vikings DT met with Patriots. MT @ RavensInsider: Letroy Guion agrees to terms with the Packers, according to his agent, Thomas Klei.";;@;;"445649410840879104";https://twitter.com/OliverBThomas/status/445649410840879104
;2014-03-17 14:54;0;0;"LOVE THIS! Glimpses of great interior pass rushing. RT @ RavensInsider: Letroy Guion agrees to terms with the Packers, according to his agent";;@;;"445649398962614272";https://twitter.com/roshanb1288/status/445649398962614272
;2014-03-17 14:54;0;0;"# Packers signed former # VIkings DL Letroy Guion. Guion had a visit with # Patriots last week.";;;# # #;"445649387381719040";https://twitter.com/HouseofSports1/status/445649387381719040
;2014-03-17 14:54;0;0;"Teddy Bankroll strikes again. “ @ RavensInsider: Letroy Guion agrees to terms with the # Packers, according to his agent.”";;@;#;"445649355270127616";https://twitter.com/MarquesEversoll/status/445649355270127616
;2014-03-17 14:54;0;0;"RT @ RavensInsider: Letroy Guion agrees to terms with the Packers, according to his agent.";;@;;"445649306985320449";https://twitter.com/DanTurczynski/status/445649306985320449
;2014-03-17 14:54;0;0;"Wow, looks like the Packers were serious about a defensive line overhaul. Just signed Letroy Guion.";;;;"445649286043164673";https://twitter.com/onlineandnice/status/445649286043164673
;2014-03-17 14:54;0;0;"TWO outside free agents? Wow. RT @ RavensInsider: Letroy Guion agrees to terms with the Packers, according to his agent, Thomas Kleine.";;@;;"445649282373124096";https://twitter.com/LukeMMoney/status/445649282373124096
;2014-03-17 14:53;5;0;"# Packers signed former # VIkings DL Letroy Guion. Guion had a visit with # Patriots last week.";;;# # #;"445649146180300800";https://twitter.com/NFL_DovKleiman/status/445649146180300800
;2014-03-17 14:53;0;0;"Ted might hurt himself MT @ RavensInsider Letroy Guion agrees to terms with the Packers, according to his agent, Thomas Kleine.";;@;;"445649102965993473";https://twitter.com/ChrisTerlop/status/445649102965993473
;2014-03-17 14:53;4;2;"RT @ RavensInsider: Letroy Guion agrees to terms with the Packers, according to agent, Thomas Kleine. Ravens had interest, but no major offer";;@;;"445649077573672960";https://twitter.com/rothchris/status/445649077573672960
;2014-03-17 14:53;0;0;"Hey packers! Thanks for taking letroy guion. Lol...";;;;"445649044929380352";https://twitter.com/Harut728/status/445649044929380352
;2014-03-17 14:53;0;1;"Damn, stole him right out from under us MT “ @ RavensInsider: Letroy Guion agrees to terms with the Packers, according to his agent."";;@;;"445649019792945152";https://twitter.com/VikeFans/status/445649019792945152
;2014-03-17 14:52;0;0;"in other news who the hell is Letroy Guion # Packers";;;#;"445648973940813824";https://twitter.com/mlynch115/status/445648973940813824
;2014-03-17 14:52;2;1;"Another DL! RT @ RavensInsider: Letroy Guion agrees to terms with the Packers, according to his agent, Thomas Kleine";;@;;"445648964113534976";https://twitter.com/acmepackingco/status/445648964113534976
;2014-03-17 14:52;1;0;"Packers add another D Line guy in Letroy Guion, adding another decent player.";;;;"445648927069839360";https://twitter.com/j_hussain/status/445648927069839360
