username;date;retweets;favorites;text;geo;mentions;hashtags;id;permalink
;2014-03-23 15:06;0;0;"@ jasonjwilde @ packers anything you can tell us about the Letroy Guion signing? Scouting report?";;@ @;;"447826798835818496";https://twitter.com/bjorntorock/status/447826798835818496
;2014-03-22 22:47;0;0;"Add Letroy Guion to the D-line mix - ESPN (blog) http://ift.tt/1gLzf70 # NFL # GreenbayPackers";;;# #;"447580447577747457";https://twitter.com/GreenbayPlus/status/447580447577747457
;2014-03-22 16:04;0;0;"@ gojiramonkey we were interested in him. We got DE Julius Peppers (da Bears) & DT Letroy Guion. (Vikes) ha stealing from the enemy.";;@;;"447478834842337280";https://twitter.com/stokesy76/status/447478834842337280
;2014-03-21 09:53;0;0;"Forums: LeTroy Guion signs with Packers http://foxs.pt/1jgQuk6 # packers";;;#;"447023179349774336";https://twitter.com/PackersOnScout/status/447023179349774336
;2014-03-21 06:58;0;0;"Bishop, QB Josh Freeman, DT Letroy Guion, LB Marvin Mitchell, CB Marcus Sherels. Recontrataciones: QB Matt Cassel, DT Fred Evans, DE...";;;;"446979174595846144";https://twitter.com/Quarterback_NFL/status/446979174595846144
;2014-03-20 18:49;0;0;"# Vikings defensive line: +Linval Joseph -Letroy Guion +Corey Wootton -Jared Allen. Net gain? Net loss?";;;#;"446795657731260416";https://twitter.com/qbwins/status/446795657731260416
;2014-03-20 16:05;0;0;"Acme Packing Company: James Starks and Letroy Guion Contracts: Packers Get Bargains on Both http://bit.ly/1jd7GXz";;;;"446754417996337154";https://twitter.com/PackersPulse/status/446754417996337154
;2014-03-20 16:04;1;0;"Acme Packing Company >> James Starks and Letroy Guion Contracts: Packers Get Bargains on Both http://buzztap.com/-ns6PiM";;;;"446754156368629760";https://twitter.com/packersbuzztap/status/446754156368629760
;2014-03-20 14:40;0;0;"James Starks and Letroy Guion Contracts: Packers Get Bargains on Both http://dlvr.it/5BjzL1 # Packers";;;#;"446733049506447360";https://twitter.com/FanMag_Packers/status/446733049506447360
;2014-03-20 14:34;0;0;"James Starks and Letroy Guion Contracts: Packers Get Bargains on Both: The two most recent Packer free agent s... http://bit.ly/OBus2c";;;;"446731608112902144";https://twitter.com/Packers_Sigs/status/446731608112902144
;2014-03-20 14:21;0;0;"James Starks and Letroy Guion Contracts: Packers Get Bargains on Both - SB Nation http://aggbot.com/Green-Bay-Packers-News/article/22421279 …";;;;"446728352893001729";https://twitter.com/Packers_Newz/status/446728352893001729
;2014-03-20 14:01;0;0;"Thanks to @ BobMcGinn, we now know the details of @ James44Starks' and Letroy Guion's contracts: http://sbn.to/1eWpsvk";;@ @;;"446723151267782656";https://twitter.com/acmepackingco/status/446723151267782656
;2014-03-20 14:01;0;0;"Thanks to @ BobMcGinn, we now know the details of @ James44Starks' and Letroy Guion's contracts: http://sbn.to/1eWpsvk";;@ @;;"446723147828445184";https://twitter.com/TexWestern/status/446723147828445184
;2014-03-20 12:00;0;1;"THESE are the secrets former # Vikings DT Letroy Guion shared with the # Packers when he signed with them: http://www.purplejesusdiaries.com/2014-articles/march/what-secrets-will-letroy-guion-tell-the-packers.html …";;;# #;"446692848537047041";https://twitter.com/PJDiaries/status/446692848537047041
;2014-03-20 10:10;0;0;"MIN Purple Jesus: What Secrets Will Letroy Guion Tell the Packers? http://bit.ly/1jbA4cE";;;;"446665077802811392";https://twitter.com/FLGM_NFC_news/status/446665077802811392
;2014-03-19 23:35;0;0;"Letroy Guion";;;;"446505236837179392";https://twitter.com/jbruuuu/status/446505236837179392
;2014-03-19 21:02;0;0;"@ markcraignfl Is he better than letroy guion?";;@;;"446466761337348096";https://twitter.com/BroncoBob360/status/446466761337348096
;2014-03-19 13:32;2;1;"# FTB is back! Julius Peppers and Letroy Guion dicussed as well as losses of Jones and EDS! Draft Series: DL # GoPackGo http://packerstalk.com/2014/03/19/from-the-benches-the-meaning-of-life-from-an-existential-perspective/ …";;;# #;"446353456182218752";https://twitter.com/FromTheBenches/status/446353456182218752
;2014-03-19 13:27;0;0;"Packers: Ex-Vikings tackle Letroy Guion signed to one-year deal http://dlvr.it/5BFT4f @ MnTcTwins # Minnesota";;@;#;"446352167641681921";https://twitter.com/MNRags/status/446352167641681921
;2014-03-19 13:00;0;0;"# NFL Packers sign DT Letroy Guion: The Green Bay Packers have signed DT Letroy Guion. The signing was announced... http://q.gs/627N9";;;#;"446345398701940736";https://twitter.com/NFL_24h/status/446345398701940736
;2014-03-19 11:26;0;0;"When I typed in Letroy Guion on YouTube the only highlight that came up was James Starks hitting him with the truck stick... Smh";;;;"446321719041462273";https://twitter.com/ACONN2013/status/446321719041462273
;2014-03-19 09:57;2;1;"Setting realistic expectations for Julius Peppers' and Letroy Guion's roles on the # Packers in 2014: http://bleacherreport.com/articles/1997393-setting-realistic-expectations-for-each-green-bay-packers-free-agent-signing …";;;#;"446299338252099584";https://twitter.com/MichelleBruton/status/446299338252099584
;2014-03-19 02:46;0;0;"Add Letroy Guion to the D-Line mix http://es.pn/1l20SAw";;;;"446190896842031104";https://twitter.com/ProNoles/status/446190896842031104
;2014-03-18 23:40;0;0;"Green Bay Packers sign Letroy Guion http://lombardiave.com/2014/03/17/green-bay-packers-sign-former-minnesota-vikings-defensive-lineman-letroy-guion/ …";;;;"446144041567010816";https://twitter.com/Loree1966/status/446144041567010816
;2014-03-18 23:21;0;1;"Even though we picked up Julius Peppers & Letroy Guion, I don't see us going after DeSean Jackson.";;;;"446139249986109441";https://twitter.com/Chanimal36/status/446139249986109441
;2014-03-18 20:41;13;14;"# Packers have signed DT Letroy Guion... another Going Green! If ya can't beat us, join us!! # GoPackGo!!pic.twitter.com/vJTbtCVbMY";;;# #;"446099153030873089";https://twitter.com/bwdpromotions/status/446099153030873089
;2014-03-18 19:51;0;0;"r/GreenBayPackers: Letroy Guion's Contract is worth just less than $1 million http://bit.ly/1fY91CT";;;;"446086401444958208";https://twitter.com/PackerRedditor/status/446086401444958208
;2014-03-18 18:28;12;3;"Letroy Guion's deal with # Packers is 1 year, $985K. He got $100K to sign, $730K base salary, $105K in per-game roster bonuses, $50K workout.";;;#;"446065635005825024";https://twitter.com/TomPelissero/status/446065635005825024
;2014-03-18 18:11;0;1;"Letroy Guion went from a 4-3 3-tech to a 3-4 NT in like three seasons of good eatin";;;;"446061234664665088";https://twitter.com/tyschalter/status/446061234664665088
;2014-03-18 17:58;3;0;"By my count, only three current # Packers have any playing experiance with other teams: DuJuan Harris, Letroy Guion, Julius Peppers";;;#;"446058015284670464";https://twitter.com/JuMosq/status/446058015284670464
;2014-03-18 17:23;13;5;"NT Letroy Guion's 1-yr. deal with # Packers worth $985,000. Includes $100,000 S-bonus and $730,000 minimum base. Was to have made $4M in Minn";;;#;"446049396556566528";https://twitter.com/BobMcGinn/status/446049396556566528
;2014-03-18 17:21;0;1;"" @ GoesslingESPN: Scout to @ BobMcGinn on Letroy Guion: " He'll jump offside, do all the (expletive) that drives you nuts." He wasn't terrible";;@ @;;"446048659851862017";https://twitter.com/akesNpains1/status/446048659851862017
;2014-03-18 17:18;0;0;"Letroy Guion's one-year contract with the Green Bay Packers is worth $985,000. via @ TomSilverstein";;@;;"446047998330404864";https://twitter.com/WISportsBlog/status/446047998330404864
;2014-03-18 17:17;0;0;"Guion's deal worth just less than $1 million: Green Bay - Nose tackle Letroy Guion's one-year contract with th... http://bit.ly/1fXIi9A";;;;"446047696776724481";https://twitter.com/Wrestlfn78/status/446047696776724481
;2014-03-18 16:15;0;0;"Milwaukee paper report: Mike Zimmer determined Letroy Guion "lacked the mental acuity'' the new pat lee?? Yes!";;;;"446032253668179968";https://twitter.com/jpaul_schram/status/446032253668179968
;2014-03-18 15:56;0;0;"# NFLOffseasonWinner(s) Julius Peppers and Letroy Guion, for actually being signed as unrestricted free agents by Ted Thompson";;;#;"446027451588546561";https://twitter.com/TheGusKnorr/status/446027451588546561
;2014-03-18 15:19;0;0;"Yardbarker: Packers sign former Vikings' DT Letroy Guion http://bit.ly/1j2d5ka";;;;"446018084030001152";https://twitter.com/PackersPulse/status/446018084030001152
;2014-03-18 15:06;0;0;"Packers sign former Vikings' DT Letroy Guion http://foxs.pt/1cWrujJ # packers # nfl";;;# #;"446014782248730625";https://twitter.com/SoFeyen/status/446014782248730625
;2014-03-18 14:54;0;0;"@ EAMaddenNFL Letroy Guion";;@;;"446011781048434688";https://twitter.com/BrandMasterG/status/446011781048434688
;2014-03-18 14:52;0;1;"Packers sign former Vikings ' DT Letroy Guion: According to the team's website, the Green Bay Packers have s... http://bit.ly/1cWoqE0";;;;"446011196462731264";https://twitter.com/60maxpowero/status/446011196462731264
;2014-03-18 14:45;0;0;"Packers sign former Vikings' DT Letroy Guion - Yardbarker http://aggbot.com/Green-Bay-Packers-News/article/22396542 …";;;;"446009492401299456";https://twitter.com/Packers_Newz/status/446009492401299456
;2014-03-18 14:29;0;0;"Yardbarker: # Packers sign former Vikings ' DT Letroy Guion http://www.yardbarker.com/nfl/articles/packers_sign_former_vikings_dt_letroy_guion/16040048 … via @ yardbarker";;@;#;"446005563843833857";https://twitter.com/60maxpowero/status/446005563843833857
;2014-03-18 13:53;0;0;"Packers agree to terms with DT Letroy Guion http://beta.thescore.com/news/456594";;;;"445996508367060994";https://twitter.com/_LilAntt/status/445996508367060994
;2014-03-18 13:48;0;0;"@ ProFootballTalk why haven't u guys reported the Letroy Guion signing by the @ packers yet?? # undertheradar # wheresthelove";;@ @;# #;"445995281436672000";https://twitter.com/Ali_Ridha52GBP/status/445995281436672000
;2014-03-18 12:58;0;0;"Green Bay Packers sign DT Letroy Guion - http://fox6now.com http://ift.tt/1fWTuDr # NFL # GreenbayPackers";;;# #;"445982466151837696";https://twitter.com/GreenbayPlus/status/445982466151837696
;2014-03-18 12:18;0;0;"Green Bay Packers sign Letroy Guion - LomdardiAve http://ift.tt/1opdCQD # NFL # GreenbayPackers";;;# #;"445972547637882880";https://twitter.com/GreenbayPlus/status/445972547637882880
;2014-03-18 12:01;0;0;"I like pickin up Letroy Guion. He adds beef/depth to the line";;;;"445968246781403137";https://twitter.com/donjuan174/status/445968246781403137
;2014-03-18 10:57;3;1;"Scout to @ BobMcGinn on Letroy Guion: "If you keep it simple he'll be OK. He'll jump offside, do all the (expletive) that drives you nuts."";;@;;"445952209826881536";https://twitter.com/GoesslingStrib/status/445952209826881536
;2014-03-18 10:45;6;2;"Wow RT @ christomasson: Milwaukee paper report: Mike Zimmer determined Letroy Guion "lacked the mental acuity'' which is why he was released";;@;;"445949080477245440";https://twitter.com/KevinMcMahonNFL/status/445949080477245440
;2014-03-18 10:28;1;1;"Wow, some strong comments on Letroy Guion in this Journal-Sentinel story. http://www.jsonline.com/sports/packers/packers-james-jones-signs-deal-with-oakland-raiders-b99227418z1-250727811.html …";;;;"445944809010655232";https://twitter.com/MNBrianHall/status/445944809010655232
;2014-03-18 10:24;9;5;"Milwaukee paper report: Mike Zimmer determined Letroy Guion "lacked the mental acuity'' which is why he was released: http://www.twincities.com/sports/ci_25365500/green-bay-packers-ex-vikings-nose-tackle-letroy …";;;;"445943840826863616";https://twitter.com/christomasson/status/445943840826863616
;2014-03-18 10:22;0;0;"This could be the best D-Line the packers have had since 1997 super bowl. Letroy Guion will be a good guy to rotate in.";;;;"445943256938184704";https://twitter.com/taytayroo/status/445943256938184704
;2014-03-18 10:22;0;0;"James Jones goes to Raiders; Vikings' nose tackle Letroy Guion signs with Packers - http://goo.gl/IVBXow via @ SportzHype";;@;;"445943232673771520";https://twitter.com/SportzHype/status/445943232673771520
;2014-03-18 10:15;0;0;"@Saint_Deuce thoughts on Letroy Guion?";;@Saint_Deuce;;"445941476036333568";https://twitter.com/Chee_Noth/status/445941476036333568
;2014-03-18 10:04;1;0;"Former Vikings Defensive End Letroy Guion Signs With Packers - Yardbarker http://aggbot.com/Minnesota-Vikings-News/article/22393294 …";;;;"445938696265924609";https://twitter.com/Vikings_Newz/status/445938696265924609
;2014-03-18 09:34;1;0;"# Packers add ex-Viking NT Letroy Guion, bid farewell to WR James Jones ... http://www.jsonline.com/sports/packers/packers-james-jones-signs-deal-with-oakland-raiders-b99227418z1-250727811.html …";;;#;"445931343772258304";https://twitter.com/BobMcGinn/status/445931343772258304
;2014-03-18 09:11;0;0;"Packers sign # Vikings DT Letroy Guion http://www.packers.com/news-and-events/article-1/Packers-sign-DT-Letroy-Guion/a8041a51-fc2c-4151-9814-cc0d428592c0?campaign=free_agency_20140317_20227204&campaign=gb:fanshare:twitter …";;;#;"445925364682874882";https://twitter.com/duluthkate/status/445925364682874882
;2014-03-18 08:53;1;2;"Also up at JS Online, scouts' take on Julius Peppers, the 2014 free agents ranked, Letroy Guion in/James Jones out: http://www.jsonline.com/sports/packers/";;;;"445920933434245120";https://twitter.com/TyDunne/status/445920933434245120
;2014-03-18 08:30;0;0;"@ LetroyGuion98 Change tht to The official Twitter of Green Bay Packers DT LeTroy Guion :)";;@;;"445915201116700672";https://twitter.com/gobrewcrew65/status/445915201116700672
;2014-03-18 08:19;0;0;"# Packers signed former # Nole Letroy Guion on Monday http://floridastate.247sports.com/Board/36/Noles-in-NFL-Free-Agency-26443084/1#a26577344 … via @ Noles247";;@;# # #a26577344;"445912469127856128";https://twitter.com/Noles247/status/445912469127856128
;2014-03-18 08:11;0;0;"Former # Vikings DT Letroy Guion signs a deal with the # Packers for 1 year and just over the 6-year veterans minimum of $730 thousand.";;;# #;"445910484810608640";https://twitter.com/ESPNLaCrosseWI/status/445910484810608640
;2014-03-18 08:07;0;0;"James Jones goes to Raiders; Vikings' nose tackle Letroy Guion signs with ... - Milwaukee Journal Sentinel http://dlvr.it/59gxRS";;;;"445909275928313856";https://twitter.com/BayAreaSports9/status/445909275928313856
;2014-03-18 08:03;0;1;"James Jones goes to Raiders; Vikings' nose tackle Letroy Guion signs with ... - Milwaukee Journal Sentinel http://ow.ly/2EOhxh";;;;"445908277608861698";https://twitter.com/Raiderswatch/status/445908277608861698
;2014-03-18 07:51;0;1;"James Jones goes to Raiders; Vikings' nose tackle Letroy Guion signs with ... - Milwaukee Journal Sentinel http://dlvr.it/59gb68";;;;"445905239745384449";https://twitter.com/OakRaidersview/status/445905239745384449
;2014-03-18 07:34;5;7;"By signing DE Julius Peppers & NT Letroy Guion, # Packers GM Ted Thompson has given team room to seek help at LB & safety in draft.";;;#;"445900935856799744";https://twitter.com/TomOatesWSJ/status/445900935856799744
;2014-03-18 07:30;1;1;"ICYMI, # Packers news: WR James Jones signs w/ Oakland, RB James Starks stays in GB, ex-Vikings DT Letroy Guion gets 1-year deal.";;;#;"445900104990330881";https://twitter.com/TomOatesWSJ/status/445900104990330881
;2014-03-18 07:30;2;0;"Reportedly visited NE. RT @ RavensInsider: Ex-Vikings defensive tackle Letroy Guion joins the Packers http://www.baltimoresun.com/sports/ravens/ravens-insider/bal-letroy-guion-joins-the-packers-20140317,0,3412142.story …";;@;;"445899969502126080";https://twitter.com/JumboHart/status/445899969502126080
;2014-03-18 07:22;0;0;"@ Cardinaltravel @ keladewig Letroy Guion";;@ @;;"445897943581597696";https://twitter.com/Ladewig/status/445897943581597696
;2014-03-18 07:08;0;0;"Journal Sentinel: James Jones goes to Raiders; Vikings' nose tackle Letroy Guion signs with Packers http://bit.ly/1j02JBr";;;;"445894482412572673";https://twitter.com/PackersPulse/status/445894482412572673
;2014-03-18 07:06;0;0;"James Jones goes to Raiders; Vikings' nose tackle Letroy Guion signs with ... - Milwaukee Journa... http://bit.ly/1onMtgR # raiders # nfl";;;# #;"445894049250025472";https://twitter.com/NTNRaiders/status/445894049250025472
;2014-03-18 07:03;0;0;"James Jones goes to Raiders; Vikings' nose tackle Letroy Guion signs with ... - Milwaukee Journal Sentinel http://dlvr.it/59fZCj";;;;"445893298327011328";https://twitter.com/BayAreaSports9/status/445893298327011328
;2014-03-18 06:42;0;0;"James Jones goes to Raiders; Vikings’ nose tackle Letroy Guion signs with Packers http://goo.gl/fb/4dOpJ";;;;"445887912538689536";https://twitter.com/MetroMKE/status/445887912538689536
;2014-03-18 06:31;1;2;"Ex-Vikings defensive tackle Letroy Guion joins the Packers http://www.baltimoresun.com/sports/ravens/ravens-insider/bal-letroy-guion-joins-the-packers-20140317,0,3412142.story …";;;;"445885202192035840";https://twitter.com/AaronWilson_NFL/status/445885202192035840
;2014-03-18 04:55;0;0;"2014 NFL Free Agency: Green Bay Packers sign Letroy Guion - FanSided http://dlvr.it/59bjxP";;;;"445860967524466689";https://twitter.com/GreBayPackersnw/status/445860967524466689
;2014-03-18 04:33;0;0;"Forum Post: DT Letroy Guion signs with Packers http://ow.ly/2EO4aC";;;;"445855614104010752";https://twitter.com/PackersFanClub/status/445855614104010752
;2014-03-18 04:32;0;0;"Packer Forum: DT Letroy Guion signs with Packers: The former Vikings will meet with the Packers on Sunday if h... http://bit.ly/1iZsSQY";;;;"445855157872365569";https://twitter.com/PackersFanClub/status/445855157872365569
;2014-03-18 03:59;0;0;"Packers sign Letroy Guion # packers http://instagram.com/p/lrZYz9nSsT/";;;#;"445847038719447040";https://twitter.com/bmcgee945/status/445847038719447040
;2014-03-18 02:35;0;0;"Packers sign D lineman Guion, Starks to return: GREEN BAY — The Packers have signed defensive tackle Letroy Guion... http://dlvr.it/59XcxW";;;;"445825728773234688";https://twitter.com/MilwaukeeCP/status/445825728773234688
;2014-03-18 02:30;0;1;"2014 NFL Free Agency: Green Bay Packers sign Letroy Guion - FanSided http://ift.tt/1iZ3YAP # NFL # GreenbayPackers";;;# #;"445824470704717824";https://twitter.com/GreenbayPlus/status/445824470704717824
;2014-03-18 00:12;2;0;"IMO, bringing in DT Letroy Guion from the Vikings all but convinces me we've seen the last of Pickett, Jolly, and Wilson. # Packers";;;#;"445789825073823745";https://twitter.com/WISportsBlog/status/445789825073823745
;2014-03-17 23:23;0;0;"“ @ RavensInsider: Letroy Guion agrees to terms with the Packers, according to his agent, Thomas Kleine.” Lol yessss";;@;;"445777421405401088";https://twitter.com/TheRodGrandy/status/445777421405401088
;2014-03-17 23:16;0;1;"Packers add free agent DT Letroy Guion http://bit.ly/1cToHYw";;;;"445775726965309441";https://twitter.com/WAOW/status/445775726965309441
;2014-03-17 23:00;0;0;"DL Letroy Guion is leaving the # Vikings after signing with the # Packers today. # NFL";;;# # #;"445771780766965760";https://twitter.com/nfl_czar/status/445771780766965760
;2014-03-17 23:00;0;0;"Packers: Ex-Vikings tackle Letroy Guion signed to one-year deal http://dlvr.it/59Trtf";;;;"445771735778877440";https://twitter.com/BDCitizensports/status/445771735778877440
;2014-03-17 22:51;0;0;"Packers add Letroy Guion - http://rotosportsnews.com/packers-add-letroy-guion/ …";;;;"445769508276277248";https://twitter.com/RotoSportsNews1/status/445769508276277248
;2014-03-17 22:22;0;0;"Packers add free agent DT Letroy Guion http://bit.ly/1cTgDae";;;;"445762116838891521";https://twitter.com/wkbtsports/status/445762116838891521
;2014-03-17 22:15;0;0;"“ @ packers: # Packers have signed DT Letroy Guion. Started 28 games for the # Vikings over past two seasons#Packers # ohmygosh";;@;# # #Packers #;"445760466300592129";https://twitter.com/KragnessRhett/status/445760466300592129
;2014-03-17 22:03;0;0;"Former Vikings Defensive End Letroy Guion Signs With Packers - Yardbarker http://aggbot.com/Green-Bay-Packers-News/article/22387182 …";;;;"445757368694210560";https://twitter.com/Packers_Newz/status/445757368694210560
;2014-03-17 22:02;0;0;"# Packers make another move up to shore up D-line add free-agent tackle Letroy Guion .. # Vikings # Minneapolis http://q.gs/5xXlL";;;# # #;"445757058487296000";https://twitter.com/brknews_msp/status/445757058487296000
;2014-03-17 21:56;0;0;"Packers add Letroy Guion - http://NBCSports.com http://ift.tt/1iYeQis";;;;"445755528695013376";https://twitter.com/mediatracker16/status/445755528695013376
;2014-03-17 21:50;0;0;"Yardbarker: Former Vikings Defensive End Letroy Guion Signs With Packers http://bit.ly/OqQ1m0";;;;"445753998679629824";https://twitter.com/VikingsPulse/status/445753998679629824
;2014-03-17 21:40;0;0;"Packers make another move up to shore up D-line, add free-agent tackle Letroy Guion: http://strib.mn/1diW4Pm # NFL # VIKINGS";;;# #;"445751681930641408";https://twitter.com/JoeCamel_Sports/status/445751681930641408
;2014-03-17 21:33;0;0;"@ BasedSexyPonder Letroy Guion";;@;;"445749931190390786";https://twitter.com/NPuntIntendedSP/status/445749931190390786
;2014-03-17 21:31;0;1;"“ @ Vikeologist: # Packers sign former # Vikings DT LeTroy Guion” --OHHH LOOK EVERYONE ALL THE PACKERS EVER DO IS SIGN EX-VIKINGS";;@;# #;"445749424233279488";https://twitter.com/johndlind/status/445749424233279488
;2014-03-17 21:23;0;1;"Packers signed James Starks to a 2 year extension and DT Letroy Guion today. Finally.";;;;"445747211897298945";https://twitter.com/brodie_004/status/445747211897298945
;2014-03-17 21:22;0;0;"Ex-Vikings defensive tackle Letroy Guion joins the Packers - baltimoresun http://aggbot.com/Baltimore-Ravens-News/article/22386871 …";;;;"445746918837469184";https://twitter.com/LatestRavenNews/status/445746918837469184
;2014-03-17 21:19;1;0;"DT Letroy Guion signed with the Packers.";;;;"445746362294882305";https://twitter.com/KeithALund/status/445746362294882305
;2014-03-17 21:10;1;1;"@ PackersBR Meu texto sobre a elevação do nível da DL com a chegada de Julius Peppers e Letroy Guion http://opiniaofa.blogspot.com.br/2014/03/elevando-o-nivel-da-linha-defensiva.html …";;@;;"445743937433927680";https://twitter.com/gui_cohen/status/445743937433927680
;2014-03-17 21:09;0;1;"Hey # Vikings fans... How is that Letroy Guion guy the # Packers signed? I don't really recall watching him or hearing his name?";;;# #;"445743799591903232";https://twitter.com/AChurchill8/status/445743799591903232
;2014-03-17 21:05;0;0;"[NFL] O Green Bay Packers contratou o DT Letroy Guion.";;;;"445742798755856384";https://twitter.com/USports_/status/445742798755856384
;2014-03-17 21:04;0;0;"Packers have signed DT Letroy Guion. Started 28 games for the # Vikings over past two seasons: @ RobeyWanKanobi";;@;#;"445742426192224256";https://twitter.com/nickKaighin/status/445742426192224256
;2014-03-17 21:03;0;0;"Packers add free agent DT Letroy Guion: The Green Bay Packers have signed ex-Vikings tackle Letroy Guion to a... http://dlvr.it/59STNf";;;;"445742158926970880";https://twitter.com/milwaukee_buzz/status/445742158926970880
;2014-03-17 21:01;0;0;"Yardbarker: Former Vikings Defensive End Letroy Guion Signs With Packers http://bit.ly/1cT3DkP";;;;"445741874599321601";https://twitter.com/PackersPulse/status/445741874599321601
;2014-03-17 20:53;0;0;"@ MasonLoegering2 Letroy Guion";;@;;"445739808065732609";https://twitter.com/tyschmidt4/status/445739808065732609
;2014-03-17 20:52;0;0;"Packers Have Signed Letroy Guion http://sulia.com/my_thoughts/268571a0f0ffdceaf098fbc241a31372/?source=tw&action=share&btn=big&form_factor=desktop …";;;;"445739508911181824";https://twitter.com/agandia/status/445739508911181824
;2014-03-17 20:49;0;0;"Packers sign DT Letroy Guion";;;;"445738657539170306";https://twitter.com/fabimota1/status/445738657539170306
;2014-03-17 20:47;0;0;"http://Packers.com - Packers sign DT Letroy Guion: http://ble.ac/OqGH1l";;;;"445738255028195329";https://twitter.com/BR_Packers/status/445738255028195329
;2014-03-17 20:47;0;0;"Packers make another move up to shore up D-line, add free-agent tackle Letroy Guion http://dlvr.it/59SHB4";;;;"445738169284050944";https://twitter.com/TwinCitiesBuzz/status/445738169284050944
;2014-03-17 20:44;0;0;"Packers announce signing of former Vikings DT Letroy Guion to 1-year contract -via SportsCenter http://bit.ly/zzSpRY";;;;"445737533738340352";https://twitter.com/papatibodeau/status/445737533738340352
;2014-03-17 20:30;0;0;"The Green Bay Packers have signed DT Letroy Guion.";;;;"445733958412943360";https://twitter.com/TheDSH/status/445733958412943360
;2014-03-17 20:28;0;0;"Packers | Letroy Guion contract update http://wp.me/p3HIFZ-l7R";;;;"445733322447024128";https://twitter.com/therofl/status/445733322447024128
;2014-03-17 20:23;0;0;"Packers add free agent DT Letroy Guion (Yahoo Sports): MILWAUKEE (AP) -- The Green Bay Packers have signed ex-Vikings tackle Letroy G...";;;;"445732102617575424";https://twitter.com/CURRYDocurly/status/445732102617575424
;2014-03-17 20:21;0;0;"@Procto42 # Packers have signed DT Letroy Guion. Started 28 games for the # Vikings...will this make me happy? Peppers, Guion and Matthews :)";;@Procto42;# #;"445731585862549504";https://twitter.com/jlang_04/status/445731585862549504
;2014-03-17 20:19;0;0;"“ @ packers: # Packers have signed DT Letroy Guion. Started 28 games for the # Vikings over past two seasons" who is this guy??";;@;# #;"445731191878995968";https://twitter.com/LindseyKettner/status/445731191878995968
;2014-03-17 20:13;0;0;"Letroy Guion to the Packers? Wow I never thought they would be interested in any Vikings. # NFLFreeAgency";;;#;"445729646651658240";https://twitter.com/andrew_melby_15/status/445729646651658240
;2014-03-17 20:06;1;1;"Who is this Letroy Guion guy everybody keeps talkin about that the Packers picked up???????";;;;"445727791607074816";https://twitter.com/VikingGuru/status/445727791607074816
