username;date;retweets;favorites;text;geo;mentions;hashtags;id;permalink
;2018-03-13 13:17;1;0;"Everyone is worried about Brent Celek, but Nigel Bradham Mullen is still unsigned @ SharkyMcBuckets";;@;;"973624203550363654";https://twitter.com/Phil_E_Moose/status/973624203550363654
;2018-03-13 13:14;1;1;"Watch Schwartz turn Corey Nelson into Nigel Bradham and him walk in free agency next season.";;;;"973623345483866112";https://twitter.com/GregSmallz/status/973623345483866112
;2018-03-13 13:09;1;1;"Corey Nelson means no Nigel Bradham? # EAGLES";;;#;"973622208496046081";https://twitter.com/PHLSportsFan/status/973622208496046081
;2018-03-13 13:07;0;0;"The two best ILBs are still available and that is probably the biggest need right now on defense. Those names are Avery Williams and Nigel Bradham. Both are very good, althletic LBs that can actually cover.";;;;"973621645263933441";https://twitter.com/just_Carner/status/973621645263933441
;2018-03-13 13:07;0;0;"Nigel Bradham";;;;"973621575084896256";https://twitter.com/kentuckybekah/status/973621575084896256
;2018-03-13 13:06;1;1;"Get Nigel Bradham @ Redskins";;@;;"973621356309942272";https://twitter.com/JnoSzn/status/973621356309942272
;2018-03-13 13:05;0;8;"Nelson tem 25 anos apenas, vem para disputar posição no grupo de LBs que perdeu o Nigel Bradham para a free agency. Não conhecia o jogador, mas interessante o Eagles reforçar a posição, ainda mais com um jogador novo. Amigo @ Broncos_Br pode nos dizer mais sobre ele?";;@;;"973621179771686912";https://twitter.com/EaglesInsiderBR/status/973621179771686912
;2018-03-13 13:05;0;2;"LB- Nigel Bradham OL- Cameron Fleming/Chris Hubbard CB-Nickell Robey Coleman";;;;"973621163921498113";https://twitter.com/ChosenRosenNYG/status/973621163921498113
;2018-03-13 12:56;2;4;"jags need to complete that linebacker group by signing another nole @ NigelBradham_13";;@;;"973618920828612608";https://twitter.com/blankenstrips/status/973618920828612608
;2018-03-13 12:45;1;2;"Key free agents signed by Super Bowl champion Eagles: Nick Foles, LaGarrette Blount, Alshon Jeffery, Torrey Smith, Brandon Brooks, Stefen Wisnieski, Chris Long, Nigel Bradham, Malcolm Jenkins, Rodney McLeod and Patrick Robinson.";;;;"973616170153766912";https://twitter.com/PackersNotes/status/973616170153766912
;2018-03-13 12:45;0;0;"@ JohnMurphyShow @ Dajones19 Thought about bringing back Zach Brown or Nigel Bradham? # GoBills";;@ @;#;"973616100951937024";https://twitter.com/tgart84/status/973616100951937024
;2018-03-13 12:38;1;1;"@ Giants please sign Nigel Bradham and some offensive lineman please";;@;;"973614284939939841";https://twitter.com/emvee94/status/973614284939939841
;2018-03-13 12:32;0;0;"Lol I don’t have any doubt of that. With Marcus and lewan both having huge deals coming up our cap is gonna shrink quick. But signing guys like Nigel bradham/sitton/Pugh aren’t going to break the bank. I mean even some visits getting set up would be nice";;;;"973612816639909888";https://twitter.com/cflatland96/status/973612816639909888
;2018-03-13 12:24;0;1;"@ SeanPayton @ Saints Suh is going to eat our entire cap!! Get Graham and Nigel Bradham instead!!";;@ @;;"973610710197452800";https://twitter.com/SeanGros/status/973610710197452800
;2018-03-13 12:19;0;1;"We need to hurry up and resign Nigel Bradham";;;;"973609601429065730";https://twitter.com/Who_MikeyJ/status/973609601429065730
;2018-03-13 12:19;0;0;"Bruh if they dont resign @ NigelBradham_13 we gone have problems # SignBradham";;@;#;"973609535079436289";https://twitter.com/KdWatTheyCallMe/status/973609535079436289
;2018-03-13 12:18;0;10;"Resign Nigel bradham and we’re going back to back";;;;"973609354606899200";https://twitter.com/AtnsMM/status/973609354606899200
;2018-03-13 12:17;0;1;"For me, sign Nigel Bradham at the right cost and go for 2nd-3rd tier FAs.";;;;"973609108799705089";https://twitter.com/brandonjcookie/status/973609108799705089
;2018-03-13 12:11;0;6;"We’re gonna be wise and not overpay anybody because when it comes time to sign the bank over to Lewan and Marcus, we don’t wanna have to cut other valuable dudes. Having said that, I think we offer a decent deal to both Nigel Bradham and Dion Lewis. We’ll see if they bite.";;;;"973607530936061952";https://twitter.com/markcameronhall/status/973607530936061952
;2018-03-13 12:03;0;1;"Bills sign Nigel @ NigelBradham_13 hopefully https://twitter.com/4JoshReed/status/973604916290756608 …";;@;;"973605362652729344";https://twitter.com/orasheed24/status/973605362652729344
;2018-03-13 11:59;1;1;"@ ZachBrown_55 or @ NigelBradham_13. Let’s go # Bills!";;@ @;#;"973604461372428288";https://twitter.com/tgart84/status/973604461372428288
;2018-03-13 11:58;0;2;"Nigel Bradham?";;;;"973604113891160065";https://twitter.com/lmaowain/status/973604113891160065
;2018-03-13 11:54;0;1;"Nigel Bradham";;;;"973603188354908160";https://twitter.com/98Abdi/status/973603188354908160
;2018-03-13 11:51;0;2;"Nigel Bradham would be a nice pick up for the # Jaguars";;;#;"973602548673282049";https://twitter.com/MadisonBehrens/status/973602548673282049
;2018-03-13 11:45;0;1;"Gosto do Graham, mas tá pedindo demais. Por mim, ia de Mike Gesicki na Primeira escola, ia atrás de um ou dois Lbs na FA razoáveis, como o Christian Jones, Nigel Bradham, Tahir Whitehead, ou Anthony Hitchens, tentaria o Moncrief e com a saída do Breuax ia atrás do Aaron Colvin.";;;;"973600826961874946";https://twitter.com/Heitortullionp/status/973600826961874946
;2018-03-13 11:39;0;0;"Sheldon Richardson Trumaine Johnson Malcom butler Nigel Bradham Poe breeland eifert so many !!! https://twitter.com/mike__215/status/973598621924028416 …";;;;"973599448650715142";https://twitter.com/mike__215/status/973599448650715142
;2018-03-13 11:38;0;0;"All I need is Nigel bradham";;;;"973599314244177921";https://twitter.com/josh_grizlyberk/status/973599314244177921
;2018-03-13 11:35;0;0;"Nigel Bradham to replace him?";;;;"973598379262599168";https://twitter.com/JMaddox221/status/973598379262599168
;2018-03-13 11:33;0;0;"I think the biggest problem that plagues the front seven is their inability to cover. Signing Nigel Bradham would help to solve that problem.";;;;"973597921395576832";https://twitter.com/RBrindisi12/status/973597921395576832
;2018-03-13 11:29;0;0;"@ NigelBradham_13 you wanna win a few more rings and solidify your legacy? You should stay in Philly homie, we NEED you here.";;@;;"973596998959058945";https://twitter.com/LordUnger94/status/973596998959058945
;2018-03-13 11:22;0;0;"Goodness. This spells the end of @ NigelBradham_13 in Philly. We’ll miss you! https://twitter.com/TerezPaylor/status/973552001912012801 …";;@;;"973595172603879424";https://twitter.com/WesP03/status/973595172603879424
;2018-03-13 11:20;0;2;"Some guys that might be lower in the Market the raiders should be in on Morgan Burnett Nigel Bradham EJ Gaines Rashan Melvin Kenny Vaccaro Zach Line Prince Amukamara Eric Reid Adrian Clayborn Avery Williamson Cameron Flemming Terrell Pryor";;;;"973594638517813248";https://twitter.com/fallonator007/status/973594638517813248
;2018-03-13 11:19;0;0;"ILB is a need now for the bears. Nigel Bradham would be a great addition. There will be options through first 3 rds to address need in the draft. Roquan Smith, Tremaine Edmunds, Vander Esch, Malik Jefferson, Rashaan Evans. # bears";;;#;"973594304806563840";https://twitter.com/FreenationDre/status/973594304806563840
;2018-03-13 11:18;0;1;"Isn't Nigel bradham gonna be on the free agency";;;;"973594136858320898";https://twitter.com/Wavyy99/status/973594136858320898
;2018-03-13 11:18;0;1;"I wonder if Hicks played a full season, would we care that much about Nigel Bradham? # EaglesTalk";;;#;"973594091186475008";https://twitter.com/CrazyCurtPhilly/status/973594091186475008
;2018-03-13 11:17;0;0;"This would be awesome!";;;;"973593867818799104";https://twitter.com/ddool002/status/973593867818799104
;2018-03-13 11:15;0;0;"@ NigelBradham_13 come back";;@;;"973593286102454273";https://twitter.com/JordanTannerr/status/973593286102454273
;2018-03-13 11:14;0;0;"If only we could just keep @ NigelBradham_13";;@;;"973593185367797760";https://twitter.com/The_BuenoLife/status/973593185367797760
;2018-03-13 11:14;3;0;"We need to make right what Rex wronged and bring @ NigelBradham_13 home to buffalo !!";;@;;"973593038143582209";https://twitter.com/Hammy_Cuts/status/973593038143582209
;2018-03-13 11:11;0;0;"Why can't they go after a LB also you have Preston Brown out there Nigel Bradham. Sure you could get one for about 3 mil a year.";;;;"973592288382390272";https://twitter.com/nscott70/status/973592288382390272
;2018-03-13 11:07;0;3;"Eagles also could lose Patrick Robinson, Nigel Bradham, Bennie Logan, Vinny Curry, and have already lost Trey Burton. It's March 13th. We all need to calm down";;;;"973591434459779073";https://twitter.com/TheFalcoholic/status/973591434459779073
;2018-03-13 10:59;0;0;"@ incarceratedbob whatcha got on Nigel Bradham? Buffalo reunion?";;@;;"973589482355249154";https://twitter.com/Grimm314/status/973589482355249154
;2018-03-13 10:59;0;1;"Suh still needs to be cut Wilkerson def gonna get overpaid DRC is good depth ————————————- Nigel Bradham Trumaine Johnson Zack Martin would be great";;;;"973589464055468033";https://twitter.com/TeufelTitan09/status/973589464055468033
;2018-03-13 10:56;0;1;"They’re right at the end of their cap room lmao... forget Suh, they better go get Nigel Bradham back before we snatch him up";;;;"973588532387295232";https://twitter.com/_ChillyCom/status/973588532387295232
;2018-03-13 10:54;0;0;"Hopefully Nigel Bradham is next https://twitter.com/adamschefter/status/973553549635407872 …";;;;"973588240837038081";https://twitter.com/adam_boyce01/status/973588240837038081
;2018-03-13 10:52;0;6;"Nelson won't be there at 8, but we can sign a LB like Nigel Bradham and get another defensive need at 8.";;;;"973587499242147841";https://twitter.com/teedoteop/status/973587499242147841
;2018-03-13 10:50;0;0;"pic.twitter.com/2JO6xSJl7F";;;;"973587079514017793";https://twitter.com/dollarsboyy/status/973587079514017793
;2018-03-13 10:48;1;3;"My FA wishlist as of 11:45AM on 3/13/2018 (no particular order): 1) EJ Gaines 2) John Brown 3) Justin Pugh 4) Josh Sitton 5) Chris Hubbard 6) Ross Cockrell 7) Taylor Gabriel 8) Jack Mewhort 9) Ryan Jensen 10) Alex Okafor 11) Avery Williamson 12) Nigel Bradham";;;;"973586720506699777";https://twitter.com/KSIXI/status/973586720506699777
;2018-03-13 10:47;0;14;"Sign Nigel Bradham, draft Baker Mayfield and then bring in Donte Whitner for a tryout before cutting him 30 seconds in and I'll guarantee a Bills Super Bowl win.";;;;"973586398719639552";https://twitter.com/PatMoranTweets/status/973586398719639552
;2018-03-13 10:44;0;5;"Dion Lewis Malcolm Butler (if price isn't too high) Nigel Bradham";;;;"973585694152159233";https://twitter.com/showltee/status/973585694152159233
;2018-03-13 10:44;0;2;"Want the Bills to Sign Nigel Bradham";;;;"973585651911266304";https://twitter.com/David_F_Ladies/status/973585651911266304
;2018-03-13 10:44;0;1;"Nigel Bradham...";;;;"973585540795830273";https://twitter.com/ArturBellini1/status/973585540795830273
;2018-03-13 10:41;2;43;"Waiting for that " @ NigelBradham_13 returns to Buffalo" Tweet like... pic.twitter.com/YasB1haWpD";;@;;"973584720364752896";https://twitter.com/AshleyPetty_/status/973584720364752896
;2018-03-13 10:40;0;11;"Burton signing elsewhere doenst bother me. Its good for him. But @ NigelBradham_13 needs to come home right now";;@;;"973584545009356800";https://twitter.com/thomasrp93/status/973584545009356800
;2018-03-13 10:38;0;1;"Chargers need to get Zach Brown, Avery Williamson, demario Davis, Nigel Bradham or Preston brown";;;;"973584154221670401";https://twitter.com/CuckmySock/status/973584154221670401
;2018-03-13 10:37;1;0;"Some of the players I'd be down with for the # Saints: # FreeAgency TE: Jimmy Graham CB: DRC Malcolm Butler Aaron Colvin WR: Donte Moncrief OL: Senio Kelemete DE: Alex Okafor Vinny Curry S: Tyrann Mathieu LB: Nigel Bradham";;;# #;"973583911346372608";https://twitter.com/RaymondTylerM/status/973583911346372608
;2018-03-13 10:37;1;2;"Preston Smith Nigel Bradham Zach Brown Ryan Kerrigan and we got Mason Foster that would be a scary Linebacker core! https://twitter.com/redskinstoday_/status/973577572285079553 …";;;;"973583831369486337";https://twitter.com/sneakerabe/status/973583831369486337
;2018-03-13 10:34;0;0;"If Redskins don’t sign Nigel Bradham we ain’t tryna improve on defense";;;;"973583095801827328";https://twitter.com/CobyxJets/status/973583095801827328
;2018-03-13 10:33;0;18;"I haven't seen anything about Nigel Bradham anywhere. That's the one free agent I've been really hoping to see the BIlls sign/bring back. He and Milano on the outside... # Sheesh.";;;#;"973582939190636544";https://twitter.com/PatMoranTweets/status/973582939190636544
;2018-03-13 10:31;0;0;"Dont try to tell me ZB is better than Nigel Bradham";;;;"973582309898276864";https://twitter.com/CKuzinz/status/973582309898276864
;2018-03-13 10:31;0;0;"Nigel bradham?";;;;"973582274104053761";https://twitter.com/Jhook_83/status/973582274104053761
;2018-03-13 10:24;2;2;"# Redskins Nigel Bradham > Zach Brown";;;#;"973580583388565504";https://twitter.com/Clark_Long/status/973580583388565504
;2018-03-13 10:22;0;1;"Proud Chiefs fan moment.";;;;"973580145868115970";https://twitter.com/WisemanMBrett/status/973580145868115970
;2018-03-13 10:19;1;1;"Seriously though, if we don’t sign Nigel Bradham I’m going to lose it";;;;"973579346882498561";https://twitter.com/_CodyStewart/status/973579346882498561
;2018-03-13 10:19;0;0;"I hope this means the @ Eagles can sign Patrick Robinson or Nigel Bradham or both! If both leave then maybe Trey Burton???? https://twitter.com/fieldyates/status/973555291550879745 …";;@;;"973579299033841665";https://twitter.com/d_dymondjr/status/973579299033841665
;2018-03-13 10:15;1;0;"@ Patricia_Traina any news on Giants overspending for Nigel Bradham 10mil+ a year and Pugh for 10 mil a year?";;@;;"973578426199179264";https://twitter.com/Mike_Melchione/status/973578426199179264
;2018-03-13 10:15;0;0;"Nigel bradham next @ buffalobills";;@;;"973578410655207425";https://twitter.com/Mccoyformvp/status/973578410655207425
;2018-03-13 10:13;0;0;"I look for the Bengals to make a splash in the free agent market by picking up a linebacker. Preston Brown, Tahir Whitehead, Nigel Bradham, and Anthony Hitchens should be on their radar.. Go Bengals ! # WhoDey # Bengalspic.twitter.com/Oo0CxfmuJ3";;;# #;"973577697883500544";https://twitter.com/bjmcphillips65/status/973577697883500544
;2018-03-13 10:12;0;0;"@ RapSheet @ AdamSchefter @ MikeGarafolo any update on Patrick Robinson, Nigel Bradham and Legarette Blount for us Eagles fans guys?";;@ @ @;;"973577622897741825";https://twitter.com/AChez22/status/973577622897741825
;2018-03-13 10:12;44;111;"# Redskins are interested in Free Agent LB Nigel Bradham, who just won a superbowl with the # Eagles.";;;# #;"973577572285079553";https://twitter.com/redskinstoday_/status/973577572285079553
;2018-03-13 10:10;0;0;"Eagles free agency updates: Market for Nigel Bradham set; one less potential Nick Foles suitor http://iphillysports.com/2018/03/13/eagles-free-agency-updates-market-for-nigel-bradham-set-one-less-potential-nick-foles-suitor-2/ …";;;;"973577056297603072";https://twitter.com/iPhillySports/status/973577056297603072
;2018-03-13 10:10;0;1;"#1 right now is Nigel Bradham. Need a LB who can cover and compliment Blake Martinez the Thumper. Bradham played under Pettine in Buffalo. At corner I'd much rather sign 2-3 B level guys, Claiborne/Amukamara etc. Depth at CB is an embarrassment right now. Need bodies!!!";;;#1;"973576979462131713";https://twitter.com/TFG_Football/status/973576979462131713
;2018-03-13 10:07;1;6;"Free Agents (or soon to be) that I want. I’m not familiar with many OL FA’s: 1.) Tyran Mathieu 2.) Nigel Bradham 3.) Zach Brown";;;;"973576370067525634";https://twitter.com/MlllKE/status/973576370067525634
;2018-03-13 10:05;0;0;"I’d be shocked if Nigel Bradham doesn’t come back to Philly";;;;"973575781812199424";https://twitter.com/kev___215/status/973575781812199424
;2018-03-13 10:04;0;0;"Perfect offseason from here: Sign jack Mewhort, Cameron Fleming and/or Justin Pugh, Nigel Bradham, Aaron Colvin Resign: Darkwa, Kennard Cockerell to team friendly deals Draft: 1st Saquon Barkley, 2nd Will Hernandez, Big Wr";;;;"973575472792686592";https://twitter.com/Ch33ma_Yousuf/status/973575472792686592
;2018-03-13 09:57;3;21;"Ex-Eagles LB Nigel Bradham at #29. Often the only true 'backer on the field when Philly went to its dime base with Malcolm Jenkins as the moneybacker. Does everything at an above-average level. Some linebackers are tackle stat grabbers; Bradham's numbers are for real.";;;#29;"973573851324928001";https://twitter.com/BR_DougFarrar/status/973573851324928001
;2018-03-13 09:56;0;0;"9 mil a year for hitchens? Well it’s been a great time, but have a nice career @ NigelBradham_13 you’ll ball out anywhere you go";;@;;"973573425078861824";https://twitter.com/stephenm255/status/973573425078861824
;2018-03-13 09:55;0;0;"You belong in midnight green!! Wish you the best no matter where you go but I still have hope you'll be here next season. Lets do it again";;;;"973573271714222082";https://twitter.com/D_D_Dio/status/973573271714222082
;2018-03-13 09:53;0;0;"Browns should be targeting Nigel Bradham from Philly";;;;"973572696150814720";https://twitter.com/SaviorCle/status/973572696150814720
;2018-03-13 09:46;0;0;"eagles went out and got Alston Jeffrey, Nigel bradham, Darby and foles in last couple years.. So yeah";;;;"973571089824669696";https://twitter.com/CordHarden_32/status/973571089824669696
;2018-03-13 09:46;1;0;"If the birds don’t resign Nigel Bradham with this more relaxed cap space, there’s gonna be problems";;;;"973570969104277504";https://twitter.com/dilfnation2/status/973570969104277504
;2018-03-13 09:41;0;0;"Few players given limited cap I think the Giants should kick tires on the defensive side of the ball and add starters and depth: Alex Okafor Aaron Lynch Tamba Hali Trent Murphy Junior Galette Zach Brown Demario Davis Preston Brown Nigel Bradham Tahir Whitehead (Cont.)";;;;"973569630039150597";https://twitter.com/themaj381/status/973569630039150597
;2018-03-13 09:40;0;0;"@ DougAndGator971 I’m ok with the lions signing Demarco Murray for 1 or 2 years but they better make sure they draft a stud RB then. Suprised they haven’t shown any interest in Carlos Hyde yet? Also if lions let Tahir go would love for them to get in on Nigel Bradham from Philly!";;@;;"973569539500847104";https://twitter.com/AndrewBuris/status/973569539500847104
;2018-03-13 09:35;4;26;"At this point my top priority is improving our pathetic inside LB’s. My top FA’s are Nigel Bradham and Avery Williamson. Would love to land both. Not as worried about OL as much. Amazing what a good coaching staff with a different scheme can do. # ColtsNation # Colts";;;# #;"973568319725932544";https://twitter.com/4theShoe/status/973568319725932544
;2018-03-13 09:29;0;0;"I know they are getting closer to being under the cap. Does that include $$ available to get Patrick Robinson and/or Nigel Bradham resigned if those are priority Free Agents?";;;;"973566821960908801";https://twitter.com/RyanBoyer11/status/973566821960908801
;2018-03-13 09:27;0;9;"Nigel Bradham on the Lions radar?? @ LLamorandier also how realistic is it for the first 3 picks to be Landry, Chubb/Michel and Jerome Baker from Ohio State";;@;;"973566300781010944";https://twitter.com/3kingjames23/status/973566300781010944
;2018-03-13 09:20;0;2;"@ eagles need to re-sign Nigel bradham";;@;;"973564571188449281";https://twitter.com/trat_daddy9/status/973564571188449281
;2018-03-13 09:19;0;12;"Malcom Butler and Nigel Bradham. You missed 2 studs";;;;"973564140882194433";https://twitter.com/JooVict41286891/status/973564140882194433
;2018-03-13 09:15;2;10;"Or they could free up that money and use it to extend BG or Nigel Bradham. Goes way behind breaking even at this point. https://twitter.com/eliotshorrparks/status/973558954470014977 …";;;;"973563090217459713";https://twitter.com/LiamJenkins21/status/973563090217459713
;2018-03-13 09:13;0;0;"He’s my dream signing for this offseason. Hasn’t been great in coverage but excellent against the run. Would love him as my ILB. Nigel Bradham is also up there for me.";;;;"973562726399270912";https://twitter.com/TheBuffaloBro/status/973562726399270912
;2018-03-13 09:10;0;2;"Right. It helps you get $ to spend on someone like Patrick Robinson, Nigel Bradham.";;;;"973561916571488256";https://twitter.com/DiBiSportsTalk/status/973561916571488256
;2018-03-13 09:08;0;3;"@ buffalobills @ JeremyWGR now get me Nigel Bradham and a competent Qb to back/teach Rosen and I'd call this off-season a success!!! # GoBills";;@ @;#;"973561463657910272";https://twitter.com/bigmikebillzfan/status/973561463657910272
;2018-03-13 09:03;0;1;"Cue @ NigelBradham_13 back to Buffalo tweet ;) https://twitter.com/salsports/status/973558213722476544 …";;@;;"973560075154481152";https://twitter.com/the_hard_t/status/973560075154481152
;2018-03-13 09:01;0;0;"@ NigelBradham_13";;@;;"973559577768849408";https://twitter.com/MaadDad57/status/973559577768849408
;2018-03-13 08:57;0;1;"Nigel Bradham!!! Come On Guy´s sign Nigel an bring him back! # Bills";;;#;"973558689851494400";https://twitter.com/BSG1966Tomy/status/973558689851494400
;2018-03-13 08:56;0;2;"Nigel Bradham, comin in hot.";;;;"973558416865218560";https://twitter.com/itsbabydom/status/973558416865218560
;2018-03-13 08:55;0;0;"Eagles free agency updates: Market for Nigel Bradham set; one less potential Nick Foles suitor http://iphillysports.com/2018/03/13/eagles-free-agency-updates-market-for-nigel-bradham-set-one-less-potential-nick-foles-suitor/ …";;;;"973558173050253312";https://twitter.com/iPhillySports/status/973558173050253312
;2018-03-13 08:55;0;5;"Well now we need a couple of line backers. Please get Nigel Bradham!";;;;"973558129823711232";https://twitter.com/Jesusfreak2281/status/973558129823711232
;2018-03-13 08:54;0;1;"Nigel Bradham is next ???";;;;"973557927108890629";https://twitter.com/nateosu29/status/973557927108890629
;2018-03-13 08:52;0;2;"“Ballin on a Ballard Budget” ILB FA Conclusion: I would sign 1 of these LB’s and address the position in the draft.. Avery Williamson- $6-8 mill Nigel Bradham- $6-8 mill Preston Brown- $4-5 mill Todd Davis-$3-5 mill Likely Total- $6-8 mill";;;;"973557441953763328";https://twitter.com/GeiseDerick/status/973557441953763328
;2018-03-13 08:49;0;9;"Eagles free agency updates: Market for Nigel Bradham set; one less potential Nick Foles suitor http://www.phillyvoice.com/eagles-free-agency-update-market-nigel-bradham-set-one-less-potential-nick-foles-suitor/ …";;;;"973556731073781760";https://twitter.com/JimmyKempski/status/973556731073781760
;2018-03-13 08:48;1;0;"@ fcoxx_91 @ JOEL9ONE @ brandongraham55 @ TJernigan8 @ MychalKendricks @ k_grugierhill @ NigelBradham_13 @ JordanHicks @ greengoblin @ MalcolmJenkins @ SidneyJonesIVhttps://twitter.com/mr_pjordan/status/973182491145179141 …";;@ @ @ @ @ @ @ @ @ @ @;;"973556448964874240";https://twitter.com/mr_pjordan/status/973556448964874240
;2018-03-13 08:46;0;2;"If they can somehow get Nigel bradham I’ll be so happy";;;;"973555804090650626";https://twitter.com/miaphinsfootbal/status/973555804090650626
;2018-03-13 08:44;0;0;"Haven't seen anybody report the guaranteed $$ yet, but this looks like a lucrative deal. I'm curious how it'll affect the market for Nigel Bradham, who's three years older than Hitchens. https://twitter.com/TerezPaylor/status/973552001912012801 …";;;;"973555282407317504";https://twitter.com/AaronKazreports/status/973555282407317504
;2018-03-13 08:41;1;11;"besides Brate most of the free agents I want # Saints to target (Aaron Colvin, Donte Moncrief, Trey Burton) are still available, so that's cool also monitor guys like Beau Allen, Nigel Bradham, Virgil Green, and Avery Williamson";;;#;"973554734526353408";https://twitter.com/john_siglerrr/status/973554734526353408
;2018-03-13 08:41;0;0;"And every one that hath forsaken houses, or brethren, or sisters, or father, or mother, or wife, or children, or lands, for my name's sake, shall receive an hundredfold, and shall inherit everlasting life. But many that are 1st shall be last; & the last shall be 1st Matt 19:29-30";;;;"973554698258206720";https://twitter.com/ProfessorWentz/status/973554698258206720
;2018-03-13 08:41;11;17;"Imagine how much Nigel Bradham will fetch on the open market, if Hitchens’ deal is the benchmark ... https://twitter.com/terezpaylor/status/973552001912012801 …";;;;"973554608931942405";https://twitter.com/MattLombardoPHL/status/973554608931942405
;2018-03-13 08:41;0;1;"Dontari poe, Demarcus Lawrence, Paul Richardson, OL, Nigel Bradham";;;;"973554534365777920";https://twitter.com/Grizz_716/status/973554534365777920
;2018-03-13 08:39;0;1;"“Ballin on a Ballard Budget” ILB continued: #2 Nigel Bradham- Doesn’t get talked about enough, filled in great when Hicks got hurt. Could be the off ball play making 4-3 LB colts need in Flus system. Can also play multiple positions. Only concern is turning 29. pic.twitter.com/PBMkzDsQ6I";;;#2;"973554188360802304";https://twitter.com/GeiseDerick/status/973554188360802304
;2018-03-13 08:38;1;3;"Updated Free Agency Wish List - (Defense) Edge - No one noteworthy DL - Dontari Poe Star Lotulelei Jay Bromley LB - Nigel Bradham Avery Williamson Preston Brown Devon Kennard CB - Trumaine Johnson Rashaan Melvin Nickell Robey EJ Gaines S - Not needed # Colts # FreeAgency";;;# #;"973553952754159617";https://twitter.com/amarano001/status/973553952754159617
