username;date;retweets;favorites;text;geo;mentions;hashtags;id;permalink
;2018-03-19 20:42;0;0;"I think I shed a tear when the news of your extension broke...";;;;"975910387836170241";https://twitter.com/PatrickLeipzig2/status/975910387836170241
;2018-03-19 20:11;0;0;"Tackling machine is going to be here for a while!!!";;;;"975902549147561984";https://twitter.com/mahl1334/status/975902549147561984
;2018-03-19 20:08;0;0;"Glad your back. Kick me some ass. Fly Eagles Fly.";;;;"975901984921391108";https://twitter.com/ConshyBob8/status/975901984921391108
;2018-03-19 20:08;0;0;"So Glad u stayed. Let's get another ring. # FlyEaglesFly";;;#;"975901826401951745";https://twitter.com/MAnzio77/status/975901826401951745
;2018-03-19 20:03;0;0;"Look forward to seeing you play next season";;;;"975900600947871749";https://twitter.com/bmbsqd4/status/975900600947871749
;2018-03-19 19:52;0;3;"I love Nigel Bradham! https://twitter.com/NigelBradham_13/status/975874824869466112 …";;;;"975897814667587584";https://twitter.com/Kathyinthe850/status/975897814667587584
;2018-03-19 19:00;0;0;"So stoked your back bro!!! Can’t wait til Sept 6. # FlyEaglesFly";;;#;"975884747770544128";https://twitter.com/jmargophoto/status/975884747770544128
;2018-03-19 18:55;0;0;"Big year for you this season I can feel it";;;;"975883420269268992";https://twitter.com/nancyarobinson1/status/975883420269268992
;2018-03-19 18:43;0;0;"";;;;"975880354304315392";https://twitter.com/ThisisWill__/status/975880354304315392
;2018-03-19 18:31;0;0;"My guy # flyeaglesfly";;;#;"975877448746270721";https://twitter.com/glockboyzrah/status/975877448746270721
;2018-03-19 18:30;0;0;"Awesome bro! Thanks for coming back!";;;;"975877296665038853";https://twitter.com/jtrot54/status/975877296665038853
;2018-03-19 18:28;0;0;"Dad";;;;"975876626390159362";https://twitter.com/S1cKWaRRioR/status/975876626390159362
;2018-03-19 18:23;0;0;"That would be y'alls name as a wrestling stable too";;;;"975875480141344768";https://twitter.com/KennyLeePhotos/status/975875480141344768
;2018-03-19 18:22;0;0;"Number 53 going to win Super Bowl 53. Book it!";;;;"975875135184945153";https://twitter.com/Jorgen1225/status/975875135184945153
;2018-03-19 18:22;0;0;"";;;;"975875066901729280";https://twitter.com/DakHatesPuppies/status/975875066901729280
;2018-03-19 18:21;197;1005;"flex gangpic.twitter.com/vFz3wV5BDC";;;;"975874824869466112";https://twitter.com/NigelBradham_13/status/975874824869466112
;2018-03-19 17:24;0;0;"Nigel Bradham will help him with that.";;;;"975860550549884928";https://twitter.com/thejohnnymop/status/975860550549884928
;2018-03-19 16:05;0;0;"How about Timmy Jernigan, Ronald Darby, Nigel Bradham, Patrick Robinson, and maybe throw in Chris Long, Jason Peters, and Fletcher Cox. That ought to do thanks Lou The Bucs could use some serious defensive help in the secondary and pass rush still haha";;;;"975840627010211841";https://twitter.com/clay_gilman/status/975840627010211841
;2018-03-19 14:29;0;0;"@ NigelBradham_13 Yea then we go and sign @ mosesbread72 # Wtf? # Eagles # FlyEaglesFlypic.twitter.com/hd8WvhTbom";;@ @;# # #;"975816558131007488";https://twitter.com/mr_menis/status/975816558131007488
;2018-03-19 12:34;0;0;"Eagles Sign Nigel Bradham!!! YES!!! DOUBLE MOONWALK TIME!! Mychal Kendricks On Trading Block!!! http://www.youtube.com/watch?feature=player_embedded&v=sb8tIi0mop4 …https://www.super-bowl-2018.org/eagles-sign-nigel-bradham-yes-double-moonwalk-time-mychal-kendricks-on-trading-block/ …";;;;"975787531932495872";https://twitter.com/SuperBowl2018US/status/975787531932495872
;2018-03-19 12:33;0;1;"Nigel Bradham or I’m honestly thinking that Mel Blount people have said it’s a must have card but man it’s a lot of coin for him";;;;"975787291800227847";https://twitter.com/Monsta_65/status/975787291800227847
;2018-03-19 11:09;0;0;"Doug Pederson, Carson Wentz, Nigel Bradham";;;;"975766150012338176";https://twitter.com/trequartbeasta/status/975766150012338176
;2018-03-19 09:23;0;0;"@ Eagles the amount of tweets about Nigel Bradham over the last week is despicable. Should have had a 10 game suspension last year";;@;;"975739636768215040";https://twitter.com/RoadToSix/status/975739636768215040
;2018-03-19 09:09;0;0;"Nigel Bradham talks up Jordan Hicks in a big way here. Can't wait to see them both back out there together. https://twitter.com/Eagles/status/975084855556849664 …";;;;"975735944518275072";https://twitter.com/JS_Football/status/975735944518275072
;2018-03-19 02:19;0;1;"# QJBHEROMUT18 Nigel bradham @qbjbeat @ easports_mut";;@qbjbeat @;#;"975632757379379200";https://twitter.com/MyRingerAcc_/status/975632757379379200
;2018-03-18 19:26;0;0;"Nigel Bradham re-signs!!";;;;"975528919712477184";https://twitter.com/FlyQtheMC/status/975528919712477184
;2018-03-18 17:24;0;0;"Nigel bradham and see how he plays please";;;;"975498300844425216";https://twitter.com/Joshruns26/status/975498300844425216
;2018-03-18 16:02;0;1;"Re watching the superbowl That hit @ MalcolmJenkins put on Cooks was a legit game changer What might have been missed tho was @ NigelBradham_13 rocked Brady in the ribs that same play Wake up call for the Pats They weren't ready for the fight they were already in. # FlyEaglesFly";;@ @;#;"975477545549344768";https://twitter.com/MatthewElam78/status/975477545549344768
;2018-03-18 14:48;0;0;"@ rd32_era @ greengoblin @ bbrooks_79 @ Lanejohnson65 @ MychalKendricks @ JordanHicks @ NigelBradham_13 @ fcoxx_91 @ JOEL9ONE @ TJernigan8 @ ZERTZ_86 @ KBDeuce4 @ k_grugierhill which one of y’all got PS4 and trynna fun squads on Fortnite";;@ @ @ @ @ @ @ @ @ @ @ @ @;;"975458875137839111";https://twitter.com/ZMill316/status/975458875137839111
;2018-03-18 14:10;0;2;"That is so cute";;;;"975449357733564416";https://twitter.com/Anna88460866/status/975449357733564416
;2018-03-18 14:01;3;7;"Safe to say # DougPederson was jacked to have # NigelBradham back... # FlyEaglesFly Did Someone Say Ice Cream?! # Eagles # EaglesNation # GangGreen # BleedGreen # NFL # Philly @ Eaglespic.twitter.com/GdsW89Pamd";;@;# # # # # # # # #;"975447237848420352";https://twitter.com/a2dradio_com/status/975447237848420352
;2018-03-18 12:14;0;0;"This just made my heart smile Love my team so much # FlyEaglesFly @ NigelBradham_13 @ Eagleshttps://twitter.com/corephilly/status/975148308204208128 …";;@ @;#;"975420202174337024";https://twitter.com/JamieMR612/status/975420202174337024
;2018-03-18 11:51;0;0;"Jimmy graham, y’all coulda signed Nelson or Crabtree... coulda signed Vinny Curry or Nigel Bradham... y’all shoulda signed Cousins https://twitter.com/chrisplollar/status/975375038399614976 …";;;;"975414282887327745";https://twitter.com/brother_ALi72/status/975414282887327745
;2018-03-18 11:32;0;1;"@ Flyerfn4lif @ artay3 @ Jaywalkin33";;@ @ @;;"975409575733219328";https://twitter.com/Gentilea10A/status/975409575733219328
;2018-03-18 10:59;0;1;"I don't know what the hell he just said but Lane and Ertz Contract restructure allows the eagles to give them a full roster bonus for 2018 and count minimum against the cap. Nigel bradham contract (5 year/40 mill) counts for only 2 mill against the cap.";;;;"975401409398030337";https://twitter.com/alekstamnes/status/975401409398030337
;2018-03-18 10:13;0;0;"@ QJBeat @ EASPORTS_MUT # QJBHeroMUT18 Nigel Bradham";;@ @;#;"975389820867481600";https://twitter.com/JayJayPond/status/975389820867481600
;2018-03-18 07:24;0;0;"Nigel Bradham Interview https://fb.me/1N3n3WFTa";;;;"975347279422001152";https://twitter.com/phillybldgreen/status/975347279422001152
;2018-03-18 06:30;0;37;"The Flyers rally late for a much-needed win, Jake Arrieta throws a simulated game, Nigel Bradham lauds a former teammate, and more in Wake Up Call. https://spark.adobe.com/page/4KTCk914bJlFw/ …";;;;"975333495068413953";https://twitter.com/NBCSPhilly/status/975333495068413953
;2018-03-18 06:15;1;3;"http://www.phillypressboxradio.com # Flyers score 3 late, win # Phillies @ JArrieta34 impresses in 1st simulated action. @ NigelBradham_13 returns to # Eagles to organized chaos # villanovabball rolls @ DonteDivincenzo @ MikalBridges. @ Chet_JimChesko @ FredHugo_ @ jqydella @ denmal56 @ bobsullivan00pic.twitter.com/8QK4xDfp8r";;@ @ @ @ @ @ @ @ @;# # # #;"975329900730159104";https://twitter.com/PhillyPressbox/status/975329900730159104
;2018-03-18 01:42;0;1;"This is my best friend Dance. Watched almost every @ Eagles game together during their championship run. @ cj_wentz @ MalcolmJenkins @ TheWorldof_AJ @ LG_Blount @ nelsonagholor @ brandongraham5 @ mackhollins @ NigelBradham_13 @ JOEL9ONEpic.twitter.com/hOsK1s8qIJ";;@ @ @ @ @ @ @ @ @ @;;"975261070603571200";https://twitter.com/bubbehs_revenge/status/975261070603571200
;2018-03-17 23:39;0;0;"@ QJBeat @ EASPORTS_MUT Nigel Bradham please";;@ @;;"975230300774129664";https://twitter.com/gpstuhler/status/975230300774129664
;2018-03-17 23:20;0;0;"Nigel bradham";;;;"975225288811470849";https://twitter.com/Joshruns26/status/975225288811470849
;2018-03-17 21:39;0;0;"@ QJBeat QJB can you give me the Mut Hereo Nigel Bradham";;@;;"975199965701136384";https://twitter.com/Jackhog92119174/status/975199965701136384
;2018-03-17 21:37;0;0;"Hey man would you take Nigel bradham or Derrick brooks at rolb";;;;"975199525752238086";https://twitter.com/justinlanebeard/status/975199525752238086
;2018-03-17 21:30;0;2;"Nigel Bradham - 4th round Jay Ajayi - 5th round Jason Kelce - 6th round Jalen Mills - 7th round Rodney McLeod - UDFA Jason Peters - UDFA Corey Clement - UDFA Don’t think you can’t find players late in the draft that can help you win a Super Bowl. # Eagles";;;#;"975197757525733382";https://twitter.com/j_ladrae/status/975197757525733382
;2018-03-17 20:48;0;0;"Eagles insider Dave Spadaro sits down with LB Nigel Bradham about winning the Super Bowl, http://youtu.be/o4Z6OKUKg4I?a";;;;"975187038935728128";https://twitter.com/bonemiso/status/975187038935728128
;2018-03-17 20:30;0;0;"Me gustó un video de @ YouTube http://youtu.be/NfIjfqBh8bE?a Eagles One-On-One: LB Nigel Bradham (3/15/18)";;@;;"975182620467150849";https://twitter.com/TheJonathanJVP/status/975182620467150849
;2018-03-17 20:20;0;0;"@ YaBoySavage_ this new Nigel Bradham has 92 zone too pic.twitter.com/3qj7EP3f0Y";;@;;"975180118799896576";https://twitter.com/shanepearson924/status/975180118799896576
;2018-03-17 20:08;0;0;"Nigel Bradham";;;;"975177182833184768";https://twitter.com/OmearaAidan/status/975177182833184768
;2018-03-17 20:00;0;0;"@ cj_wentz @ NFoles_9 @ Lanejohnson65 @ ZERTZ_86 @ brandongraham55 @ greengoblin @ NigelBradham_13 @ CoreyClement_6 The Greatest Movie Ever Madepic.twitter.com/WnBv4YBgiK";;@ @ @ @ @ @ @ @;;"975175068060913664";https://twitter.com/CP1er/status/975175068060913664
;2018-03-17 19:06;0;0;"@ NigelBradham_13 so happy we signed my Goon back. Dude is a savv";;@;;"975161424753274881";https://twitter.com/Tramz31/status/975161424753274881
;2018-03-17 19:04;0;0;"Nigel bradham";;;;"975160896229203968";https://twitter.com/Joshwilson84/status/975160896229203968
;2018-03-17 18:49;0;0;"Fantastic!";;;;"975157176888168449";https://twitter.com/tarmac05/status/975157176888168449
;2018-03-17 18:12;0;2;"Love that freakin guy! # Overqualified # DougieP";;;# #;"975147828380127232";https://twitter.com/fooch2132/status/975147828380127232
;2018-03-17 17:55;0;4;"I love how Doug tickles him.";;;;"975143681153032192";https://twitter.com/Tangaroo215/status/975143681153032192
;2018-03-17 17:50;0;1;"He looked more sharp wearing a # Bills jersey. # BillsMafia";;;# #;"975142370621771776";https://twitter.com/jkflesh/status/975142370621771776
;2018-03-17 17:46;0;1;"@ NigelBradham_13 gotta love this team.";;@;;"975141238205763584";https://twitter.com/glennc1111/status/975141238205763584
;2018-03-17 17:45;0;1;"Bills fan here but that is cool as F! That’s the unity teams strive for!";;;;"975141006977970181";https://twitter.com/pokerh8r/status/975141006977970181
;2018-03-17 17:43;0;1;"@ kyle55braxton";;@;;"975140701242609665";https://twitter.com/gloomysmitty/status/975140701242609665
;2018-03-17 17:41;0;1;"@ BarryCorrigan13";;@;;"975140149058326529";https://twitter.com/scoobybyrne/status/975140149058326529
;2018-03-17 17:36;0;12;"And Doug giving him a rib shot love right there";;;;"975138831769985027";https://twitter.com/abounasis67/status/975138831769985027
;2018-03-17 17:31;1;10;"So awesome ...love this team";;;;"975137542684192770";https://twitter.com/TheBigRagu215/status/975137542684192770
;2018-03-17 17:13;1;3;"Exactly how we all felt @ NigelBradham_13 # FlyEaglesFlyhttps://twitter.com/the_haan/status/975123206947262464 …";;@;#;"975132943751368704";https://twitter.com/CarlosRod_02/status/975132943751368704
;2018-03-17 16:04;0;1;"RT @ AlbertBreer: Going thru some deals, smart one by the Eagles for LB Nigel Bradham. Only $8 million fully guaranteed, $6 million in 2018 and $14 in first two years. So they have flexibility with a very good player. Deal is basically year-to-year.";;@;;"975115672224194560";https://twitter.com/footballr_at/status/975115672224194560
;2018-03-17 15:39;0;2;"I’m a pretty huge fan of that Nigel Bradham guy";;;;"975109332026077184";https://twitter.com/JBlauv/status/975109332026077184
;2018-03-17 15:13;33;80;"Going thru some deals, smart one by the Eagles for LB Nigel Bradham. Only $8 million fully guaranteed, $6 million in 2018 and $14 in first two years. So they have flexibility with a very good player. Deal is basically year-to-year.";;;;"975102784918999047";https://twitter.com/AlbertBreer/status/975102784918999047
;2018-03-17 14:22;0;3;"Nigel Bradham took less money to stay in Philly. What a bro.";;;;"975090072285573120";https://twitter.com/EaglesMonkey/status/975090072285573120
;2018-03-17 14:21;0;0;"@ QJBeat @ EASPORTS_MUT # qjbheromut18 Nigel Bradham";;@ @;#;"975089679740489728";https://twitter.com/KillerKam200O/status/975089679740489728
;2018-03-17 14:02;165;839;"LB Nigel Bradham discusses his decision to return to the # Eagles and much more in his sit-down interview with @ EaglesInsider. # FlyEaglesFlypic.twitter.com/leSiuU8lH2";;@;# #;"975084855556849664";https://twitter.com/Eagles/status/975084855556849664
;2018-03-17 13:06;0;0;"Can you correct the Nigel Bradham deal since new details have it very team friendly? Howie stole him.";;;;"975070774712250368";https://twitter.com/pecor_matthew/status/975070774712250368
;2018-03-17 12:38;0;0;"Eagles say Nick Foles Is Worth More Than The Bradford Trade…Nigel Bradham Gone? Response Videos!!! https://www.super-bowl-2018.org/eagles-say-nick-foles-is-worth-more-than-the-bradford-trade-nigel-bradham-gone-response-videos/ …pic.twitter.com/yh5bmt6vXz";;;;"975063944464347141";https://twitter.com/SuperBowl2018US/status/975063944464347141
;2018-03-17 12:33;0;0;"Percy harvin the only Gator i fuck with and Nigel Bradham the only Seminole i fuck with...";;;;"975062696302432256";https://twitter.com/1MrOooWee/status/975062696302432256
;2018-03-17 12:32;0;0;"Nigel Bradham praises Eagles for standing by him through tough times https://usat.ly/2FMgoxG via @ theeagleswire";;@;;"975062423425159168";https://twitter.com/Smashmouth_Mo/status/975062423425159168
;2018-03-17 12:13;0;0;"Eagles One-On-One: LB Nigel Bradham (3/15/18) https://youtu.be/NfIjfqBh8bE via # FlyEaglesFly";;;#;"975057565670395905";https://twitter.com/1933Eagles/status/975057565670395905
;2018-03-17 12:08;0;0;"RT @ NBCSPhilly Nigel Bradham is happy to be back with the Super Bowl champs, but sad to see one of his teammates go ( @ RoobNBCS) http://www.nbcsports.com/philadelphia/eagles/bradham-re-signs-he-lauds-teammate-no-longer-here … …";;@ @;;"975056306762600448";https://twitter.com/Phillysports25/status/975056306762600448
;2018-03-17 12:05;9;72;"@ NigelBradham_13 had to make a pit stop and take a photo opt # FSU # gonolespic.twitter.com/UZo6iLvSeN";;@;# #;"975055422653632514";https://twitter.com/bmbsqd4/status/975055422653632514
;2018-03-17 11:06;10;20;"Updated --> Eagles additions: Michael Bennett, Haloti Ngata, Daryl Worley, Corey Nelson. Eagles losses: Vinny Curry, LeGarrette Blount, Brent Celek, Patrick Robinson, Trey Burton, Beau Allen, Torrey Smith, Marcus Johnson, Caleb Sturgis. Re-signed: Nigel Bradham. pic.twitter.com/qbLJ69pn5F";;;;"975040740614078465";https://twitter.com/SheilKapadia/status/975040740614078465
;2018-03-17 11:04;0;0;"Nigel Bradham's payday proof Eagles were right to stand by him http://fw.to/oO5cDmC";;;;"975040085912621056";https://twitter.com/ernestlevans/status/975040085912621056
;2018-03-17 11:01;17;168;"Nigel Bradham is happy to be back with the Super Bowl champs, but sad to see one of his teammates go ( @ RoobNBCS) http://www.nbcsports.com/philadelphia/eagles/bradham-re-signs-he-lauds-teammate-no-longer-here …";;@;;"975039434021376000";https://twitter.com/NBCSPhilly/status/975039434021376000
;2018-03-17 09:11;0;0;"@ NigelBradham_13 welcome back champ now let’s go get anther one with our new defense nicknamed by you at your resigning “Our Eagles Defense The 215 Controlled Chaos” love it # eaglesdefense215controlledchaos";;@;#;"975011692798267392";https://twitter.com/Boricua261/status/975011692798267392
;2018-03-17 08:55;77;222;"Nigel Bradham - 4th round Jay Ajayi - 5th round Jason Kelce - 6th round Jalen Mills - 7th round Rodney McLeod - UDFA Jason Peters - UDFA Corey Clement - UDFA Don’t think you can’t find players late in the draft that can help you win a Super Bowl. # Eagles";;;#;"975007688441577472";https://twitter.com/TSteegeNFL/status/975007688441577472
;2018-03-17 08:21;0;0;"I know you tried to will and dream the honey badger here like you dud with nigel bradham and his contract. I just wanna say sorry, didnt get your wish this time.";;;;"974999177485791232";https://twitter.com/DrDutchTweets/status/974999177485791232
;2018-03-17 07:32;0;1;"Eagles keeping Nigel Bradham a huge upset, but that didn’t make your so-called list.";;;;"974986811926876160";https://twitter.com/tj_furman/status/974986811926876160
;2018-03-17 07:15;0;2;"Nigel Bradham says he had confidence he would return to Eagles https://247sports.com/nfl/philadelphia-eagles/Bolt/Nigel-Bradham-says-he-had-confidence-he-would-return-to-Philadelphia-Eagles-116312496 …pic.twitter.com/lem5VvjuyL";;;;"974982429529329664";https://twitter.com/zesty_eagles/status/974982429529329664
;2018-03-17 07:09;1;0;"Nigel Bradham por mais 5 anos! Tudo apontava que o defensor dos # Eagles se tornaria livre ao final do temporada, varias equipes mostraram interesse em contar com seu jogo de imposição, porém em um sinal de respeito e gratidão ele ficará na Philadelphia. # FlyEaglesFly # NFLpic.twitter.com/B5ebA6UBCV";;;# # #;"974980945701933056";https://twitter.com/EaglesFlyers76/status/974980945701933056
;2018-03-17 06:56;0;1;"@ MikeFOX29 @ AlexHolleyFOX29 @ cj_wentz @ AO1Foundation @ ZERTZ_86 @ royalboiler @ NigelBradham_13 @ NFoles_9 @ HowieRoseman @ TheWorldof_AJ @ JoelEmbiid @ MalcolmJenkins @ mackhollins @ Rodney_McLeod4 @ fcoxx_91 Please support my GoFundMe campaign: https://www.gofundme.com/kingstaclothing-fundraising?pc=tw_co_dashboard_a&rcid=48a5fc900caf4223a060559ebc3cbfec … @ gofundmepic.twitter.com/cj10qxWDnA";;@ @ @ @ @ @ @ @ @ @ @ @ @ @ @ @;;"974977743111802880";https://twitter.com/PhilBCEO/status/974977743111802880
;2018-03-17 04:43;0;1;"Nigel Bradham contract is actually extremely team-friendly http://www.nbcsports.com/philadelphia/eagles/nigel-bradham-contract-actually-extremely-team-friendly …pic.twitter.com/7RwZIdeD0X";;;;"974944265250988032";https://twitter.com/zesty_eagles/status/974944265250988032
;2018-03-17 02:02;0;0;"Nigel Bradham Returns To Be A Part Of 'Controlled Chaos' http://ift.tt/2FVwCbo";;;;"974903682771939328";https://twitter.com/NFL_FanTeam_Ldr/status/974903682771939328
;2018-03-17 01:02;0;2;"Got Kyle Long and Nigel Bradham and they cost me about 80k. I’m very happy with the promo. I honestly think this is the perfect way to do a promo for NMS players. You gotta play some solos then spend a little coin and work the market a little to upgrade your team. Can’t complain";;;;"974888683886260229";https://twitter.com/Ty_TooFly/status/974888683886260229
;2018-03-17 00:01;0;2;"That nigel bradham got 92 zone yup hes my out of position LOLB lets eat";;;;"974873306590572545";https://twitter.com/LightningMUT/status/974873306590572545
;2018-03-16 22:27;0;0;"Nigel Bradham Returns To Be A Part Of ‘Controlled Chaos’ http://iphillysports.com/2018/03/17/nigel-bradham-returns-to-be-a-part-of-controlled-chaos-2/ …pic.twitter.com/8wSndWLzlZ";;;;"974849803036356608";https://twitter.com/iPhillySports/status/974849803036356608
;2018-03-16 22:16;0;0;"Nigel Bradham Returns To Be A Part Of 'Controlled Chaos' http://dlvr.it/QLLCSy # Eagles # NFL";;;# #;"974846805551624192";https://twitter.com/BirdGangLive/status/974846805551624192
;2018-03-16 22:13;0;0;"On the seventh day God made made Howie Roseman # NigelBradham # alshonjeffery";;;# #;"974846180332105728";https://twitter.com/LaurieFitzptrck/status/974846180332105728
;2018-03-16 22:12;0;0;"Carson Wentz. Alshon Jeffery. Lane Johnson. Jay Ajayi. Corey Clement. Zach Ertz. Brandon Graham. Derek Barnett. Nigel Bradham. Jalen Mills. Ronald Darby. Malcolm Jenkins. And they added Michael Bennett, an absolute beast. They're fine. Relax.";;;;"974845897216544768";https://twitter.com/McBrooklyn77/status/974845897216544768
;2018-03-16 21:46;0;0;"Nigel Bradham Returns To Be A Part Of 'Controlled Chaos' http://ift.tt/2IuPvQQ";;;;"974839288360833024";https://twitter.com/Flyeaglesfly81/status/974839288360833024
;2018-03-16 21:46;0;0;"Eagles, LB Nigel Bradham Agree To Terms On A Five-Year Contract http://ift.tt/2FJgI0m";;;;"974839268655947776";https://twitter.com/Flyeaglesfly81/status/974839268655947776
;2018-03-16 21:31;0;0;"I liked a @ YouTube video http://youtu.be/NfIjfqBh8bE?a Eagles One-On-One: LB Nigel Bradham (3/15/18)";;@;;"974835585583005697";https://twitter.com/THEjaycepticon/status/974835585583005697
;2018-03-16 21:14;0;1;"The eagles signed Nigel Bradham, haloti ngata, Corey Nelson while being 11m over the cap. They currently have between 7-11m in cap space. I’m not tryna here this “no way they can sign a player” https://twitter.com/milford236eagle/status/974809704147968000 …";;;;"974831242339405824";https://twitter.com/eaglesrealist/status/974831242339405824
;2018-03-16 21:02;0;0;"You could have gone with Darren Sproles or Nigel Bradham, but you went with Mack Hollins. Smh";;;;"974828240157184001";https://twitter.com/EaglesMonkey/status/974828240157184001
;2018-03-16 20:17;0;1;"I decided to get Nigel bradham to replace my 93 rolb. d. Brooks. Hope meddle works for you. It was a tough choice";;;;"974816956342652928";https://twitter.com/Azzrius/status/974816956342652928
;2018-03-16 19:08;21;85;"Eagles additions: Michael Bennett, Haloti Ngata, Daryl Worley, Corey Nelson. Eagles losses: Vinny Curry, Brent Celek, Patrick Robinson, Trey Burton, Beau Allen, Torrey Smith, Marcus Johnson, Caleb Sturgis. Re-signed: Nigel Bradham.";;;;"974799539378053120";https://twitter.com/SheilKapadia/status/974799539378053120
;2018-03-16 18:49;0;0;"@ NigelBradham_13 Thanks for re-signing Nigel. And thanks for holding the Defense together when @ JordanHicks went down. Everyone is different, and you lead this team in your way, and obviously it was effective. Can't wait til next year! @ Eagles";;@ @ @;;"974794704872263680";https://twitter.com/alexloverton/status/974794704872263680
;2018-03-16 18:39;0;0;"That Nigel Bradham is good for me . and makes most of my time go up to 96";;;;"974792402257969152";https://twitter.com/MarstheKishin/status/974792402257969152
;2018-03-16 17:39;0;0;"He wore Nigel Bradham's number? https://twitter.com/ShenkLarry/status/974668310234230790 …";;;;"974777171813326848";https://twitter.com/Jacalore/status/974777171813326848
;2018-03-16 17:38;0;0;"Haha yeah he’s a fkn beast";;;;"974777005290930176";https://twitter.com/tazzsg24/status/974777005290930176
;2018-03-16 17:33;0;0;"Trey Burton is upset the Eagles didn't go out of their way to try to prioritize keeping him a #2 TE and #3 TE (Celek). Majority of players don't know jack about the salary cap and team building. Nigel Bradham the Eagles STARTING LB is way more valuable than Celek and Burton.";;;#2 #3;"974775681581137920";https://twitter.com/richsmoothie23/status/974775681581137920
;2018-03-16 17:28;0;0;"I liked a @ YouTube video http://youtu.be/FCzhdqT6cnA?a NEW MUT HEROS! | EZEKIEL ELLIOTT AND NIGEL BRADHAM!!| MADDEN 18 ULTIMATE TEAM";;@;;"974774514138558464";https://twitter.com/MTGamer88/status/974774514138558464
;2018-03-16 17:28;0;0;"NEW MUT HEROS! | EZEKIEL ELLIOTT AND NIGEL BRADHAM!!| MADDEN 18 ULTIMATE TEAM: http://youtu.be/FCzhdqT6cnA?a via @ YouTube";;@;;"974774457548984320";https://twitter.com/MTGamer88/status/974774457548984320
;2018-03-16 17:25;0;1;"Eagles cap situation was tighter than Hawks. They restructured Zach Ertz & Lane Johnson, freed up enough cap space to sign their own FA Nigel Bradham to a 5 yr/40 mill deal and accommodate Michael Bennett's contract. Seems they're finding money to sign Dickson, Mingo, etc";;;;"974773642088386562";https://twitter.com/TahWatson/status/974773642088386562
;2018-03-16 17:15;0;0;"How could I apply for a football clinic in Chile? @ cj_wentz @ JOEL9ONE @ brandongraham55 @ Eagles @ Lanejohnson65 @ MalcolmJenkins @ MychalKendricks @ bbrooks_79 @ JasonKelce @ ZERTZ_86 @ nelsonagholor @ TheWorldof_AJ @ NFL @ nflcommish @ NigelBradham_13 @ greengoblin @ Eliel74aravena";;@ @ @ @ @ @ @ @ @ @ @ @ @ @ @ @ @;;"974771103020322816";https://twitter.com/jaimevillenad/status/974771103020322816
;2018-03-16 17:03;4;36;"Why does Nigel Bradham expect the # Eagles defense to be even better next season? @ DZangaroNBCS has the story while Quick Slants starts now on NBCSP.http://www.nbcsports.com/philadelphia/eagles/why-nigel-bradham-expects-even-better-eagles-defense …";;@;#;"974768084832616449";https://twitter.com/NBCSPhilly/status/974768084832616449
