username;date;retweets;favorites;text;geo;mentions;hashtags;id;permalink
;2018-03-14 11:16;0;8;"Another LB down: LB Nigel Bradham has re-signed with the Eagles";;;;"973956145139380224";https://twitter.com/ChargersLegion/status/973956145139380224
;2018-03-14 11:16;0;0;"Eagles re-sign LB Nigel Bradham to 5-year deal - http://ift.tt/2FUUtYM # FlyEaglesFly";;;#;"973956018446258176";https://twitter.com/PEaglesNews/status/973956018446258176
;2018-03-14 11:16;0;0;"Re-signing Bradham would have been my #1 priority for the Eagles. I'm thrilled to see him coming back! @ NigelBradham_13";;@;#1;"973955974825463810";https://twitter.com/wpshp1/status/973955974825463810
;2018-03-14 11:12;2;6;"EAGLES TRADE RUMORS: According to @ CBSSports , the # Eagles are looking to trade Mychal Kendricks after re-signing Nigel Bradham. # FlyEaglesFly # EaglesTalk # CPSpic.twitter.com/OaRT4J2fOF";;@;# # # #;"973955122777804800";https://twitter.com/CornerPubSports/status/973955122777804800
;2018-03-14 11:11;1;1;"Needed to resign @ NigelBradham_13 my guy a tank fr him next to hicks goin be nasty";;@;;"973954773765513216";https://twitter.com/Reef_Wp/status/973954773765513216
;2018-03-14 11:09;0;1;"The fact we resigned Nigel Bradham should make every NFL team run and hide. We coming for that 2peat.";;;;"973954366838321157";https://twitter.com/nellywelyy/status/973954366838321157
;2018-03-14 11:09;0;1;"Eagles, LB Nigel Bradham Agree To Terms On A Five-Year Contract http://www.philadelphiaeagles.com/news/article-1/Eagles-LB-Nigel-Bradham-Agree-To-Terms-On-A-Five-Year-Contract/efa6fdd6-93d9-4a01-8ecc-1a0016129207 …pic.twitter.com/yOMoEbVUN2";;;;"973954350052790272";https://twitter.com/zesty_eagles/status/973954350052790272
;2018-03-14 11:09;0;0;"Sports Bettings Tips NBA and NHL http://www.superparleysportspicks.com/ # NationalWalkoutDay # PiDay # WalkoutWednesday # WednesdayWisdom # NateSolder # OTRII # CarlosHyde # Ticketmaster # parkland, fl # NigelBradham";;;# # # # # # # # # #;"973954224940863488";https://twitter.com/SuperParley_De/status/973954224940863488
;2018-03-14 11:09;0;0;"Eagles, linebacker Nigel Bradham agree on 5-year deal http://twib.in/l/jrApBaL6qLGK pic.twitter.com/xsGPlQkPoR";;;;"973954209317048322";https://twitter.com/ValuBit/status/973954209317048322
;2018-03-14 11:08;0;3;"The Philadelphia Eagles Have Re-Signed Linebacker Nigel Bradham To A Long-Term Deal Of A 5 Year $40 Million Dollar Deal. # GoNoles # FSU # LBU # DoSomethingpic.twitter.com/VOUvtEracA";;;# # # #;"973953936347533314";https://twitter.com/lets_go_noles/status/973953936347533314
;2018-03-14 11:07;0;0;"Eagles re-sign LB Nigel Bradham to 5-year deal http://www.espn.com/nfl/story/_/id/22758940 …";;;;"973953651336196097";https://twitter.com/dominickevans/status/973953651336196097
;2018-03-14 11:06;1;1;"He had a down yr, this may have been the best or at the least top 3 FA lbs this yr. Was! Eagles re-signed WLB Nigel Bradham to a five-year, $40 million contract.";;;;"973953595291979776";https://twitter.com/HBogart27/status/973953595291979776
;2018-03-14 11:06;0;0;"Nigel Bradham contract amazing. There are a lot of ex bills out there getting paid or who have got paid. Meanwhile we sign 30 year olds to replace them.";;;;"973953411401093120";https://twitter.com/RichRiderNova/status/973953411401093120
;2018-03-14 11:05;0;0;"This move to keep Nigel Bradham pleases me greatly. # FlyEaglesFlyhttps://twitter.com/RapSheet/status/973911503668686848 …";;;#;"973953341842698240";https://twitter.com/mittencake/status/973953341842698240
;2018-03-14 11:04;1;2;"That's Howie Do it! Outstanding job! Eagles re-sign LB Nigel Bradham ! Details : https://zurl.co/vaBY1 # SportsSkillet # Eagles # FlyEaglesFly # NFL # NigelBradham # EaglesTalk # MychalKendricks # NFLFreeAgency # NFLFreeAgentFrenzypic.twitter.com/jupP6R5hKu";;;# # # # # # # # #;"973952936379342848";https://twitter.com/SportsSkillet/status/973952936379342848
;2018-03-14 11:04;0;0;"Eagles re-sign LB Nigel Bradham to 5-year deal http://theviralinfo.com/eagles-re-sign-lb-nigel-bradham-to-5-year-deal/ …";;;;"973952918381580299";https://twitter.com/TheViralInfo33/status/973952918381580299
;2018-03-14 11:03;0;1;"Glad to see eagles resigned Nigel Bradham we need Linebackers and he was a stud last year";;;;"973952717524750337";https://twitter.com/jrob7539/status/973952717524750337
;2018-03-14 11:03;3;2;"Eagles, linebacker Nigel Bradham agree on 5-year deal worth reported $40 million @ ap_robmaaddihttp://apne.ws/4cxPIAe";;@;;"973952662700949505";https://twitter.com/AP_NFL/status/973952662700949505
;2018-03-14 11:01;0;0;"With the # Eagles re-signing Nigel Bradham to a long-term deal today, they'll likely move on from Mychal... https://fb.me/2zYfG6FsG";;;#;"973952374627848193";https://twitter.com/Philly_Sports99/status/973952374627848193
;2018-03-14 10:59;0;0;"Eagles re-sign LB Nigel Bradham to 5-year deal http://www.friendlydb.com/item/14345361/eagles-resign-lb-nigel-bradham-to-5year-deal …";;;;"973951680986300416";https://twitter.com/MarkHigbee/status/973951680986300416
;2018-03-14 10:58;0;0;"Eagles keeping LB Nigel Bradham https://ownetech.com/eagles-keeping-lb-nigel-bradham/ …pic.twitter.com/ZnqU0X5k6M";;;;"973951443400101893";https://twitter.com/OwneTech/status/973951443400101893
;2018-03-14 10:58;0;0;"Eagles : Nigel Bradham rempile https://goo.gl/fb/VgjRZB";;;;"973951434747236354";https://twitter.com/sportnumb1/status/973951434747236354
;2018-03-14 10:58;0;0;"Can't Complain Beane Is Making The Right Moves!!! On a side note I think former Bills Player Nigel Bradham is not worth the money the Eagles Just Paid Him. I don't think he's worth it I don't think he would of ever got that type of contract here! Thoughts??";;;;"973951395455004672";https://twitter.com/Northsabrefan1/status/973951395455004672
;2018-03-14 10:57;0;1;"# Eagles re-sign LB Nigel Bradham to a 5yr deal worth 40Mil";;;#;"973951163283451905";https://twitter.com/BranchHuddle/status/973951163283451905
;2018-03-14 10:57;0;0;"Eagles : Nigel Bradham rempile http://dlvr.it/QL0pbM pic.twitter.com/ZUMgZJaPrc";;;;"973951163056844800";https://twitter.com/TDActu/status/973951163056844800
;2018-03-14 10:56;0;0;"# NationalWalkoutDay National School Walkout # PiDay Today is pi day! # walkout # WednesdayWisdom Nate Solder # OTRII Carlos Hyde Ticketmaster 19.4K Tweets parkland, fl 3,840 Tweets Nigel Bradham 7,974 Tweets # naturepic.twitter.com/7QhtDjQb1h";;;# # # # # #;"973951030743519232";https://twitter.com/youmustdo1/status/973951030743519232
;2018-03-14 10:56;0;1;"Very interested to see Nigel Bradham contract breakdown.. even w/ all the cuts # Eagles still didnt have much room. Regardless for this year solid move, was a must keep.";;;#;"973951011915206659";https://twitter.com/mysportsrumors/status/973951011915206659
;2018-03-14 10:55;0;0;"Hell Nah Nigel Bradham is already part of a Process a SB winning process https://twitter.com/bufffanatics/status/972877208552427520 …";;;;"973950874459430913";https://twitter.com/TheOnlyJuan93/status/973950874459430913
;2018-03-14 10:55;0;1;"The Super Bowl champions Philadelphia Eagles re-signed linebacker Nigel Bradham to a five-year deal worth $40 million. pic.twitter.com/L3j3ckWEI3";;;;"973950637116342274";https://twitter.com/sandropacheco71/status/973950637116342274
;2018-03-14 10:53;0;0;"@ NigelBradham_13 congrats on your 5 year deal here for thevlong haul welcome back the enforcer let's repeat this season !!! # FlyEaglesFly";;@;#;"973950343989088260";https://twitter.com/KingCrown123/status/973950343989088260
;2018-03-14 10:52;0;1;"Just hand the Eagles the Lombardi trophy now...Nigel Bradham’s back";;;;"973950068998004736";https://twitter.com/JustJasper9/status/973950068998004736
;2018-03-14 10:51;0;1;"pic.twitter.com/jjAHwehUiM";;;;"973949754450169856";https://twitter.com/TheOnlyJuan93/status/973949754450169856
;2018-03-14 10:50;1;0;"Nigel Bradham bleibt für weitere 5 Jahre beim amtierenden Super Bowl Champion! # NFLFreeAgency # WinnerWinnerChickenDinnerhttps://twitter.com/nflnetwork/status/973948037545435136 …";;;# #;"973949442998104065";https://twitter.com/W_WSportz/status/973949442998104065
;2018-03-14 10:49;0;0;"The # Eagles and LB Nigel Bradham agreed to terms on a 5 year deal worth $40M # NFLFreeAgency";;;# #;"973949199753535488";https://twitter.com/GJohal21/status/973949199753535488
;2018-03-14 10:49;1;0;"Grade for the Eagles re-signing OLB Nigel Bradham - http://walterfootball.com/freeagentsigninggrades.php …";;;;"973949184805019648";https://twitter.com/walterfootball/status/973949184805019648
;2018-03-14 10:49;0;0;"Eagles re-sign LB Nigel Bradham to 5-year deal http://dlvr.it/QL0mLx pic.twitter.com/vDp9GKjtHT";;;;"973949170242371584";https://twitter.com/surfistadem/status/973949170242371584
;2018-03-14 10:48;0;0;"@ NigelBradham_13 YES SIR!!!! Welcome back!!";;@;;"973948956014186498";https://twitter.com/Joncwilcox/status/973948956014186498
;2018-03-14 10:47;0;0;"Eagles Lock Up Nigel Bradham: Philadelphia re-signs LB Nigel Bradham to 5-year/$40M deal, will shop LB Mychal Kendricks (multiple reports) http://bleacherreport.com/articles/2406811-nigel-bradham-reportedly-re-signs-with-eagles-on-5-year-40-million-contract?share=twitter …";;;;"973948801869406208";https://twitter.com/ltf_ty/status/973948801869406208
;2018-03-14 10:47;0;0;"Eagles, LB Nigel Bradham agree to 5-year deal https://phl.today/60327/eagles-lb-nigel-bradham-agree-to-5-year-deal/ …pic.twitter.com/zSyOZr98vO";;;;"973948778796462081";https://twitter.com/215Today/status/973948778796462081
;2018-03-14 10:47;0;0;"http://imdb.to/2F0Ge4E "Nigel Bradham"";;;;"973948702602571776";https://twitter.com/anna401901/status/973948702602571776
;2018-03-14 10:46;0;0;"@ NigelBradham_13 finna workout with the receivers & pull in 10 ints next season # TodeyCalledIt";;@;#;"973948478186541058";https://twitter.com/Todey2040/status/973948478186541058
;2018-03-14 10:46;0;0;"@ NigelBradham_13 Good to have you back for years to come!! Keep up that high octane pace! # FlyEaglesFly # Repeat # back2back";;@;# # #;"973948447131750402";https://twitter.com/zmerzlikar/status/973948447131750402
;2018-03-14 10:46;25;94;"Eagles have re-signed LB Nigel Bradham to a 5yr/$40M deal # FlyEaglesFlypic.twitter.com/0XBI4SrTNF";;;#;"973948423270535168";https://twitter.com/EaglesNation113/status/973948423270535168
;2018-03-14 10:44;0;0;"NFL Free Agent Outside Linebacker Rankings updated (Eagles re-sign Nigel Bradham) - http://walterfootball.com/freeagents2018OLB.php …";;;;"973948055979470848";https://twitter.com/walterfootball/status/973948055979470848
;2018-03-14 10:44;103;465;"Nigel Bradham is staying in Philadelphia! The LB is expected to sign a 5-year, $40 million deal (via @ RapSheet).pic.twitter.com/wXVOulbaKL";;@;;"973948037545435136";https://twitter.com/nflnetwork/status/973948037545435136
;2018-03-14 10:44;0;0;"Nigel Bradham, Eagles agree on five-year, $40M deal http://fw.to/soFBF7j";;;;"973948002904756224";https://twitter.com/REG_LLC_2010/status/973948002904756224
;2018-03-14 10:43;1;2;"Yessssss RT @ Eagles: The # Eagles have agreed to terms with LB Nigel Bradham on a five-year contract. # FlyEaglesFlypic.twitter.com/U9EdDkVcq2";;@;# #;"973947675216351232";https://twitter.com/AngRenzi/status/973947675216351232
;2018-03-14 10:43;1;1;"Bruh idk what Howie doing but we keep Nigel Bradham, get Micheal Bennet and Hali Ngata (sp)... to add to a defense where we really didn’t lose anyone I say good chance to repeat";;;;"973947652512600065";https://twitter.com/MrCoolYNC/status/973947652512600065
;2018-03-14 10:43;0;0;"Source: Eagles keep LB Nigel Bradham https://www.worldsitenews.com/source-eagles-keep-lb-nigel-bradham/ …";;;;"973947645457829888";https://twitter.com/worldsitenews/status/973947645457829888
;2018-03-14 10:43;0;0;"Source: Eagles keep LB Nigel Bradham https://www.worldsitenews.com/source-eagles-keep-lb-nigel-bradham/ …";;;;"973947641758408705";https://twitter.com/Siddharthjrs/status/973947641758408705
;2018-03-14 10:42;0;0;"Eagles re-sign LB Nigel Bradham to 5-year deal http://ift.tt/2FI0SCW";;;;"973947431137304576";https://twitter.com/1arimoney/status/973947431137304576
;2018-03-14 10:42;0;0;"OFFICIAL: Eagles sign Nigel Bradham to five-year contract https://www.bleedinggreennation.com/2018/3/14/17119274/nigel-bradham-eagles-contract-details-linebacker-philadelphia-mychal-kendricks-trade-rumors-nfl-news?utm_campaign=bleedinggreennation&utm_content=entry&utm_medium=social&utm_source=twitter … via @ BleedingGreen";;@;;"973947407561101312";https://twitter.com/nearandfarce/status/973947407561101312
;2018-03-14 10:42;0;0;"Eagles re-sign LB Nigel Bradham to 5-year deal http://dlvr.it/QL0k6F";;;;"973947387487051777";https://twitter.com/PeopleSports33/status/973947387487051777
;2018-03-14 10:42;0;0;"Eagles re-sign LB Nigel Bradham to 5-year deal http://dlvr.it/QL0jxd";;;;"973947378255347712";https://twitter.com/MarlonLane22/status/973947378255347712
;2018-03-14 10:41;1;2;"Grade’s up for Nigel Bradham, Nate Solder on the way hhttp://www.espn.com/nfl/story/_/id/22680603/2018-nfl-free-agency-grades-big-trades-signings-moves-offseason-bill-barnwell";;;;"973947138496372747";https://twitter.com/billbarnwell/status/973947138496372747
;2018-03-14 10:38;0;1;"cute & sexy hypstar's girls >> http://bit.do/hypstar2018 Carlos Hyde Ticketmaster Nate Solder Nigel Bradham parkland, fl # NationalWalkoutDay # PiDay # WalkoutWednesday # WednesdayWisdom # OTRII";;;# # # # #;"973946471589429249";https://twitter.com/Erik_Bro/status/973946471589429249
;2018-03-14 10:36;0;0;"@ NigelBradham_13 # FlyEaglesFlyhttps://twitter.com/eagles/status/973920774665981952 …";;@;#;"973945966234550272";https://twitter.com/HaySoos100/status/973945966234550272
;2018-03-14 10:35;0;2;"Best signing yet!!! This guy gets it done. @ NigelBradham_13 @ Eagles";;@ @;;"973945669273751552";https://twitter.com/eddiep9873/status/973945669273751552
;2018-03-14 10:35;2;14;"Whn you wake up to good news frm @ Eagles @ NigelBradham_13 pic.twitter.com/5RPIn7mfsH";;@ @;;"973945637749383169";https://twitter.com/day02126/status/973945637749383169
;2018-03-14 10:34;1;1;"Totally hosed on that call ... but one of the great Noles hits of all time.";;;;"973945511140102144";https://twitter.com/woodycumbie/status/973945511140102144
;2018-03-14 10:34;0;0;"Nice to see we keeping @ NigelBradham_13 congrats on the extension # FlyEaglesFlyhttps://twitter.com/Eagles/status/973920774665981952 …";;@;#;"973945430181543937";https://twitter.com/Twitch2_0/status/973945430181543937
;2018-03-14 10:32;0;0;"Nigel Bradham, Eagles agree on five-year, $40M deal http://fw.to/soFBF7j";;;;"973945058012614657";https://twitter.com/Sahlj/status/973945058012614657
;2018-03-14 10:30;0;0;"Comin backkkk babyyyyy";;;;"973944521573699584";https://twitter.com/eaglesvip1/status/973944521573699584
;2018-03-14 10:29;0;0;"Eagles keeping LB Nigel Bradham: The Philadelphia Eagles have re-signed LB Nigel Bradham to a… https://goo.gl/fb/CW8n11 http://bitly.com/2sjBBbW";;;;"973944287087026176";https://twitter.com/Asian_News_/status/973944287087026176
;2018-03-14 10:29;0;0;"";;;;"973944173664587782";https://twitter.com/brittany__cxx/status/973944173664587782
;2018-03-14 10:27;0;0;"Congratulations to @ NigelBradham_13";;@;;"973943772903034880";https://twitter.com/PhilMcN/status/973943772903034880
;2018-03-14 10:27;0;0;"e.g.";;;;"973943680737402880";https://twitter.com/stingsting59/status/973943680737402880
;2018-03-14 10:26;0;0;"Eagles Re-Sign Nigel Bradham For 5 Years/$40 Million https://bars.tl/lUv4G2qthL";;;;"973943468149149698";https://twitter.com/SusqueBarstool/status/973943468149149698
;2018-03-14 10:25;0;0;"Report: Eagles to re-sign Nigel Bradham http://iphillysports.com/2018/03/14/report-eagles-to-re-sign-nigel-bradham/ …";;;;"973943307633152000";https://twitter.com/iPhillySports/status/973943307633152000
;2018-03-14 10:25;0;0;"Damn straight @ NigelBradham_13 is/was @ Eagles top priority signing!";;@ @;;"973943245750374402";https://twitter.com/PhilMcN/status/973943245750374402
;2018-03-14 10:24;0;0;"Congrats @ NigelBradham_13 https://twitter.com/rapsheet/status/973914274241433601 …";;@;;"973943050798972929";https://twitter.com/blueandgold81/status/973943050798972929
;2018-03-14 10:24;4;6;"Linebacker Nigel Bradham Signs 5-Year Deal With The Eagles http://philly.thasportsjunkies101.com/nigel-bradham-signs-5-year-deal-eagles/ …pic.twitter.com/tiwq4g9oF7";;;;"973942955135389698";https://twitter.com/TSJ_Philly/status/973942955135389698
;2018-03-14 10:24;0;0;"Eagles re-sign LB Nigel Bradham to 5-year deal";;;;"973942915859992576";https://twitter.com/YerwoodCenter_/status/973942915859992576
;2018-03-14 10:24;0;0;"Linebacker Nigel Bradham Signs 5-Year Deal With The Eagles http://philly.thasportsjunkies101.com/nigel-bradham-signs-5-year-deal-eagles/ …pic.twitter.com/yOw5GDe6le";;;;"973942881747701761";https://twitter.com/TSJ_NFL/status/973942881747701761
;2018-03-14 10:22;0;6;"Y’all really don’t understand how happy it makes me as a diehard Eagles fan that the Sgt In Arms, Nigel Bradham, is staying home where he belongs.";;;;"973942531107979269";https://twitter.com/RIPDMBNFL/status/973942531107979269
;2018-03-14 10:22;0;0;"Trade him? He was a free agent.....";;;;"973942481371959296";https://twitter.com/MLett21/status/973942481371959296
;2018-03-14 10:22;0;0;"@ NigelBradham_13 YESSSSSSS!!!! WELCOME BACK TO THE TEAM MONSTER!!!! BIG THINGS AHEAD FOR YOU!!!!";;@;;"973942420206489601";https://twitter.com/GreenMtnBoy802/status/973942420206489601
;2018-03-14 10:21;0;0;"I liked a @ YouTube video http://youtu.be/wA7cpMf06ok?a Nigel Bradham Mic'd Up: San Fransisco 49ers vs. Philadelphia Eagles";;@;;"973942288379514881";https://twitter.com/william9152008/status/973942288379514881
;2018-03-14 10:21;0;0;"I seller at fiverr do you need anything please contact to do your work https://www.fiverr.com/margaretlawrenc/create-edu-email-address … # NigelBradham";;;#;"973942199812440064";https://twitter.com/lawrenc2003/status/973942199812440064
;2018-03-14 10:19;0;0;"Philly locking up Nigel Bradham before he hits FA is a very smart move. One of the best MIKE linebackers in the game right now. # NFLFreeAgency # Eagles";;;# #;"973941791790649345";https://twitter.com/TjonSports/status/973941791790649345
;2018-03-14 10:19;0;0;"# RT @ WBLZSports: # NFL: Eagles will re-sign LB Nigel Bradham to 5-year, $40M deal - Adam Schefter (ESPN) http://espn.go.com/nfl/ TuneIN Now right here. http://wblzsports.out.airtime.pro:8000/wblzsports_a";;@;# #;"973941672148111363";https://twitter.com/ThumpNlouD/status/973941672148111363
;2018-03-14 10:19;0;0;"Philadelphia Eagles re-sign Nigel Bradham to 5-year deal, per sources http://dlvr.it/QL0Z7X pic.twitter.com/B6tN696mKn";;;;"973941603512365062";https://twitter.com/CorneliusIV/status/973941603512365062
;2018-03-14 10:19;0;0;"Jordan Hicks Nigel Bradham Corey Nelson Brandon Graham Fletcher Cox Timmy Jernigan Michael Bennett with Derek Barnett Vinny Curry Chris Long Vaeao & Beau all still in rotation up front for now?!!?!?! Good luck running the football";;;;"973941598445801472";https://twitter.com/pennskippy/status/973941598445801472
;2018-03-14 10:18;0;3;"I'm so hype that we didn't lose Nigel Bradham";;;;"973941560088973312";https://twitter.com/MikePizzo3/status/973941560088973312
;2018-03-14 10:17;0;0;"Stoked as hell to find out Philly is keeping @ NigelBradham_13 # FlyEaglesFly";;@;#;"973941288461627395";https://twitter.com/EaglesPhan36/status/973941288461627395
;2018-03-14 10:17;0;1;"Gunz ablazing back on the squad @ thatmccrosskid our favorite player @ NigelBradham_13 https://twitter.com/adamschefter/status/973910929137197056 …";;@ @;;"973941189232775171";https://twitter.com/kaptain_karl19/status/973941189232775171
;2018-03-14 10:17;0;1;"Eagles, LB Nigel Bradham agree to 5-year deal https://phl.today/60315/eagles-lb-nigel-bradham-agree-to-5-year-deal/ …pic.twitter.com/aLYjK2zrgZ";;;;"973941182471593986";https://twitter.com/215Today/status/973941182471593986
;2018-03-14 10:16;0;0;"# Eagles resign LB Nigel Bradham to 5-year $40m deal! # FlyEaglesFly # Eagles";;;# # #;"973940919178162176";https://twitter.com/PollsEagles/status/973940919178162176
;2018-03-14 10:16;0;0;"Eagles, linebacker Nigel Bradham agree on 5-year deal https://svsportsonline.com/eagles-linebacker-nigel-bradham-agree-on-5-year-deal/ …";;;;"973940899867713536";https://twitter.com/azemarketing/status/973940899867713536
;2018-03-14 10:15;0;6;"Re-signing Nigel Bradham may be the biggest move the Eagles will make this offseason http://phillysportsnetwork.com/2018/03/14/odds/ …";;;;"973940747228602368";https://twitter.com/LiamJenkins21/status/973940747228602368
;2018-03-14 10:15;0;1;"Re-signing Nigel Bradham may be the biggest move the Eagles will make this offseason http://phillysportsnetwork.com/2018/03/14/odds/ …";;;;"973940713128939521";https://twitter.com/PhiladelphiaSN/status/973940713128939521
;2018-03-14 10:15;1;5;". @ SheilKapadia and @ Bo_Wulf's running Eagles offseason take is updated with their analysis of the reported re-signing of Nigel Bradham: https://theathletic.com/272116/2018/03/14/grading-all-of-the-eagles-offseason-moves/ …";;@ @;;"973940622204768256";https://twitter.com/TheAthleticPHI/status/973940622204768256
;2018-03-14 10:14;0;0;"***NFL ALERT*** •Eagles Resign LB NigelBradham •Giants Get a LT in Nate Solder • RB… https://www.instagram.com/p/BgTuuj5hARK/";;;;"973940519226302464";https://twitter.com/rocsports__/status/973940519226302464
;2018-03-14 10:13;0;3;"Hitchens would have to get NFL cheat codes to play half as good as Nigel Bradham.";;;;"973940099351064576";https://twitter.com/PhillyFanHND/status/973940099351064576
;2018-03-14 10:12;0;0;"That's a lot of money for Nigel Bradham... Hoping there isn't some shock release/trade.";;;;"973939994950819841";https://twitter.com/flipadelphia42/status/973939994950819841
;2018-03-14 10:12;0;0;"Oh thank God, was worried he'd slip away on free market. @ NigelBradham_13 eagle for life now!";;@;;"973939848632504325";https://twitter.com/MikeDonnellyJr/status/973939848632504325
;2018-03-14 10:12;0;0;"Nigel Bradham: Philadelphia Eagles re-sign linebacker https://www.upi.com/Sports_News/NFL/2018/03/14/Nigel-Bradham-Philadelphia-Eagles-re-sign-linebacker/7001521037977/?utm_source=dlvr.it&utm_medium=twitter …";;;;"973939826935267329";https://twitter.com/UPIsports/status/973939826935267329
;2018-03-14 10:11;0;0;"Yuhhhpic.twitter.com/BwSAW1PWNP";;;;"973939766801698817";https://twitter.com/phillyallday100/status/973939766801698817
;2018-03-14 10:11;0;2;"Nigel Bradham segue em Philly pic.twitter.com/qxkFmFJZyO";;;;"973939662199885831";https://twitter.com/ColtsNationBR/status/973939662199885831
;2018-03-14 10:11;0;0;"Eagles, linebacker Nigel Bradham agree on 5-year deal - http://ift.tt/2paK9Sx # FlyEaglesFly";;;#;"973939659075178496";https://twitter.com/PEaglesNews/status/973939659075178496
;2018-03-14 10:10;1;17;". @ Eagles signing @ NigelBradham_13 was a top priority,he was their alpha dog on defense. The champs are having a great off-season. # FlyEaglesFly # PhiladelphiaEagles # Eagles # FreeAgency";;@ @;# # # #;"973939353952112640";https://twitter.com/BMac_SportsTalk/status/973939353952112640
;2018-03-14 10:10;1;3;"It looks like Nigel Bradham is here to stay, the Eagles have signed him to a five year, $40M deal. pic.twitter.com/nGEkcI23ip";;;;"973939306992750597";https://twitter.com/Phillysaysgo/status/973939306992750597
;2018-03-14 10:09;0;0;"Eagles re-sign LB Nigel Bradham to 5-year deal https://www.espn.com/nfl/story/_/id/22758940/philadelphia-eagles-resign-lb-nigel-bradham …";;;;"973939228915662850";https://twitter.com/CSNCrowd/status/973939228915662850
;2018-03-14 10:09;0;0;"Eagles re-sign LB Nigel Bradham to 5-year deal http://newfoundland.dailydigest.us/2018/03/14/eagles-re-sign-lb-nigel-bradham-to-5-year-deal/ …";;;;"973939133424046081";https://twitter.com/TheDailyDigest/status/973939133424046081
;2018-03-14 10:09;0;0;"Eagles re-sign LB Nigel Bradham to 5-year deal https://svsportsonline.com/eagles-re-sign-lb-nigel-bradham-to-5-year-deal/ …";;;;"973939099185876992";https://twitter.com/azemarketing/status/973939099185876992
;2018-03-14 10:09;4;29;"Quick thoughts on the Eagles' re-signing of Nigel Bradham: http://www.espn.com/blog/philadelphia-eagles/post/_/id/24730/philadelphia-eagles-2018-free-agency-nigel-bradham-provides-wiggle-room-at-linebacker …";;;;"973939079187456000";https://twitter.com/Tim_McManus/status/973939079187456000
;2018-03-14 10:08;0;0;"Eagles re-sign LB Nigel Bradham to 5-year deal - https://1newsnet.com/eagles-re-sign-lb-nigel-bradham-to-5-year-deal/ …";;;;"973939035487002625";https://twitter.com/1_newsnet/status/973939035487002625
;2018-03-14 10:08;0;0;"Nigel Bradham, Eagles agree on five-year, $40M deal - http://NFL.com http://www.nfl.com/news/story/0ap3000000921159/article/nigel-bradham-eagles-agree-on-fiveyear-40m-deal …";;;;"973939032760700929";https://twitter.com/LisaJFilippi2/status/973939032760700929
;2018-03-14 10:08;0;0;"Eagles re-sign LB Nigel Bradham to 5-year deal https://goo.gl/fb/Rw26bG # DSNSports";;;#;"973938922505097218";https://twitter.com/DannyShookNews/status/973938922505097218
;2018-03-14 10:08;0;0;"Of course I meant cog. LoL";;;;"973938860676845568";https://twitter.com/PhilMcN/status/973938860676845568
;2018-03-14 10:08;0;3;"LB Nigel Bradham is staying with # Eagles on a 5-year deal worth 40-million according to @ AdamSchefter";;@;#;"973938814212296704";https://twitter.com/PressACWeinberg/status/973938814212296704
;2018-03-14 10:07;0;0;"Eagles, linebacker Nigel Bradham agree on 5-year deal https://goo.gl/fb/EVuiFg";;;;"973938733006442496";https://twitter.com/freshgameslive/status/973938733006442496
