username;date;retweets;favorites;text;geo;mentions;hashtags;id;permalink
;2009-04-25 18:19;0;0;"Pick 30....should gone 29 before - Titans Kenny Britt of Rutgers. They address the need they had to go down field. RB would have been dumb";;;;"1616460830";https://twitter.com/sportstalkmatt/status/1616460830
;2009-04-25 18:19;0;0;"With the 30th pick the Tennessee Titans take Kenny Britt WR Rutgers # nfldraft";;;#;"1616460826";https://twitter.com/wildrman/status/1616460826
;2009-04-25 18:19;0;0;"Titans take WR Kenny Britt with the 30th Overall.";;;;"1616460817";https://twitter.com/AlkaMo21/status/1616460817
;2009-04-25 18:19;0;0;"Vince Young's Titans finally take a wide receiver in the 1st round, Rutgers' Kenny Britt. # draft";;;#;"1616460757";https://twitter.com/40acressports/status/1616460757
;2009-04-25 18:19;0;0;"RD1: #30: Tennessee: Kenny Britt, WR, Rutgers # NFLdraft";;;#30 #;"1616460666";https://twitter.com/NCAAsports/status/1616460666
;2009-04-25 18:19;0;0;"@ andreakleid Titans picked up Kenny Britt WR/Rutgers";;@;;"1616460640";https://twitter.com/djryguy/status/1616460640
;2009-04-25 18:19;0;0;"With the 30th pick, the Titans select Kenny Britt, WR from Rutgers";;;;"1616460531";https://twitter.com/TheRedzoneorg/status/1616460531
;2009-04-25 18:19;0;0;"NFL Draft: Tennessee pick Kenny Britt from Rutgers.";;;;"1616460513";https://twitter.com/themib/status/1616460513
;2009-04-25 18:19;0;0;"Tenn pick Kenny Britt. WR";;;;"1616460327";https://twitter.com/alhpixie/status/1616460327
;2009-04-25 18:19;0;0;"Y los Titanes se llevan en el pick 30 a Kenny Britt ( WR )";;;;"1616460226";https://twitter.com/alvarosteely/status/1616460226
;2009-04-25 18:19;0;0;"With the 30th pick in the 2009 NFL Draft the Tennessee Titans select Kenny Britt, WR, Rutgers.";;;;"1616460152";https://twitter.com/SportsCenter/status/1616460152
;2009-04-25 18:18;0;0;"titans pull a fast one and draft kenny britt from rutgers";;;;"1616460118";https://twitter.com/thacover2/status/1616460118
;2009-04-25 18:18;0;0;"Tennessee Titans select Rutgers WR Kenny Britt with the 30th pick.";;;;"1616460071";https://twitter.com/BrendanPrunty/status/1616460071
;2009-04-25 18:18;0;0;"pick 30, kenny britt to the tennessee titans";;;;"1616459770";https://twitter.com/madrasirain/status/1616459770
;2009-04-25 18:18;0;0;"Kenny Britt, another WR goes to Tennessee # nfldraft";;;#;"1616459748";https://twitter.com/CowboysWarRoom/status/1616459748
;2009-04-25 18:18;0;0;"Kenny Britt is the pick";;;;"1616459742";https://twitter.com/Daryldraftdog/status/1616459742
;2009-04-25 18:18;0;0;"They took Kenny Britt. Finally got a Wide Out. Thanks Jeff Fisher";;;;"1616459732";https://twitter.com/NotoriousKRO/status/1616459732
;2009-04-25 18:18;0;0;"kenny britt bitchesssssss";;;;"1616459696";https://twitter.com/Jeremy__Austin/status/1616459696
;2009-04-25 18:18;0;0;"YES! Kenny Britt!";;;;"1616459632";https://twitter.com/SurfingKane/status/1616459632
;2009-04-25 18:18;0;0;"RT @ BlkSportsOnline: Tennessee has to take Kenny Britt..Don't they???";;@;;"1616459591";https://twitter.com/BSO/status/1616459591
;2009-04-25 18:18;0;0;"Titans select Kenny Britt WR Rutgers";;;;"1616459537";https://twitter.com/titansbuzztap/status/1616459537
;2009-04-25 18:18;0;0;"NFL Draft >> Pick #30 >> @ TitansNFL select Kenny Britt (WR) of Rutgers. # Titans # NFLDraft";;@;#30 # #;"1616459523";https://twitter.com/sportytweets/status/1616459523
;2009-04-25 18:18;0;0;"Kenny Britt to Titans. Another NJ connection -- Rutgers";;;;"1616459449";https://twitter.com/NFLprguy/status/1616459449
;2009-04-25 18:18;0;0;"Titans actually take Kenny Britt.";;;;"1616459378";https://twitter.com/ProFootballTalk/status/1616459378
;2009-04-25 18:18;0;0;"Y los Titanes escojen a Kenny Britt, WR. Ahora van los Cardenales.";;;;"1616459308";https://twitter.com/Shaloom/status/1616459308
;2009-04-25 18:18;0;0;"TITANS select... Kenny Britt; WR; Rutgers";;;;"1616459237";https://twitter.com/Dolfan99_34/status/1616459237
;2009-04-25 18:18;0;0;"With the 30th pick Titans get Kenny Britt, WR, Rutgers";;;;"1616459229";https://twitter.com/HeraldSports/status/1616459229
;2009-04-25 18:18;0;0;"Kenny Britt Is the newest Titan!";;;;"1616459131";https://twitter.com/TopherYork/status/1616459131
;2009-04-25 18:18;0;0;"Titans pick WR Kenny Britt";;;;"1616459104";https://twitter.com/SLowe08/status/1616459104
;2009-04-25 18:18;0;0;"Rd. 1 pick 30: Titans pick Kenny Britt, WR, Rutgers";;;;"1616459056";https://twitter.com/PittsburghPG/status/1616459056
;2009-04-25 18:18;0;0;"TEN pick Kenny Britt WR # nfldraft";;;#;"1616459016";https://twitter.com/ess0h/status/1616459016
;2009-04-25 18:18;0;0;"the 30th pick, tennessee titans pick kenny britt (WR)";;;;"1616459000";https://twitter.com/HAILSKINS/status/1616459000
;2009-04-25 18:18;0;0;"Titans pick number 30 Kenny Britt # nfldraft";;;#;"1616458988";https://twitter.com/ghomyak/status/1616458988
;2009-04-25 18:18;0;0;"The Titans take Rutgers WR Kenny Britt at No. 30 # nfldraft # titans";;;# #;"1616458900";https://twitter.com/usatodaynfl/status/1616458900
;2009-04-25 18:18;0;0;"30 - Kenny Britt WR Rutgers to the Tennessee Titans";;;;"1616458888";https://twitter.com/FantasyShocker/status/1616458888
;2009-04-25 18:18;0;0;"the 30th pick in the draft, the titans select kenny britt wr rutgers";;;;"1616458880";https://twitter.com/rocknwitdblest/status/1616458880
;2009-04-25 18:18;0;0;"Kenny Britt?";;;;"1616458683";https://twitter.com/steve_phillips_/status/1616458683
;2009-04-25 18:18;0;0;"NFL draft: 30, Titans: Kenny Britt, WR, Rutgers. http://www.packersnews.com # nfldraft";;;#;"1616458676";https://twitter.com/gbpressgazette/status/1616458676
;2009-04-25 18:18;0;0;"Pick 30. Titans Select: WR- Kenny Britt --------Cards are next!";;;;"1616458631";https://twitter.com/boycottfootball/status/1616458631
;2009-04-25 18:18;0;0;"1.30 Kenny Britt, WR Rutgers to Tennessee";;;;"1616458310";https://twitter.com/JeffPasquino/status/1616458310
;2009-04-25 18:18;0;0;"Pick No. 30 - Tennessee selects Kenny Britt";;;;"1616458232";https://twitter.com/BhamWeekly/status/1616458232
;2009-04-25 18:18;0;0;"30. TEN - Kenny Britt WR";;;;"1616458134";https://twitter.com/pArtyiNfo4aLL/status/1616458134
;2009-04-25 18:18;0;0;"At 30, the Titans go with - Kenny britt WR- # NFL # NFLDRAFT";;;# #;"1616458098";https://twitter.com/Andrew_Garda/status/1616458098
;2009-04-25 18:18;0;0;"With 30th pick in 1st Rnd, Titans select WR Kenny Britt (6-3, 215, Rutgers)";;;;"1616457637";https://twitter.com/Titans/status/1616457637
;2009-04-25 18:18;0;0;"Titans select Kenny Britt!";;;;"1616457612";https://twitter.com/NFLDraftBible/status/1616457612
;2009-04-25 18:18;0;0;"Tennessee Titans select Kenny Britt";;;;"1616457443";https://twitter.com/TheOvertime/status/1616457443
;2009-04-25 18:16;0;0;"@travboogie4 kenny britt?";;@travboogie4;;"1616443796";https://twitter.com/jsermo/status/1616443796
;2009-04-25 18:14;0;0;"Please let Kenny Britt end up on a team I can root for # nfldraft # Rutgers";;;# #;"1616433529";https://twitter.com/sahyder1/status/1616433529
;2009-04-25 18:14;0;0;"I think the Titans take Kenny Britt.";;;;"1616429263";https://twitter.com/JohnCzahor/status/1616429263
;2009-04-25 18:13;0;0;"Kenny Britt, next Titans pick!";;;;"1616424118";https://twitter.com/SurfingKane/status/1616424118
;2009-04-25 18:12;0;0;"I hope St. Louis picks Kenny Britt";;;;"1616418686";https://twitter.com/ccversiii/status/1616418686
;2009-04-25 18:12;0;0;"29. NY Giants: Hakeem Nicks/WR/North Carolina. G-Men get Plax's replacement, but shockingly not Kenny Britt. That said, Nicks is the goods.";;;;"1616417182";https://twitter.com/draftresults/status/1616417182
;2009-04-25 18:11;0;0;"Giants missed out bigtime by not taking Kenny Britt from Rutgers. # nfldraft";;;#;"1616410691";https://twitter.com/joshuaduboff/status/1616410691
;2009-04-25 18:10;0;0;"Hakeem Nicks >>>> Kenny Britt. And I'm fuckin friend with Kenny. Good pick Giants. Nice WR to replace Plaxico.";;;;"1616408853";https://twitter.com/april_rose/status/1616408853
;2009-04-25 18:10;0;0;"Tennessee has to take Kenny Britt..Don't they???";;;;"1616407516";https://twitter.com/BSO/status/1616407516
;2009-04-25 18:10;0;0;"And there goes Hakeem Nicks. I really hope Kenny Britt falls to #44 for Miami, but I don't think he will.";;;#44;"1616405596";https://twitter.com/tedhill/status/1616405596
;2009-04-25 18:10;0;0;"Titans are up. Trade for Boldin? Nicks is taken. Are we going CB or Kenny Britt or surprise.";;;;"1616405479";https://twitter.com/amike77/status/1616405479
;2009-04-25 18:09;0;0;"NYG=Kenny Britt...thats what they should do!";;;;"1616399196";https://twitter.com/DerdniK/status/1616399196
;2009-04-25 18:08;0;0;"Giants fans...are you feeling Kenny Britt or Hakeem Nicks...its one or the other...";;;;"1616396244";https://twitter.com/BLITZMagPrez/status/1616396244
;2009-04-25 18:06;0;0;"I'm guessing Hakeem Nicks to the Giants, either him or Kenny Britt. Depends on who they're higher on, because they seem a bit similar.";;;;"1616382465";https://twitter.com/NightsEternal/status/1616382465
;2009-04-25 18:06;0;0;"Kenny Britt the local kid to the Giants here? # NFLdraft # rutgers";;;# #;"1616381618";https://twitter.com/sahyder1/status/1616381618
;2009-04-25 18:06;0;0;"gives the Bills a C for taking Eric Wood New York Giants now on the clock Prediction:WR Kenny Britt (Rutgers) http://bit.ly/loUHQ";;;;"1616378886";https://twitter.com/stevenlourie/status/1616378886
;2009-04-25 18:05;0;0;"okay GIANTS fans. Kenny Britt or Hakeem Nicks? Or how about Ray Maualuga? Antonio Pierce is getting up there in age. # nfldraft";;;#;"1616375590";https://twitter.com/richforestano/status/1616375590
;2009-04-25 18:05;0;0;"Giants are on the clock! Kenny Britt is still available! # nfldraft # giants # rutgers";;;# # #;"1616374645";https://twitter.com/robtraut/status/1616374645
;2009-04-25 18:05;0;0;"Time for the # giants to hopefilly pick Kenny Britt! # nfl";;;# #;"1616373536";https://twitter.com/saffir_99/status/1616373536
;2009-04-25 17:56;0;0;"Gives Green Bay a B for taking Clay Matthews Colts on the Clock Prediction: WR Kenny Britt (Rutgers) http://bit.ly/loUHQ";;;;"1616315667";https://twitter.com/stevenlourie/status/1616315667
;2009-04-25 17:50;0;0;"Kenny Britt is STILL on the board";;;;"1616275344";https://twitter.com/richforestano/status/1616275344
;2009-04-25 17:47;0;0;"@ abba_ks Yup. I'm thinking either Kenny Britt, Maulaluga, Vontae Davis....and with that, ESPN says Davis. I'm happy.";;@;;"1616257978";https://twitter.com/DukeStJournal/status/1616257978
;2009-04-25 17:46;0;0;"Bet you its kennybritt";;;;"1616248907";https://twitter.com/Jeremy_Carter/status/1616248907
;2009-04-25 17:46;0;0;"Hoping Kenny Britt gets drafted in the first round.";;;;"1616248434";https://twitter.com/sassola/status/1616248434
;2009-04-25 17:44;0;0;"Possibly the first chance for Rutgers WR Kenny Britt to be selected, right here with the Dolphins at No. 25.";;;;"1616236299";https://twitter.com/BrendanPrunty/status/1616236299
;2009-04-25 17:39;0;0;"MIAMI --- kenny britt or james laurinaitis or hakeem nicks or rey maualuga, no one else!!!";;;;"1616206810";https://twitter.com/bvsystem/status/1616206810
;2009-04-25 17:30;0;0;"WRs going quickly...Kenny Britt is still around";;;;"1616147512";https://twitter.com/GMen247/status/1616147512
;2009-04-25 17:28;0;0;"@ thenflchick Kenny Britt wouldn't be a bad pick either...";;@;;"1616133375";https://twitter.com/BLITZMagPrez/status/1616133375
;2009-04-25 17:27;0;0;"waiting for kenny britt to get picked in the NFL draft";;;;"1616122942";https://twitter.com/dougfaherty/status/1616122942
;2009-04-25 17:26;0;0;"Hopefully Kenny Britt goes before the end of the 1st";;;;"1616118266";https://twitter.com/glennrd/status/1616118266
;2009-04-25 17:26;0;0;"like garafolo said, nicks is looking like the option, i know the vikes like Kenny Britt";;;;"1616116211";https://twitter.com/GiantsGab/status/1616116211
;2009-04-25 17:15;0;0;"I hate the Eagles, but at least the Giants are now 1 WR closer to Kenny Britt. # nfldraft # giants";;;# #;"1616044036";https://twitter.com/robtraut/status/1616044036
;2009-04-25 17:11;0;0;"@ron_e_fresh Kenny Britt";;@ron_e_fresh;;"1616018961";https://twitter.com/giantstalk/status/1616018961
;2009-04-25 16:59;0;0;"kenny britt please fall to 25!!";;;;"1615930997";https://twitter.com/DubbSicks/status/1615930997
;2009-04-25 16:49;0;0;"Kenny Britt one of the top draft choices... hmmm";;;;"1615864541";https://twitter.com/sebritt/status/1615864541
;2009-04-25 16:10;0;0;"watching the NFL Draft and hoping KENNY BRITT'S dreams c0ome true. Go KENNY!";;;;"1615592901";https://twitter.com/SimplySherri/status/1615592901
;2009-04-25 16:04;0;0;"For my Dolphins I forsee Hakeem Nicks or Kenny Britt, & if for some unforseen reason Percy is still there we'll take him. Inside Information";;;;"1615548010";https://twitter.com/KayoThaKomic/status/1615548010
;2009-04-25 15:20;0;0;"And shout outs to my homie Kenny Britt! RU Rah Rah and all that good shit lol. ADHD havin, throwin pillows in his sleep + shit..";;;;"1615239336";https://twitter.com/april_rose/status/1615239336
;2009-04-25 14:39;0;0;"Bears need to get kenny britt...NOW";;;;"1614965992";https://twitter.com/yolo_pinyato/status/1614965992
;2009-04-25 13:31;0;0;"is wishing the NYG luck today in the draft, go Kenny Britt!";;;;"1614514586";https://twitter.com/dyada07/status/1614514586
;2009-04-25 11:17;0;0;"@ WaleDC ny giants i think we will get kenny britt from rutgers.... and i want them to get kenny britt from rutgers.....";;@;;"1613601575";https://twitter.com/JUSTCHILLY/status/1613601575
;2009-04-25 11:14;0;0;"Is rooting on the cowboys and the chiefs in the draft...and is waitiing to see where my boy kenny britt go...)Ea bayonne is going hard......";;;;"1613583366";https://twitter.com/dredre201/status/1613583366
;2009-04-25 11:12;0;0;"I wanna be on record...I want the Dolphins to take Kenny Britt out of Rutgers in the first round";;;;"1613573145";https://twitter.com/CashSports/status/1613573145
;2009-04-25 11:07;0;0;"@ LL91 Very true .. how many picks do the Rams have? sec round pick I think they will look to get a WR maybe Kenny Britt from Rutgers";;@;;"1613537368";https://twitter.com/Madden_Maniac9/status/1613537368
;2009-04-25 11:06;0;0;"I'm calling this now: Giants take Rutgers WR Kenny Britt in the 1st Round.";;;;"1613527982";https://twitter.com/AndrewLenaghan/status/1613527982
;2009-04-25 10:41;0;0;"@ elimanning Kenny Britt, let's do it!!!";;@;;"1613362523";https://twitter.com/Whoootiz/status/1613362523
;2009-04-25 08:38;0;0;"AND I THINK THAT KENNY BRITT WILL NOT HAVE TO MOVE VERY FAR....... FROM RUTGERS TO THE NY GIANTS!!! HOPEFULLY......";;;;"1612646357";https://twitter.com/JUSTCHILLY/status/1612646357
;2009-04-25 07:38;0;0;"DRAFT DAY! It's like Christmas. Hoping for a great result for Kenny Britt and REALLY hoping to hear Mike Teel's name called. A class act.";;;;"1612376876";https://twitter.com/jenniecollucci/status/1612376876
;2009-04-25 07:37;0;0;"I predict a boring day for the Jets and the Giants, and an early second-round appearance by Kenny Britt, at the NFL Draft.";;;;"1612373298";https://twitter.com/StevePoliti/status/1612373298
;2009-04-25 06:15;0;0;"Based on the 90 seconds of NFL draft coverage I heard this week, I think I'd be happy if the Bears took WR Kenny Britt. It's all a crapshoot";;;;"1612077629";https://twitter.com/Ed_Lilly/status/1612077629
;2009-04-24 14:43;0;0;"With the 30th pick in the 1010 XL Media Mock Draft, Jum Wyatt with the Tennessian chooses Kenny Britt";;;;"1606735742";https://twitter.com/1010XL/status/1606735742
;2009-04-24 14:41;0;0;"The one thing I want to hear tomorrow: "With the 29th pick, the NY Giants select Kenny Britt, WR, Rutgers"";;;;"1606722549";https://twitter.com/robtraut/status/1606722549
;2009-04-24 14:36;0;0;"NFL Insiders debate Kenny Britt draft value: http://www.nfldraftbible.com/Daily-Dose/all_access_kenny_britt.html";;;;"1606676949";https://twitter.com/NFLDraftBible/status/1606676949
;2009-04-24 14:06;0;0;"@ SuperBowl_2010 A wide receiver - Kenny Britt or Tiquan Underwood...stick with QB's already on the roster, Klemens's good, ratliff potential";;@;;"1606421434";https://twitter.com/Aerocles/status/1606421434
;2009-04-24 10:06;0;0;"@ davemark psyched to watch it (on tv) - got to give it up for Bayonne - and keeping an eye on Kenny Britt this weekend as well - go NJ!";;@;;"1604359681";https://twitter.com/stumark/status/1604359681
;2009-04-24 08:58;0;0;"I wonder who the # giants will pick if the Dolphins end up drafting Kenny Britt. Alex Mack, perhaps?";;;#;"1603791882";https://twitter.com/saffir_99/status/1603791882
;2009-04-23 17:51;0;0;"I've seen a lot of mocks leading up to the draft only one has the Ravens selecting my boy Kenny Britt! Remember the name.";;;;"1598529432";https://twitter.com/RavensTweet/status/1598529432
;2009-04-23 17:43;0;0;"Since each trade for another wideout fails, the Giants might draft Kenny Britt - would love to still see him all the time in the NFL";;;;"1598467056";https://twitter.com/glennrd/status/1598467056
;2009-04-23 12:24;0;0;"@ mattvensel I think Kenny Britt would be a great fit.";;@;;"1595891909";https://twitter.com/Tailgate365/status/1595891909
;2009-04-23 10:42;0;0;"G-Men "ending" pursuit of Braylon Edwards (cough..smokescreen..cough). Hakeem Nicks or Kenny Britt with first round pick would be nice...";;;;"1595073369";https://twitter.com/helloimbobby/status/1595073369
;2009-04-23 09:13;0;0;"I continue to hear NYG do not rate Kenny Britt as a first-round WR. Doesn't mean they won't take him in 2nd round, just not at #29. --MG";;;#29;"1594342629";https://twitter.com/MikeGarafolo/status/1594342629
;2009-04-22 17:01;0;0;"New from TJB: Link: Britt Getting a Bad Rap?: Is local product Kenny Britt miscast by national pund.. http://tinyurl.com/d97kku";;;;"1588628779";https://twitter.com/Brian_Bassett/status/1588628779
;2009-04-22 14:45;0;0;"#29 Kenny Britt";;;#29;"1587541333";https://twitter.com/gac1033/status/1587541333
;2009-04-22 14:36;0;0;"RT @ thejetsblog: New from TJB: Film Room: Kenny Britt Highlights: Highlights of Rutgers WR Kenny Britt. http://tinyurl.com/d3b7je LIKING HIM";;@;;"1587468694";https://twitter.com/marshalldharris/status/1587468694
;2009-04-22 14:11;0;0;"The Jets Blog >> Film Room: Kenny Britt Highlights http://tinyurl.com/d3b7je";;;;"1587268081";https://twitter.com/jetsbuzztap/status/1587268081
;2009-04-22 14:03;0;0;"New from TJB: Film Room: Kenny Britt Highlights: Highlights of Rutgers WR Kenny Britt. http://tinyurl.com/d3b7je";;;;"1587200465";https://twitter.com/Brian_Bassett/status/1587200465
;2009-04-22 13:51;0;0;"@ joereedy True. But they are the Browns so who knows what they will do. They could wait until the 2nd rd. and get Kenny Britt from Rutgers.";;@;;"1587104038";https://twitter.com/antman111/status/1587104038
;2009-04-22 13:41;0;0;"29. NY Giants - Kenny Britt, WR, Rutgers - I dont think the Braylon Edwards to NY deal will go down, so the Giants still need a bigger WR";;;;"1587022549";https://twitter.com/RajanNanavati/status/1587022549
;2009-04-22 11:51;0;0;"@ JoeRoseShow Hope Fins get Percy Harvin, Hakeem Nicks, or Kenny Britt in 1st. Larry English if they are gone. Hope for Shawn Smith in 2nd.";;@;;"1586152190";https://twitter.com/MrRadio610/status/1586152190
;2009-04-22 10:49;0;0;"If the Giants draft Kenny Britt on Saturday, I may just have to buy a Britt jersey Sunday.";;;;"1585648867";https://twitter.com/SirSandwich/status/1585648867
;2009-04-21 18:35;0;0;"Todd McShay: Kenny Britt or Hakeem Nicks, Ron Brace, D.J. Moore â¦ Fins: What the best-case scenario for the Do.. http://tinyurl.com/d85rrj";;;;"1579765555";https://twitter.com/DolfansNYC/status/1579765555
;2009-04-21 16:27;0;0;"@ BIGCHRISSATX we got Parcells, Ireland and Sporano. I know the draft will be fine for my Fins. Kenny Britt or Hakeem Nicks!!!!";;@;;"1578725966";https://twitter.com/DubbSicks/status/1578725966
;2009-04-21 13:39;0;0;"Video of Kenny Britt http://adjix.com/s9ww";;;;"1577317040";https://twitter.com/nygmen/status/1577317040
;2009-04-21 13:04;0;0;"Kenny Britt Highlight Video: Speaking of draft prospects, check out this highlight video I found of Kenny Britt.. http://twurl.nl/qsah0b";;;;"1577033841";https://twitter.com/giantstalk/status/1577033841
;2009-04-21 12:57;0;0;"NFL draft approaching -- here's to hoping the dolphins take james laurinaitis @ 25 and kenny britt @ 44";;@ @;;"1576980940";https://twitter.com/bvsystem/status/1576980940
;2009-04-21 12:55;0;0;"Video: Wide Receiver Kenny Britt http://tinyurl.com/ctgpb6";;;;"1576959753";https://twitter.com/SNYGiants/status/1576959753
;2009-04-21 12:50;0;0;"Giants Football Blog >> Video: Wide Receiver Kenny Britt http://tinyurl.com/dkujc5";;;;"1576918024";https://twitter.com/giantsbuzztap/status/1576918024
;2009-04-21 12:33;0;0;"Browns visiting Kenny Britt on Thurs. Met with Hakeem Nicks yesterday... Maybe they're not locked in on Crabtree...";;;;"1576783248";https://twitter.com/Ryan_McCrystal/status/1576783248
;2009-04-21 10:44;0;0;"Draft guru Todd McShay on best-case scenario for Dolphins if they keep first 3 picks: WR Kenny Britt/Hakeem Nicks; NT Ron Brace; CB DJ Moore";;;;"1575889146";https://twitter.com/EthanJSkolnick/status/1575889146
;2009-04-21 08:50;0;0;"BTW- what's all this nonsense about Kenny Britt having an attitude problem? Thanks Tom Luicci, for setting the record straight.";;;;"1574979198";https://twitter.com/Hugh_Jee/status/1574979198
;2009-04-20 20:19;0;0;"Meet mister big time: Kenny Britt may be next Plax, and that ain't good http://adjix.com/awec";;;;"1570943793";https://twitter.com/nygmen/status/1570943793
;2009-04-20 15:34;0;0;"Concerns About Kenny Britt?: In Sunday’s Daily News, there was an interesting article about Kenny Britt. .. http://tinyurl.com/dya3x2";;;;"1568670175";https://twitter.com/GiantsGab/status/1568670175
;2009-04-20 15:26;0;0;"Star-Ledger >> NFL scouts have fumbled the ball on Kenny Britt's 'personality issues' http://tinyurl.com/dhw8z5";;;;"1568604963";https://twitter.com/rutgersbuzztap/status/1568604963
;2009-04-20 15:14;0;0;"Giants Gab >> Concerns About Kenny Britt? http://tinyurl.com/cjw5st";;;;"1568502741";https://twitter.com/giantsbuzztap/status/1568502741
;2009-04-20 10:12;0;0;"'Red flags' about Rutgers' Britt?: Kenny Britt It is Draft Week, and we will do whatever we can.. http://tinyurl.com/c5uloy";;;;"1566094233";https://twitter.com/bigblueview/status/1566094233
;2009-04-19 21:33;0;0;"Kenny Britt the Next Buress???: Kenny Britt even plays defense..... That's what the New York D.. http://tinyurl.com/c8wlkx";;;;"1562260716";https://twitter.com/sbncollege/status/1562260716
;2009-04-19 21:31;0;0;"Kenny Britt the Next Buress???: Kenny Britt even plays defense..... That's what the New York Daily Ne.. http://tinyurl.com/cynglk";;;;"1562242811";https://twitter.com/SBNation/status/1562242811
;2009-04-19 12:38;0;0;"Spring football is over, but I'll be providing plenty of NFL draft fodder this week on Scuttlebutt, including a feature on Kenny Britt.";;;;"1559245645";https://twitter.com/KSargeantNJ/status/1559245645
;2009-04-19 11:30;0;0;"Ravens need a WR.. Kenny Britt has skills.. but also an attitude.. I mean, never even heard of Darrius Heyward-Bey?? http://bit.ly/RLFji";;;;"1558826517";https://twitter.com/RobCarlinNBCS/status/1558826517
;2009-04-19 04:46;0;0;"Meet mister big time: Kenny Britt http://tinyurl.com/d26bsh";;;;"1557226463";https://twitter.com/nflgiants/status/1557226463
;2009-04-19 04:13;0;0;"NY Daily News >> Meet mister big time: Kenny Britt http://tinyurl.com/d26bsh";;;;"1557137290";https://twitter.com/giantsbuzztap/status/1557137290
;2009-04-19 04:11;0;0;"NYDaily >> Meet mister big time: Kenny Britt: Kenny Britt wants to be the NFL's Rookie of the Ye.. http://tinyurl.com/d26bsh";;;;"1557130561";https://twitter.com/BR_NYCGiants/status/1557130561
;2009-04-18 13:49;0;0;"I met Kenny Britt!";;;;"1552506857";https://twitter.com/patmak/status/1552506857
;2009-04-18 08:13;0;0;"Bleed Scarlet >> Kenny Britt’s wonderlic score http://tinyurl.com/cd7cmb";;;;"1550488877";https://twitter.com/rutgersbuzztap/status/1550488877