username;date;retweets;favorites;text;geo;mentions;hashtags;id;permalink
;2009-04-25 18:59;0;0;"@ orlandosports go Kenny Britt. But why did Kenny fall that far? Britt is easily top 3 WR on the charts.";;@;;"1616718636";https://twitter.com/Rikers/status/1616718636
;2009-04-25 18:59;0;0;"Titans pick Kenny Britt hope he isn't Kevin Dyson 2.0";;;;"1616716220";https://twitter.com/pseudothugzlolz/status/1616716220
;2009-04-25 18:59;0;0;"Thank goodness we picked a wide receiver. Welcome to @tennesseetitans, Kenny Britt!";;@tennesseetitans;;"1616714578";https://twitter.com/EmilyPetro/status/1616714578
;2009-04-25 18:57;0;0;"Tennessee has to be happy to see WR Kenny Britt still around at No. 30. Titans have needed a young marquee receiver for a long time.";;;;"1616705154";https://twitter.com/orlandosports/status/1616705154
;2009-04-25 18:56;0;0;"WTG Kenny Britt";;;;"1616699526";https://twitter.com/bobbyc_nj/status/1616699526
;2009-04-25 18:55;0;0;"On with Tennessee Titans #30 Draft Pick Kenny Britt (WR from Rutgers)";;;#30;"1616691381";https://twitter.com/SiriusXMNFL/status/1616691381
;2009-04-25 18:52;0;0;"Kenny Britt to the Titans with the 30th overall pick...yay Rutgers gets a first round selection.";;;;"1616669272";https://twitter.com/Kreggo_Eats/status/1616669272
;2009-04-25 18:50;0;0;"Excited about the Titans picking Kenny Britt, a Scarlett Knight";;;;"1616661058";https://twitter.com/noirsith/status/1616661058
;2009-04-25 18:46;0;0;"Titans draft wide receiver: Tennessee picks Kenny Britt with its first-round selection in the 2009 NFL Draft http://tinyurl.com/cxcezj";;;;"1616636174";https://twitter.com/wvlt/status/1616636174
;2009-04-25 18:45;0;0;"Titans draft Rutgers WR Britt : The Tennessee Titans selected Rutgers wide receiver Kenny Britt with the 30th ov.. http://tinyurl.com/cza6vu";;;;"1616628922";https://twitter.com/WBIRSports/status/1616628922
;2009-04-25 18:43;0;0;"Titans draft Rutgers receiver Kenny Britt http://tr.im/jIjq And we're on to the second round.";;;;"1616615010";https://twitter.com/JFTanner/status/1616615010
;2009-04-25 18:43;0;0;"Kenny Britt chosen in first round of NFL Draft http://www.nj.com/bayonne/index.ssf/2009/04/bayonnes_kenny_britt_chosen_by.html";;;;"1616612840";https://twitter.com/jerseyjournal/status/1616612840
;2009-04-25 18:42;0;0;"Saints Beat >> Tennessee selects Rutgers receiver Kenny Britt No. 30 in the NFL draft http://tinyurl.com/dc5nvn";;;;"1616606559";https://twitter.com/saintsbuzztap/status/1616606559
;2009-04-25 18:41;0;0;"# kenny britt, # donald brown, # harvin vikings, # mack browns, # eagles maclin, # brian cushing, # crabtree http://TwitPWR.com/beatfatigue/";;;# # # # # # #;"1616603352";https://twitter.com/GeraldHall/status/1616603352
;2009-04-25 18:40;0;0;"(@taliasunset) Dear Kenny Britt, welcome to the winning team. With Love, Talia & the Tennessee Titans.";;@taliasunset;;"1616593677";https://twitter.com/DearRobot/status/1616593677
;2009-04-25 18:39;0;0;"Dear Kenny Britt, welcome to the winning team. With Love, Talia & the Tennessee Titans.";;;;"1616592864";https://twitter.com/nataljasun/status/1616592864
;2009-04-25 18:39;0;0;"Titans tap wide receiver Kenny Britt in the first round of the NFL draft http://n247.tv/z5a";;;;"1616587637";https://twitter.com/nashville247/status/1616587637
;2009-04-25 18:38;0;0;"#30 Pick: Tennesse Titans WR Kenny Britt http://tinyurl.com/c9huu9";;;#30;"1616586333";https://twitter.com/ChrisHallUK/status/1616586333
;2009-04-25 18:37;0;0;"Britt headed to Nashville: The 30th pick is WR Kenny Britt to Tennessee. Britt has a streak of prima donna in hi.. http://tinyurl.com/cs4jft";;;;"1616580789";https://twitter.com/nfldraftdog/status/1616580789
;2009-04-25 18:37;0;0;"Titans Draft Britt No. 30: Analysis: Tennessee Titans Kenny Britt Wide Receiver Rutgers Britt is a big,.. http://tinyurl.com/cafxt9";;;;"1616580616";https://twitter.com/FootballPost/status/1616580616
;2009-04-25 18:34;0;0;"29 Giants WR Hakeem Nicks 30 Titans WR Kenny Britt 31 Cardnails RB Beenie Wells 32 Steelers DT Evander Hood thats the end of the 1st round.";;;;"1616561035";https://twitter.com/Mr_Paz/status/1616561035
;2009-04-25 18:34;0;0;"Titans Draft Kenny Britt WR!!!";;;;"1616560464";https://twitter.com/TheeNDFX/status/1616560464
;2009-04-25 18:34;0;0;"RT @ raczilla Kenny Britt is rated 77 overall in Madden NFL 10. # maddendraft";;@;#;"1616559308";https://twitter.com/EASPORTS/status/1616559308
;2009-04-25 18:34;0;0;"Kenny Britt is rated 77 overall in Madden NFL 10. # maddendraft";;;#;"1616558724";https://twitter.com/raczilla/status/1616558724
;2009-04-25 18:34;0;0;"Kenny Britt- Rutgers WR picked #30 in 1st round by the Titans .. The first time a Rutgers player has been picked in 1st round! Go RU!";;;#30;"1616556577";https://twitter.com/rurugby/status/1616556577
;2009-04-25 18:33;0;0;"WOAH Kenny Britt went first round to the Titans. Yeah RU!";;;;"1616554564";https://twitter.com/AnnieKay21/status/1616554564
;2009-04-25 18:33;0;0;"Draft 28.BUF Eric Wood C L'ville 29.NYG Hakeem Nicks WR UNC 30.TN Kenny Britt WR Rutgers 31.AZ Beanie Wells RB OSU 32.PIT Ziggy Hood DT Mizu";;;;"1616551208";https://twitter.com/athleticsite/status/1616551208
;2009-04-25 18:32;0;0;"30. Titans- Kenny Britt, WR, Rutgers. Decent WR, but I think Tenn reached for a need. Take the best when you pick late, but still. # nfldraft";;;#;"1616546167";https://twitter.com/BRM/status/1616546167
;2009-04-25 18:32;0;0;"dbcotton: Looks like no Q in Nashville with the Titans drafting Rutgers WR Kenny Britt. At 6' 3" he'll be the tallest Titans WR in years.";;;;"1616544974";https://twitter.com/TitanFans/status/1616544974
;2009-04-25 18:31;0;0;"I like the Kenny Britt pick for Tennessee, look out for the offense this year, gonna turn some heads";;;;"1616543519";https://twitter.com/SayYesToDougs/status/1616543519
;2009-04-25 18:31;0;0;"@ Titanfans Looks like no Q in Nashville with the Titans drafting Rutgers WR Kenny Britt. At 6' 3" he'll be the tallest Titans WR in years.";;@;;"1616543157";https://twitter.com/dbcotton/status/1616543157
;2009-04-25 18:31;0;0;"Okay, it's not Nicks, but I'm pumped for Kenny Britt.";;;;"1616542368";https://twitter.com/TomKinslow/status/1616542368
;2009-04-25 18:31;0;0;"28 BUF Eric Wood C-Lou 29NYG Hakeem Nicks WR - UNC 30TN Kenny Britt WR - Rut 31AZ Chris Wells RB OSU 32 PIT Evander Hood DT - Miss.";;;;"1616542088";https://twitter.com/412sports/status/1616542088
;2009-04-25 18:31;0;0;"Who in the world is Kenny Britt";;;;"1616539305";https://twitter.com/Get_ner_dun/status/1616539305
;2009-04-25 18:31;0;0;"# Titans select a wideout who can't catch. Troy Williamson, meet your double: Kenny Britt. # NFLDraft";;;# #;"1616538614";https://twitter.com/Draftguys/status/1616538614
;2009-04-25 18:30;0;1;"Kenny Britt sounds like some dude who moved here with a pocket full of dreams and has a showcase at Douglas Corner on Tuesday.";;;;"1616534393";https://twitter.com/jimreams/status/1616534393
;2009-04-25 18:30;0;0;"Congrats to Rutgers & Kenny Britt - Rutgers first 1st rounder";;;;"1616530679";https://twitter.com/IanMSchuler/status/1616530679
;2009-04-25 18:29;0;0;"Kenny Britt baby!!! Go titans!!";;;;"1616527125";https://twitter.com/jgriffsays/status/1616527125
;2009-04-25 18:29;0;0;"Hell Yeah Rutgers... Kenny Britt goes in the first round.";;;;"1616526972";https://twitter.com/Evan_Guerin/status/1616526972
;2009-04-25 18:29;0;0;"Titans roll with Kenny Britt. Neither excited nor let down. Was almost hoping we would draft Wells. Never would've thrown the ball";;;;"1616525330";https://twitter.com/zachariah_r/status/1616525330
;2009-04-25 18:28;0;0;"TITANS TAKE KENNY BRITT RUTGERS RECEIVER";;;;"1616522240";https://twitter.com/butchwhacks/status/1616522240
;2009-04-25 18:28;0;0;"Shouts to my dude Kenny Britt who got drafted by the Tennessee Titan's!!!!";;;;"1616522205";https://twitter.com/Ace2345/status/1616522205
;2009-04-25 18:28;0;0;"is kenny britt";;;;"1616518881";https://twitter.com/JLank12/status/1616518881
;2009-04-25 18:27;0;0;"@bozackjenkins Kenny Britt from Rutgers.";;@bozackjenkins;;"1616516677";https://twitter.com/ShesSoOffbeat/status/1616516677
;2009-04-25 18:27;0;0;"27IND Donald Brown RB - CT 28BUF Eric Wood C-Lou 29NYG Hakeem Nicks WR - UNC 30TN Kenny Britt WR - Rut 31AZ Chris Wells RB OSU 32 PIT next !";;;;"1616513674";https://twitter.com/412sports/status/1616513674
;2009-04-25 18:27;0;0;"titans go Kenny Britt, WR, Rutgers";;;;"1616513379";https://twitter.com/TheAudible/status/1616513379
;2009-04-25 18:26;0;0;"Kenny Britt is a Titan! Too bad its not a cowboy or giant but its still awesome";;;;"1616509600";https://twitter.com/Julie1205/status/1616509600
;2009-04-25 18:26;0;0;"# chrisonNFLdraft :: Read up on Kenny Britt and I still don't see him as a 1st round pick, even though the Titans do need more receivers.";;;#;"1616509448";https://twitter.com/chrismaka/status/1616509448
;2009-04-25 18:26;0;0;"Football: Britt Selected in First Round of 2009 NFL Draft: NEW YORK, N.Y. - Junior wide receiver Kenny Britt was.. http://tinyurl.com/cr96un";;;;"1616508399";https://twitter.com/BR_Rutgers/status/1616508399
;2009-04-25 18:25;0;0;"Kenny Britt going to the Tennessee Titans!";;;;"1616504444";https://twitter.com/aipnai/status/1616504444
;2009-04-25 18:25;0;0;"Kenny Britt goes in the first round to Tennessee!";;;;"1616502570";https://twitter.com/piney3/status/1616502570
;2009-04-25 18:25;0;0;"Tennessee Titans pick Kenny Britt, WR from Rutgers, in the first round of NFL draft";;;;"1616502226";https://twitter.com/6News/status/1616502226
;2009-04-25 18:25;0;0;"way to go Rutgers. Kenny Britt goes at #30.";;;#30;"1616501799";https://twitter.com/sassola/status/1616501799
;2009-04-25 18:25;0;0;"@ richeisen just said WR Kenny Britt is the 1st Rutgers player taken in the 1st round. That is pretty impressive!";;@;;"1616501743";https://twitter.com/NFLRandR/status/1616501743
;2009-04-25 18:25;0;0;"Kenny Britt, #30 overall at the NFL Draft to the Tennessee Titans. Our first-ever first-round selection! We're so proud of #88. Tim Pernetti";;;#30 #88;"1616500754";https://twitter.com/RUAthletics/status/1616500754
;2009-04-25 18:24;0;0;"Congrats to Kenny Britt for being the first 1st-round pick in Rutgers history !! Wish the Giants scooped him but I'm happy he went 1st round";;;;"1616496162";https://twitter.com/DomCorleone/status/1616496162
;2009-04-25 18:24;0;0;"Tennessee is going to find out in a few years that they ended up with the 2nd best WR in this draft. Kenny Britt is a beast! # nfldraft";;;#;"1616494232";https://twitter.com/DerdniK/status/1616494232
;2009-04-25 18:24;0;0;"I just wrote a poem: Kenny Britt / First Round pick / eat that shit / suck my dick. (say it like you're chanting)";;;;"1616492780";https://twitter.com/tomwp/status/1616492780
;2009-04-25 18:23;0;0;"Titans take Rutgers' own Kenny Britt..good for him.";;;;"1616489775";https://twitter.com/MyPinstripes/status/1616489775
;2009-04-25 18:23;0;0;"Titans choose Kenny Britt wide receiver from Rutgers in 1st round of nfl draft.";;;;"1616489677";https://twitter.com/garymorgan/status/1616489677
;2009-04-25 18:23;0;0;"Hooray! Rutgers finally produces a first round draft pick! Congrats to kenny britt.";;;;"1616489143";https://twitter.com/rutgerskevin/status/1616489143
;2009-04-25 18:22;0;0;"@ nfl who is Kenny Britt and was he worth our Draft pick, LOL!";;@;;"1616485681";https://twitter.com/EbonyeDillard/status/1616485681
;2009-04-25 18:22;0;0;"Congrats to Kenny Britt! Good luck with the Titans!";;;;"1616483872";https://twitter.com/sunsetbeacon/status/1616483872
;2009-04-25 18:22;0;0;"RT @ HeraldSports: With the 30th pick Titans get Kenny Britt, WR, Rutgers.*** Hard to make a bad pick here.";;@;;"1616483870";https://twitter.com/akosnitzky/status/1616483870
;2009-04-25 18:22;0;0;"KENNY BRITT BITCH";;;;"1616482122";https://twitter.com/Funderburk/status/1616482122
;2009-04-25 18:22;0;0;"Titans at #30 take Rutgers WR Kenny Britt. Cards up next. Experts think they take Beanie Wells then cut Edgerrin James. Good players left.";;;#30;"1616481084";https://twitter.com/THEJohnCassio/status/1616481084
;2009-04-25 18:22;0;0;"Titans get Kenny Britt";;;;"1616481067";https://twitter.com/foxsports910/status/1616481067
;2009-04-25 18:22;0;0;"thinktrain: Titans take Rutgers WR Kenny Britt in the 1st round. Seems like a safe pick. I'd still love to trade for Anquan Boldin. # nfl ...";;;#;"1616481065";https://twitter.com/TitanFans/status/1616481065
;2009-04-25 18:22;0;0;"Ten Titans Select Kenny Britt (#30)";;;#30;"1616481018";https://twitter.com/SavageMcLaren/status/1616481018
;2009-04-25 18:22;0;0;"and Todd McShay is a douche. Kenny Britt had no problem at all sharing the ball with Underwood, Brown, Campbell. # nfldraft";;;#;"1616480691";https://twitter.com/robtraut/status/1616480691
;2009-04-25 18:22;0;0;"Excited about the Titans pick, Kenny Britt";;;;"1616480651";https://twitter.com/matt_sullivan/status/1616480651
;2009-04-25 18:21;0;0;"was holding out for Boldin, but is relieved that we finally got a decent receiver! Welcome Kenny Britt!";;;;"1616479503";https://twitter.com/Goldni/status/1616479503
;2009-04-25 18:21;0;0;"@ titanfans Titans take Rutgers WR Kenny Britt in the 1st round. Seems like a safe pick. I'd still love to trade for Anquan Boldin. # nfldraft";;@;#;"1616478593";https://twitter.com/robrobinson/status/1616478593
;2009-04-25 18:21;0;0;"Kenny britt!!";;;;"1616476992";https://twitter.com/Bdhair/status/1616476992
;2009-04-25 18:21;0;0;"The Titans go wide receiver with Kenny Britt from Rutgers. http://tinyurl.com/dfxkp2";;;;"1616476536";https://twitter.com/KevinGoodwin/status/1616476536
;2009-04-25 18:21;0;0;"Titans take Kenny Britt, WR from Rutgers. Two more to go...";;;;"1616476532";https://twitter.com/SSMiamiDolphins/status/1616476532
;2009-04-25 18:21;0;0;"Big shout to Kenny Britt of Rutgers University just picked 30th overall in the draft!!!!! RU RAH RAH!! Yes sir!!";;;;"1616476449";https://twitter.com/MissCeo_ICE/status/1616476449
;2009-04-25 18:21;0;0;"# chrisonNFLdraft :: The Titans surprise me by drafting a WR as well - Kenny Britt from Rutgers. Man, he was not on my 1st rnd radar.";;;#;"1616476106";https://twitter.com/chrismaka/status/1616476106
;2009-04-25 18:21;0;0;"My bad. Some how I got word Wells went to the Titans. But it was Kenny Britt, a quality pick. As for White, he's still on shaky ground.";;;;"1616475900";https://twitter.com/DonBanks/status/1616475900
;2009-04-25 18:21;0;0;"TITANS SELECT KENNY BRITT (WR) as 30th PICK OVERALL...";;;;"1616474723";https://twitter.com/iamdarkerblue/status/1616474723
;2009-04-25 18:21;0;0;"#30 Tennessee Titans- Kenny Britt, WR. Grade: C+";;;#30;"1616473826";https://twitter.com/Daryldraftdog/status/1616473826
;2009-04-25 18:21;0;0;"Kenny Britt to the Titans is another 'hmmm' moment in my book # nfl # nfldraft";;;# #;"1616473355";https://twitter.com/theskiver/status/1616473355
;2009-04-25 18:20;0;0;"Hopes Kenny Britt will get it done for the Titans!";;;;"1616472895";https://twitter.com/buhler13/status/1616472895
;2009-04-25 18:20;0;0;"Will settle for Hakim Nix but would rather of had Kenny Britt. Rutgers in the house!";;;;"1616472520";https://twitter.com/jeffswierk/status/1616472520
;2009-04-25 18:20;0;0;"Congrats Kenny Britt! RUTGERS GETS A FIRST ROUND DRAFT PICK!!";;;;"1616471023";https://twitter.com/tomwp/status/1616471023
;2009-04-25 18:20;0;0;"Congratulations to Rutgers (sorry, FORMER Rutgers) Wide Receiver Kenny Britt. The Titans got one hell of a receiver. # nfldraft";;;#;"1616470966";https://twitter.com/DanLevyThinks/status/1616470966
;2009-04-25 18:20;0;0;"@taliasunset damn you guys got my sleeper WR Kenny Britt! I was hoping he'd fall into the second round for my squad. Haha. Very good pick.";;@taliasunset;;"1616470428";https://twitter.com/jonskeeetskeeet/status/1616470428
;2009-04-25 18:20;0;0;"completely digs the Kenny Britt pick. # nfldraft";;;#;"1616470031";https://twitter.com/lucastypes/status/1616470031
;2009-04-25 18:20;0;0;"Congrats Kenny Britt! First ever 1st rounder from Rutgers. # nfldraft";;;#;"1616469750";https://twitter.com/robtraut/status/1616469750
;2009-04-25 18:20;0;0;"Titans get an excellent receiver in Kenny Britt...should help the invisible passing game in Tennessee";;;;"1616469678";https://twitter.com/robertocberrios/status/1616469678
;2009-04-25 18:20;0;0;"#30) Titans take Kenny Britt, WR, Rutgers. Big WR who can really be a threat in the redzon, may turn into a true #1 WR. Cards are up.";;;#30 #1;"1616469200";https://twitter.com/DraftGems/status/1616469200
;2009-04-25 18:20;0;0;"Rutgers WR Kenny Britt to TEN. Great pickup here. Britt has good size and decent speed and now they have a WR to help Kerry Collins.";;;;"1616469110";https://twitter.com/NFLRandR/status/1616469110
;2009-04-25 18:20;0;0;""With 30th pick in the 2009 NFL Draft, the Tennessee Titans select... KENNY BRITT, Wide Receiver - Rutgers."";;;;"1616469016";https://twitter.com/nickbarre/status/1616469016
;2009-04-25 18:20;0;0;"finally!!! KENNY BRITT BABY!!";;;;"1616468320";https://twitter.com/viveksurti/status/1616468320
;2009-04-25 18:20;0;0;"DRAFTALERT Round 1 30. Titans - Kenny Britt - WR, Rutgers";;;;"1616468249";https://twitter.com/WolfieMueller/status/1616468249
;2009-04-25 18:20;0;0;"kenny britt... nice pick. much better than crabtree! good pick";;;;"1616467752";https://twitter.com/JohnAndrade/status/1616467752
;2009-04-25 18:20;0;0;"27.IND Donald Brown RB - Conn. 28.BUF Eric Wood C-Louis..29NYG Hakeem Nicks WR - UNC. 30 TN Kenny Britt WR - Rutgers 31. AZ on the clock";;;;"1616467252";https://twitter.com/412sports/status/1616467252
;2009-04-25 18:20;0;0;"With #30 pick in NFL Draft, Titans select Kenny Britt (WR-Rutgers)";;;#30;"1616467251";https://twitter.com/WRCB/status/1616467251
;2009-04-25 18:20;0;0;"Titans pick kenny britt- WR but does that mean no Bolen from AZ? Hmm? I'm sure Fisher knows more than I do about thos ;-)";;;;"1616467241";https://twitter.com/SamBradleyTN/status/1616467241
;2009-04-25 18:20;0;0;"Titans select WR Kenny Britt - they seriously needed WR help - Titans '09 fantasy football players to own: Cj , Defense - NFL FOOTBALL";;;;"1616467041";https://twitter.com/MondayMorningQB/status/1616467041
;2009-04-25 18:20;0;0;"Titans take WR Kenny Britt from Rutgers. I still wonder if Big East quality translates to NFL quality. # nfldraft";;;#;"1616466941";https://twitter.com/quinnelk/status/1616466941
;2009-04-25 18:20;0;0;"Haha, under ESPN's listed weakness for Kenny Britt: inconsistent hands ... good luck with that Kerry and Vince # NFLDraft";;;#;"1616466646";https://twitter.com/detroitlions101/status/1616466646
;2009-04-25 18:20;0;0;"Tennessee Titans select Kenny Britt, WR, Rutgers with the 30th pick. # NFLDraft Arizona Cardinals next.";;;#;"1616466571";https://twitter.com/fbihop/status/1616466571
;2009-04-25 18:20;0;0;"Tennessee Titans select Kenny Britt. Great Pick. deceptively speedy & will stretch the field for a Titans offense that now can be explosive.";;;;"1616466436";https://twitter.com/rbeinstein/status/1616466436
;2009-04-25 18:19;0;0;"Kenny Britt? At least he's a WR.";;;;"1616466341";https://twitter.com/mattruskin1234/status/1616466341
;2009-04-25 18:19;0;0;"@ drscooter Kenny Britt";;@;;"1616465601";https://twitter.com/FSBigBob/status/1616465601
;2009-04-25 18:19;0;0;"Titans take Kenny Britt at 30. Awesome route runner and can run well. Early contributor that can make a difference for Tennessee.";;;;"1616465314";https://twitter.com/T_Pomps/status/1616465314
;2009-04-25 18:19;0;0;"TEN selects WR Kenny Britt. They slumped in the playoffs because of their inability to go downfield. This is a step up. # nfldraft";;;#;"1616464974";https://twitter.com/ffootball/status/1616464974
;2009-04-25 18:19;0;0;"30. Tennessee Titans: Kenny Britt/WR/Rutgers. Super hands and rangy, Britt will provide an immediate impact for a subpar Titans WR corps.";;;;"1616464854";https://twitter.com/draftresults/status/1616464854
;2009-04-25 18:19;0;0;"Congrats to my dude Kenny Britt getting drafted to the Titans. Love ya homie.";;;;"1616464648";https://twitter.com/april_rose/status/1616464648
;2009-04-25 18:19;0;0;"Titans take Rutgers WR Kenny Britt to help Kerry Collins and the offense";;;;"1616464579";https://twitter.com/FBProspector/status/1616464579
;2009-04-25 18:19;0;0;"Kenny Britt welcome to Nashvegas!!";;;;"1616464564";https://twitter.com/GarnerMGoode/status/1616464564
;2009-04-25 18:19;0;0;"There goes another WR. Titans grab Kenny Britt at No. 30. That's 6 wideouts in the 1st round. Do Robiskie and Massaquoi make it to #49?";;;#49;"1616464283";https://twitter.com/BradBiggs/status/1616464283
;2009-04-25 18:19;0;0;"Tennessee just picked Kenny Britt. Who the hell is Kenny Britt??? He better be worth it.";;;;"1616464260";https://twitter.com/EbonyeDillard/status/1616464260
;2009-04-25 18:19;0;0;"Tennessee listens to @ derrich...picks a WR. Kenny Britt. # NFLdraft =P";;@;#;"1616464201";https://twitter.com/Derrich/status/1616464201
;2009-04-25 18:19;0;0;"Titans take Kenny Britt, finally the Titans take a big wideout.";;;;"1616464121";https://twitter.com/BobbyBroad/status/1616464121
;2009-04-25 18:19;0;0;"No highly rated WR in the draft drops more passes than Kenny Britt. As a Jags fan, I'm glad to see him in Tennessee. # NFLDraft";;;#;"1616464078";https://twitter.com/legion/status/1616464078
;2009-04-25 18:19;0;0;"DRAFT: Kenny Britt goes to TN Titans.";;;;"1616463948";https://twitter.com/wigengine/status/1616463948
;2009-04-25 18:19;0;0;"If the Giants didn't want him, Titans will take Rutgers WR Kenny Britt, who was bigger, faster than Nicks # nfldraft";;;#;"1616463799";https://twitter.com/callerdotcom/status/1616463799
;2009-04-25 18:19;0;0;"Titans pick------Kenny Britt. Me likey. Compliments C J on the outside.";;;;"1616463290";https://twitter.com/amike77/status/1616463290
;2009-04-25 18:19;0;0;"30. Tennessee Titans- Kenny Britt WR- Rutgers";;;;"1616463159";https://twitter.com/LegendsPRNews/status/1616463159
;2009-04-25 18:19;0;0;"Tennessee Titans select Kenny Britt -Stewy http://tumblr.com/xv01nm7xw";;;;"1616462719";https://twitter.com/stewy23/status/1616462719
;2009-04-25 18:19;0;0;"Kenny Britt goes to the Titans. Somebody wake Vince Young. # nfldraft";;;#;"1616462654";https://twitter.com/docfunk/status/1616462654
;2009-04-25 18:19;0;0;"Noted Rutgerian Kenny Britt goes to Tennessee at No. 30. # Skins # NFL draft";;;# #;"1616462643";https://twitter.com/CindyBoren/status/1616462643
;2009-04-25 18:19;0;0;"I WAS WRONG. Its Kenny Britt and thats a great pick. Tennessee!";;;;"1616462585";https://twitter.com/KayoThaKomic/status/1616462585
;2009-04-25 18:19;0;0;"Titans pick: Kenny Britt... they needed a WR, but a lot of good players are going to be available in the second round.";;;;"1616462529";https://twitter.com/JaimelHemphill/status/1616462529
;2009-04-25 18:19;0;0;"KENNY BRITT. WHOOOO. MCBC.";;;;"1616462519";https://twitter.com/austinelso/status/1616462519
;2009-04-25 18:19;0;0;"Back on draft. Kenny Britt to the Titans.";;;;"1616462161";https://twitter.com/clrapp/status/1616462161
;2009-04-25 18:19;0;0;"#30 TEN kenny britt -- WOW, tennessee FINALLY DRAFTS A RECEIVER in the first round. It's about time. wonder what braylon & Q are thinkin";;;#30;"1616461936";https://twitter.com/EFSports/status/1616461936
;2009-04-25 18:19;0;0;"Kenny Britt: The latest in the Tyrone Calico collection? 50/50 shot.";;;;"1616461853";https://twitter.com/thegnc/status/1616461853
;2009-04-25 18:19;0;0;"@ Wcbs was hoping for kenny britt";;@;;"1616461791";https://twitter.com/JonathanLuke01/status/1616461791
;2009-04-25 18:19;0;0;"With the thirtieth pick in the 2009 NFL Draft, the Tennessee Titans select...Kenny Britt, WR, Rutgers";;;;"1616461750";https://twitter.com/pfwinprogress/status/1616461750
;2009-04-25 18:19;0;0;"PICK 1-30: TENNESSEE - Kenny Britt (WR, Rutgers). Thank you for not taking Robiskie # NFLDraft";;;#;"1616461748";https://twitter.com/legion/status/1616461748
;2009-04-25 18:19;0;0;"Titans have picked Kenny Britt at no30. # nfldraft";;;#;"1616461674";https://twitter.com/sim0nb/status/1616461674
;2009-04-25 18:19;0;0;"30Th Pick: Kenny Britt, WR Rutgers to Tennessee. Makes much more sense than Wells.";;;;"1616461540";https://twitter.com/flaxman/status/1616461540
;2009-04-25 18:19;0;0;"With the 30th pick in the 2009 NFL Draft, the Titans select Kenny Britt, WR from Rutgers (what the heck!)";;;;"1616461402";https://twitter.com/HoosierBD/status/1616461402
;2009-04-25 18:19;0;0;"Titans pick WR Kenny Britt from Rutgers in NFL draft";;;;"1616461313";https://twitter.com/JFTanner/status/1616461313
;2009-04-25 18:19;0;0;"Titans escolhem Kenny Britt (wide receiver)";;;;"1616461143";https://twitter.com/garotanfl/status/1616461143
;2009-04-25 18:19;0;0;"kenny britt wr to titians";;;;"1616461130";https://twitter.com/robthemany/status/1616461130
;2009-04-25 18:19;0;0;"Kenny Britt to Tennessee. Thank you. # draft";;;#;"1616461114";https://twitter.com/BrianPCombs/status/1616461114
;2009-04-25 18:19;0;0;"KENNY BRITT ON THE TITANS!!! RU RAH RAH :)";;;;"1616461015";https://twitter.com/jenna732/status/1616461015
;2009-04-25 18:19;0;0;"NFL Draft >> Pick #30 >> @ TitansNFL select Kenny Britt (WR) of Rutgers. # Titans # NFLdraft";;@;#30 # #;"1616460978";https://twitter.com/BR_Titans/status/1616460978
;2009-04-25 18:19;0;0;"The Titans select Kenny Britt, wide receiver from Rutgers with the 30th pick -- surprise there! New Jersey represent # NFLDraft";;;#;"1616460972";https://twitter.com/detroitlions101/status/1616460972
;2009-04-25 18:19;0;0;"Wooo! Kenny Britt, first-round to Tennessee!";;;;"1616460961";https://twitter.com/thereadingzone/status/1616460961
;2009-04-25 18:19;0;0;"Kenny Britt - Titans";;;;"1616460939";https://twitter.com/MylesQ919/status/1616460939
;2009-04-25 18:19;0;0;"Titans take Kenny Britt - first Scarlet Knight to ever be taken in the 1st round. Cardinals are on the clock.";;;;"1616460926";https://twitter.com/draftgreenroom/status/1616460926
